ID (Chronological),TYPE (Part + Person),ARGUMENT NUMBER,TEAM STANCE,RELATED ID,ARGUMENTAL RELATION  TYPE,RELATED ID.1,ARGUMENTAL RELATION  TYPE.1,RELATED ID.2,ARGUMENTAL RELATION  TYPE.2,ADU_CAT,ADU_ES,ADU_EN
174,ARG1,3,AGAINST,173,RA,136,MA,,,estaríem afectant  a la dignitat de la mare i a la del nen,estaríamos afectando a la dignidad de la madre y a la del niño,would be affecting at the mother's dignity and at the of the boy
175,ARG1,3,AGAINST,,,,,,,el fet de regular-ho aquí no comporta que  altres països no s'estiguin produint aquests   atemptats contra la dignitat de les persones implicades,el hecho de regularlo aquí no comporta que otros países no se estén produciendo estos atentados contra la dignidad de las personas implicadas,the fact to regulate it here does not comport that other countries are not  producing these attempts against the dignity of the persons implied
176,ARG1,3,FAVOUR,,,,,,,no registre dels nens va en contra  de la seva dignitat i del seu dret a la identitat estan vostès  proposant que no es registrin   ,no registro de los niños va en contra de su dignidad y de su derecho a la identidad están ustedes proponiendo que no se registren,do not register of the boys goes against of his dignity and of his law to the identity are you proposing that they do not register
177,ARG1,3,AGAINST,176,CA,,,,,en cap moment estem dient la realitat actual,en ningún momento estamos diciendo la realidad actual,at any moment are saying the ongoing reality
178,ARG1,3,AGAINST,167;168;169,MA,,,,,l'únic que a més el nen tindrà una nacionalitat en tant  que ucrania ,el único que además el niño tendrá una nacionalidad en cuanto que ucrania,the only that besides the boy will a nationality at so much that ucrania
179,ARG1,3,AGAINST,178,RA,,,,,podria estar la nacionalitat però  ucrania i no espanya,podría estar la nacionalidad pero ucrania y no espanya,could be the nationality but ucrania and no espanya
180,ARG1,3,AGAINST,58;59;62;134;136,RA,,,,,el nen actualment  és l'objecte del contracte i  no  es pot regular,el niño actualmente es el objeto del contrato y no se puede regular,the boy at present is the object of the agreement and can not  regulate
181,ARG1,3,AGAINST,180,RA,,,,,perquè és  la seva essència el contracte,porque es su esencia lo contrate,so that it is his essence the agreement
182,ARG1,2;3,AGAINST,58;59;62;134;136;139;141;174;180;181,RA,,,,,el contracte afectarà contra seva dignitat,el contrato afectará contra suya dignidad,the agreement will affect his con dignity
183,ARG1,2;3,AGAINST,82,CA,,,,,serà el menys protegit,será lo menos protegido,will be the less protected
184,ARG1,2;3,AGAINST,183,RA,82,CA,,,serà tractat com objecte i serà efecte de control ,será tratado como objeto y será efecto de control,will be treated like object and will be effect of control
185,ARG1,2;3,AGAINST,,,,,,,una família no ha acceptat un  nen que té síndrome de down ,una familia no ha aceptado un niño que tiene síndrome de down,a family has not accepted a boy that has syndrome of down
186,ARG1,2;3,AGAINST,185,RA,,,,,està sent qualificat ,está siendo calificado,is being qualified
187,ARG1,2;3,AGAINST,43;53;54;84;46;59;62;70,RA,,,,,la dona serà tractada com objecte perquè la dona serà utilitzada  com a ventre i no com a persona,la mujer será tratada como objeto porque la mujer será utilizada como vientre y no como persona,the wife will be treated like object so that the wife will be utilised as a belly and no as a person
188,ARG1,2;3,AGAINST,43;53;54;63,RA,,,,,com a ventre de lloguer estarà  esclavitzada,como vientre de alquiler estará esclavizada,as a belly for hire will be enslaved
189,ARG1,2;3,AGAINST,58;59;62;134;136;180;181,RA,,,,,no tindrà la possibilitat de sortir d'aquest contracte  en tant que la dona no pot rebutjar aquest fet,no tendrá la posibilidad de salir de este contrato en cuanto que la mujer no puede rechazar este hecho,will not the possibility to exit of this agreement at so much that the wife can not rebuff this fact
190,ARG1,2;3,AGAINST,189,RA,,,,,en el cas  que ho faci posaria  en risc a la mare i el nadó,en el supuesto de que lo haga pondría en riesgo a la madre y el bebé,at the case that make it would pose at risk at the mother and the baby
191,ARG1,2;3,AGAINST,46;47;59;61;62;70;137;144;145;146;147;148;149;161;162;163,RA,165,MA,,,no podem introduir aquest cavall de troia que ens introdueixi  les màfies  unes coaccions cap als pares o certes  amenaces,no podemos introducir este caballo de troia que nos introduzca las mafias unas coacciones hacia los padres o ciertas amenaces,can not introduce this horse of troia that introduce us the mafias some coercions to the parents or some threats
192,ARG2,1;2;3,FAVOUR,176,RA,,,,,són exemples d'una mala legislació,son ejemplos de una mala legislación,are examples of a bad legislation
193,ARG2,1,FAVOUR,77;85;86;79;80;81;88;103,RA,50;61,MA,,,hi ha una objectivització i una mercantilització de  la dona i del nen,hay una objectivització y una mercantilización de la mujer y del niño,there is an objectivització and a mercantilització of the wife and of the boy
194,ARG2,1;3,FAVOUR,87;125;126,RA,134,CA,,,això succeeix quan  s'està legislant que no sigui altruista que sigui comercial,esto sucede cuando se está legislando que no sea altruista que sea comercial,this succeeix when it is legislating  that it was not altruistic that it was trading
195,ARG2,1;3,FAVOUR,,,,,,,que no s'estigui respectant la llibertat de la dona,que no se esté respetando la libertad de la mujer,that it was not  respecting the liberty of the wife
196,ARG2,1;3,FAVOUR,23;24;25;26;27;87;125;126;194,RA,,,,,estem presentant amb el nostre tercer argument un model com  pot ser el d'islàndia on és completament altruista,estamos presentando con nuestro tercer argumento un modelo como puede ser el de islàndia dónde es completamente altruista,are presenting with our third argument a model like can be the of islàndia where is entirely altruistic
197,ARG2,1;3,FAVOUR,196,RA,,,,,l'està  oferint la sanitat pública,lo está ofreciendo la sanidad pública,is offering it the public health
198,ARG2,1;3,FAVOUR,195,RA,,,,,la llibertat de la dona gestant està completament  protegida,la libertad de la mujer gestante está completamente protegida,the liberty of the wife gestant is entirely protected
199,ARG2,1;3,FAVOUR,195;198,RA,,,,,la dona gestant durant tot el procés  pot decidir si avortar o no quines mesures prendre i com pot  tractar la seva pròpia vida durant tot el procés de gestament,la mujer gestante durante todo el proceso puede decidir si abortar o no qué medidas tomar y como puede tratar su propia vida durante todo el proceso de gestament,the wife gestant during all the process can decide if abort or no which sizes take and how can treat his own life during all the process of gestament
200,ARG2,1;3,FAVOUR,79;80;81;82;85;86;103,RA,61,MA,,,aquests atacs contra la dignitat  del nen i de la dona només s'estan donant quan se'ls està  marcantalitzant,estos ataques contra la dignidad del niño y de la mujer solo se están dando cuando se los está marcantalitzant,these attacks against the dignity of the boy and of the wife only are  giving when it is the ones marcantalitzant
201,ARG2,1;3,FAVOUR,87;125;126;194,RA,,,,,defensem un model altruista que existeix,defendemos un modelo altruista que existe,defend an altruistic model that exists
202,ARG2,1;3,FAVOUR,201,RA,,,,,un model que existeix al canadà  o bèlgica holanda o sud-àfrica,un modelo que existe al canadà o bèlgica holanda o sur-àfrica,a model that exists at the canadà or bèlgica holanda or south-àfrica
203,ARG2,1,FAVOUR,97;98;99;118,RA,,,,,el problema de l'oferta,el problema de la ofrecida,the problem of the offer
204,ARG2,1,FAVOUR,203,MA,,,,,aquest problema de l'oferta existeix,este problema de la oferta existe,this problem of the offer exists
205,ARG2,1,FAVOUR,203;204,RA,,,,,però països com el regne unit això va ser el que va succeir com que no hi havia oferta hi havia un turisme reproductiu que hi anava fins uns altres països,pero países como el reino unido esto fue el que sucedió como que no había ofrecida había un turismo reproductivo que iba hasta otros países,but countries like the realm united this was what futile succeir as it had not offered  there was a reproductive tourism that went  until other countries
206,ARG2,1;3,FAVOUR,97;98;99;118;203;204,RA,,,,,islàndia abans de legislar-ho ho va analitzar,islàndia antes de legislarlo lo analizó,islàndia before legislating it analysed it
207,ARG2,1;3,FAVOUR,97;98;99;118;203;204,RA,,,,,per què succeeix això per què falta aquesta oferta,por qué sucede esto por qué falta esta ofrecida,how come succeeix this how come fault this offer
208,ARG2,1;3,FAVOUR,134,CA,,,,,no era  pel fet que fos altruista,no era por el hecho que fuera altruista,was not for the fact that was altruistic
209,ARG2,1;3,FAVOUR,208;197,RA,,,,,sinó perquè el sistema sanitari de garanties legals  no era suficient per les mares gestants,sino porque el sistema sanitario de garantías legales no era suficiente por las madres gestantes,but so that the sanitary system of legal guarantees was not sufficient for the mothers gestants
210,ARG2,3,FAVOUR,206,RA,,,,,nosaltres a espanya  la situació que estem analitzant sí que tenim els mitjans,nosotros a espanya la situación que estamos analizando sí que tenemos los medianos,we at espanya the situation that are analysing aye that have the modes
211,ARG2,3,FAVOUR,197;209,RA,,,,,tenim el millor sistema sanitari d'europa i  el tercer millor sistema sanitari del món,tenemos el mejor sistema sanitario de europa y lo tercero mejor sistema sanitario del mundo,have the best sanitary system of europa and the third better sanitary system in the world
212,ARG2,3,FAVOUR,79;80;81;82;103,RA,,,,,tenim un sistema legal  que està protegint l'interés del menor per sobre de totes  les coses,tenemos un sistema legal que está protegiendo el interés del menor por encima de todas las cosas,have a legal system that is protecting the interest of the minor above all the things
213,ARG2,3,FAVOUR,20;24;113;117;142,RA,,,,,la dignitat de la dona és un dret  fonamental de la nostra constitució,la dignidad de la mujer es un derecho fundamental de nuestra constitución,the dignity of the wife is a fundamental law of our constitution
214,ARG2,3,AGAINST,,,,,,,quina opinió li mereix que després de la crisi econòmica  forta que ha passat d'espanya des del dos mil vuit donaria  un context que precisament reduiria els casos d'altruisme  i sense les contraprestacions econòmiques,qué opinión le merece que después de la crisis económica fuerte que ha pasado de espanya desde el dos mil ocho daría un contexto que precisamente reduciría los casos de altruismo y sin las contraprestaciones económicas,which opinion merits him that after the strong economic crisis that has passed of espanya since the two thousand eight would give a context that precisely would reduce the cases of altruism and without the contraprestacions economic
215,ARG2,3,FAVOUR,,,,,,,després de la crisi econòmica  amb un reflotament de les garanties no econòmiques,después de la crisis económica con un reflote de las garantías no económicas,after the economic crisis with a reflotament of the no economic guarantees
216,ARG2,3,FAVOUR,201;215,RA,,,,,no és una comercialització,no es una comercialización,is not a commercialization
217,ARG2,3,FAVOUR,216,MA,201;215,RA,,,és completament altruista,es completamente altruista,is entirely altruistic
218,ARG2,3,FAVOUR,215,RA,,,,,la crisi el que podria succeir és que es creés  un mercat on s'estigués explotant la dona pagar-li menys,la crisis el que podría suceder es que se creara un mercado donde se estuviera explotando la mujer pagarle menos,the crisis what could succeir is that it created  a market where was exploding  the wife pay him less
219,ARG2,3,FAVOUR,,,,,,,però  nosaltres no estem parlant que se li pagui,pero nosotros no estamos hablando que se le pague,but we are not talking that it pay him
220,ARG2,3,FAVOUR,219,RA,,,,,estem parlant que sigui completament altruista,estamos hablando que sea completamente altruista,are talking that it was entirely altruistic
221,ARG2,3,FAVOUR,201;215;218,RA,,,,,la crisi afectaria si això es tractés com un mercat  laboral,la crisis afectaría si esto se tratara como un mercado laboral,the crisis would affect if this treated  like a labour market
222,ARG2,3,FAVOUR,216,MA,201;215,RA,,,però no és un contracte de serveis no és un treball,pero no es un contrato de servicios no es un trabajo,but is not an agreement of kicks is not a work
223,ARG2,3,FAVOUR,201;202;206,RA,,,,,és una col·laboració per un mateix fi  com es va legislar a islàndia sud-àfrica o el canadà ,es una colaboración por un mismo fin como se legisló a islàndia sur-àfrica o el canadà,is a collaboration for a same end like legislated  at islàndia south-àfrica or the canadà
224,ARG2,3,FAVOUR,201;202;223,RA,,,,,països  on s'ha provat que la gratuïtat és real,países donde se ha probado que la gratuidad es real,countries where has proved  that the gratuitousness is real
225,ARG2,3,FAVOUR,27;33;79;80;81;82;85;86;100;101;102;103,RA,,,,,ho va dir la comissió  de drets fonamentals contra la droga i el delicte de les nacions unides  quan tens un problema d'aquest caire la solució contra les màfies no és prohibir-ho,lo dijo la comisión de derechos fundamentales contra la droga y el delito de las naciones unidas cuando tenso un problema de este cariz la solución contra las mafias no es prohibirlo,said it the commission of fundamental laws against the drug and the crime of the nations united when have a problem of this look the solution against the mafias is not to prohibit it
226,ARG2,2;3,FAVOUR,225,RA,,,,,les màfies podran  existir s'hagi legislat o no s'hagi legislat,las mafias podrán existir se haya legislado o no se haya legislado,the mafias will be able to exist have legislated  or have not legislated
227,ARG2,2;3,FAVOUR,15;19;79;80;81;82;85;86;103;225;226,RA,,,,,els instruments  contra les màfies són més control prevenció i molta més  culpa,los instrumentos contra las mafias son más control prevención y mucha más culpa,the instruments against the mafias are more control prevention and a lot of more fault
228,ARG2,2;3,FAVOUR,17;20;24;113;117;142,RA,,,,,garantiment  de tots els drets que se'ls estiguin donant aquestes dones,garantiment de todos los derechos que se los estén dando estas mujeres,garantiment of all the laws that are the ones giving these wives
229,ARG2,2;3,FAVOUR,17;21;30;34;81;99;113;117;125;143;201;202;203;204;205;206;207;208;209;228,RA,155;158;159,CA,,,garantiment d'aquests drets mitjançant  un sistema públic com es fa a islàndia,garantiment de estos derechos mediante un sistema público como se hace a islàndia,garantiment of these laws by means of a public system like makes  at islàndia
230,ARG2,3,FAVOUR,209;210;211,RA,,,,,la sanitat pública  és la que ofereix aquest servei,la sanidad pública es la que ofrece este servicio,the public health is what offers this kick
231,ARG2,2;3,FAVOUR,202,RA,,,,,a sud-àfrica totes les empreses de mediació  publicitat o intermediació entre els pares i les mares gestants  estan completament prohibides,a sur-àfrica todas las empresas de mediación publicitado o intermediación entre los padres y las madres gestantes están completamente prohibidas,at south-àfrica all the companies of mediation publicised or intermediation among the parents and the mothers gestants are entirely prohibited
232,ARG2,2;3,FAVOUR,231,RA,,,,,aquestes  empreses al final el que feia era promoure unes màfies i promoure  un altruisme que no era real,estas empresas al final el que hacía era promover unas mafias y promover un altruismo que no era real,these companies at the end what made was to promote some mafias and promote an altruism that was not real
233,ARG2,2;3,FAVOUR,232,CA,,,,,en canvi si ho estàs controlant  des de la part de l'estat i des de la part garantista pots  fer com a islàndia com pot ser holanda com pot ser canadà  com pot ser ara sud-àfrica que s'ha regulat adequadament,en cambio si lo estás controlando desde la parte del estado y desde la parte garantista puedes hacer como islàndia como puede ser holanda como puede ser canadà como puede ser ahora sur-àfrica que se ha regulado adecuadamente,instead if you are controlling it since the part of the state and since the part garantista can make as a islàndia how can be holanda how can be canadà how can be now south-àfrica that it has regulated  suitably
234,ARG2,2;3,FAVOUR,233,RA,,,,,que  no existeixi,que no exista,that it do not exist
235,ARG2,2;3,AGAINST,,,,,,,creu que el mateix context d'espanya ocorria a sud-àfrica,cree que el mismo contexto de espanya ocurría a sur-àfrica,thinks that the same context of espanya occurred at south-àfrica
236,ARG2,2;3,FAVOUR,,,,,,,el context de mercat i de màfies i de  falta d'altruisme pot succeir a qualsevol de tots els estats,el contexto de mercado y de mafias y de falta de altruismo puede suceder a cualquier de todos los estados,the context of market and of mafias and of fault of altruism can succeir at any one of all the states
237,ARG2,2;3,FAVOUR,236,RA,,,,,les solucions són més garanties,las soluciones son más garantizabas,the solutions are more guarantees
238,ARG2,2;3,FAVOUR,237,MA,,,,,les solucions són  més control,las soluciones son más control,the solutions are more control
239,ARG2,1;2;3,FAVOUR,20;21,MA,,,,,el rol dels estats és garantir la dignitat de les persones,el rol de los estados es garantizar la dignidad de las personas,the rol of the states is to guarantee the dignity of the persons
240,ARG2,1;2;3,FAVOUR,239,RA,,,,,l'objectiu és el mateix,el objetivo es el mismo,the aim is the same
241,ARG2,1;2;3,FAVOUR,,,,,,,el context és diferent,el contexto es diferente,the context is distinct
242,ARG2,1;2;3,FAVOUR,241,RA,,,,,però aleshores  es farà una legislació adequada a cada context,pero entonces se hará una legislación adecuada a cada contexto,but then will make  a suitable legislation at each context
243,ARG2,1;2;3,FAVOUR,27;33;100;101;102,RA,,,,,la prohibició  és impossible,la prohibición es imposible,the ban is impossible
244,ARG2,1;2;3,FAVOUR,79;80;81;82;103;183,RA,,,,,sempre s'estarà mirant l'interés  del menor,siempre se estará mirando el interés del menor,always will be  looking the interest of the minor
245,ARG2,2,FAVOUR,244,MA,,,,,l'interès del menor és el dret que més  s'ha de protegir,el interés del menor es el derecho que más se tiene que proteger,the interest of the minor is the law that more has to  protect
246,ARG2,2,FAVOUR,10;28;90;104;176,RA,169,CA,,,aquest menor sempre se'l registrarà com va  dir el tribunal europeu de drets humans que vincula tots els  jutges i tots els registres,este menor siempre se lo registrará como dijo el tribunal europeo de derechos humanos que vincula todos los jueces y todos los registres,this minor always will register it how said the European tribunal of human laws that links all the judges and all the registries
247,ARG2,2,FAVOUR,21;30;228,MA,,,,,un procés garantista,un proceso garantista,a process garantista
248,ARG2,2,FAVOUR,198,RA,43;53;54;63;195,CA,,,respectant  la llibertat de la dona,respetando la libertad de la mujer,respecting the liberty of the wife
249,ARG2,2,FAVOUR,199,MA,,,,,pugui decidir sobre tot el procés gestant,pueda decidir sobre todo el proceso gestante,can decide on all the process gestant
250,ARG2,2;3,FAVOUR,196,RA,,,,,respectant la dignitat de la dona amb un procés on la sanitat  i la legalitat estaran al seu favor,respetando la dignidad de la mujer con un proceso donde la sanidad y la legalidad estarán a su favor,respecting the dignity of the wife with a process where the health and the legality will be at his favour
251,ARG2,2;3,FAVOUR,79;80;81;82;85;86;103,RA,,,,,a favor d'ella i del nen,a favor de ella y del niño,in favour of her and of the boy
252,ARG2,2;3,FAVOUR,4;17;20;24;30;34;87;96;113;117;142,RA,,,,,si legalitzem  estem garantint els drets de tothom,si legalizamos estamos garantizando los derechos de todo el mundo,if we legalise are guaranteeing the laws of everybody
253,ARG2,3,AGAINST,236;237;238;239;240;241;242,CA,,,,,no estem parlant  que la problemàtica es troba en el context,no estamos hablando que la problemática se encuentra en el contexto,are not talking that the problematic finds  at the context
254,ARG2,3,AGAINST,58;59;62;134;136;180;181;182;189,RA,,,,,sinó en el propi  fet del contracte,sino en el propio hecho del contrato,but at the own fact of the agreement
255,ARG2,3,AGAINST,253,RA,,,,,es limitaria en tots aquests contextos,se limitaría en todos estos contextos,would limit  at all these contexts
256,ARG2,3,AGAINST,,,,,,,en realitat no hi hauria una limitació eficaç,en realidad no habría una limitación eficaz,in reality there would not be an effective limitation
257,ARG2,3,AGAINST,52;67;72;150;156;171;172;173,RA,,,,,exili reproductiu succeeix una mica com passa amb la immigració,exilio reproductivo sucede un poco como pasa con la inmigración,reproductive exile succeeix a bit how passes with the immigration
258,ARG2,3,AGAINST,257,RA,,,,,a l'obrir fronteres  el que estem permetent és un efecte trucada,a la abrir fronteras el que estamos permitiendo es un efecto trucada,at the open borders what are permitting is an effect called
259,ARG2,3,AGAINST,258,RA,,,,,és el que precisament fa que hi entri tanta gent que no puguem regular-ho,es el que precisamente hace que entre tanta gente que no podamos regularlo,is what precisely makes that it enter  so much persons that can not regulate it
260,ARG2,3,AGAINST,257,RA,,,,,per tant conseqüència se'n van fora del país,por lo tanto consecuencia se van fuera del país,therefore consequence go  out of the country
261,ARG2,3,AGAINST,253,RA,,,,,a espanya hi ha un context completament diferent al  que pot haver-hi per exemple islàndia,a espanya hay un contexto completamente diferente al que puede haber por ejemplo islàndia,at espanya there is an entirely distinct context at the that can have for example islàndia
262,ARG2,3,AGAINST,,,,,,,islàndia  no té els mateixos recursos que hi ha espanya,islàndia no tiene los mismos recursos que hay espanya,islàndia does not have the same resources that there is espanya
263,ARG2,3,FAVOUR,4;6;7;8;9;10;11;12;13;14;15;17;24;28;30;34;87;96;29;90;97;98;99;104;118;176;203;204;205,RA,,,,,quina opinió li mereix que quan a holanda es va legalitzar  amb totes les mesures que hem dit es va acabar el turisme reproductiu  perquè l'oferta i la demanda s'igualava perquè hi havia tots els mitjans,qué opinión le merece que cuando a holanda se legalizó con todas las medidas que hemos dicho se acabó el turismo reproductivo porque la oferta y la demanda se igualaba porque había todos los medianos,which opinion merits him that when at holanda legalised  with all the sizes that have said ended  the reproductive tourism so that the offer and the demand equalised  so that there was all the modes
264,ARG2,3,AGAINST,263,CA,,,,, no s'igualaren l'oferta i la demanda,no se igualaron la oferta y la demanda,did not equalise  the offer and the demand
265,ARG2,3,AGAINST,214,RA,,,,,a espanya hi ha hagut una crisi econòmica  ha sigut molt forta ,a espanya ha habido una crisis económica ha sido muy fuerte,at espanya there has been an economic crisis has been very strong
266,ARG2,3,AGAINST,265,RA,,,,,hi ha atur,hay paro,there is unemployment
267,ARG2,3,AGAINST,265;266,RA,,,,,ni tan sols hem solucionat aquesta situació econòmica,ni siquiera hemos solucionado esta situación económica,not even have solved this economic situation
268,ARG2,3,AGAINST,,,,,,,la quantitat de demandes altruistes  no entrarien en contradicció amb totes les persones  que volen treure una contraprestació d'això,la cantidad de demandas altruistas no entrarían en contradicción con todas las personas que quieren sacar una contraprestación de esto,the quantity of altruistic demands would not enter at contradiction with all the persons that want to remove a contraprestació thereof
269,ARG2,3,AGAINST,87;125;126;194;201;208,CA,134,RA,,,no hi hauria tant d'altruisme per tant hi hauria  més contraprestacions,no habría tanto de altruismo por lo tanto habría más contraprestaciones,there would not be so much of altruism therefore there would be more contraprestacions
270,ARG2,3,AGAINST,46;47;59;61;62;70;137;144;145;146;147;148;149;161;162;163;165,RA,,,,,seria molt més fàcil passar en negre  una remuneració pel servei  de la gestació subrogada,sería mucho más fácil pasar en negro una remuneración por el servicio de la gestación subrogada,would be much easier to pass at black a remuneration for the kick of the surrogacy
271,ARG2,3,AGAINST,58,RA,,,,,al legislar-ho  no hi hauria tanta oferta,al legislarlo no habría tanta ofrecida,at the legislate it there would not be so much offer
272,ARG2,3,AGAINST,271,RA,,,,,quan hi ha  molta molta demanda i no hi ha suficient oferta han de  buscar altres llocs on sí li donin aquesta oferta,cuando hay mucha mucha demanda y no hay suficiente oferta tienen que buscar otros lugares donde sí le den esta ofrecida,when there is a lot of a lot of demand and there is not sufficient offer have to seek other places where aye give him this offer
273,ARG2,3,AGAINST,,,,,,,fora del nostre àmbit,fuera de nuestro ámbito,out of our field
274,ARG2,3,AGAINST,273,MA,,,,,fora de la nostra jurisdicció,fuera de nuestra jurisdicción,out of our jurisdiction
275,ARG2,3,AGAINST,272;273;274,RA,,,,, se'n van  ja a l'àmbit internacional,se van ya al ámbito internacional,go  already at the international field
276,ARG2,3,AGAINST,,,,,,,arreglar el problema,arreglar el problema,arrange the problem
