ID (Chronological),TYPE (Part + Person),ARGUMENT NUMBER,TEAM STANCE,RELATED ID,ARGUMENTAL RELATION  TYPE,RELATED ID.1,ARGUMENTAL RELATION  TYPE.1,ADU_CAT,ADU_ES,ADU_EN
177,ARG2,1,FAVOUR,73;96;131,CA,,,com ens poden provar que l'altruisme no existeix si s'ha aprovat a països com islàndia sud-àfrica canadà holanda o bèlgica on no hi ha ni tan sols mercat negre,como nos pueden probar que el altruismo no existe si se ha aprobado en países como islàndia sur-àfrica canadà holanda o bèlgica donde no hay ni siquiera mercado negro,how can us prove that the altruism does not exist if it has approved  at countries how islàndia south-àfrica canadà holanda or bèlgica where there is not not even black market
178,ARG2,1,AGAINST,177,CA,73;96,RA,que s'haja aprovat en altres països no significa que existeixe i que siga una realitat suficientment potent como per legalitzar-lo,que se haya aprobado en otros países no significa que existeixe y que sea una realidad suficientemente potente como para legalizarlo,that have approved  at other countries does not mean that existeixe and that it was a sufficiently powerful reality como to legalise it
179,ARG2,1,AGAINST,,,,,ja que l'altre equip li agrada tant parlar de coses que estan legalitzades en altres països i ací no  n'hi han països en què apedregar a dones pel simple fet de ser infidels és legal,puesto que el otro equipo le gusta tanto hablar de cosas que están legalizadas en otros países y aquí no han países en qué apedrear a mujeres por el simple hecho de ser infieles es legal,since the other squad likes him so much talk of things that are legalised at other countries and here no have  countries at what stone at wives for the simple fact of being infidels is legal
180,ARG2,1,AGAINST,179,RA,,,hauríem de legalitzar-lo ací també,tendríamos que legalizarlo aquí también,would have to legalise it here also
181,ARG2,1,AGAINST,,,,,a espanya el maltractament cap a les dones és una realitat de facto,a espanya el maltrato hacia las mujeres es una realidad de facto,at espanya the maltreatment to the wives is a reality of facto
182,ARG2,3,AGAINST,179;180;181,RA,,,la legalitzem també fem lleis també en aquesta direcció,la legalizamos también hacemos leyes también en esta dirección,legalise it also make laws also at this address
183,ARG2,1,AGAINST,,,,,contra la discriminació de les dones hi ha una legislació que es pot canviar i que pot ser real,contra la discriminación de las mujeres hay una legislación que se puede cambiar y que puede ser real,against the discrimination of the wives there is a legislation that can capsize  and that can be real
184,ARG2,1,AGAINST,,,,,en canvi contra la maternitat subrogada donat que s'ha de protegir l'interés del menor com ho fem per prohibir-ho que sigui eficaç,en cambio contra la maternidad subrogada dado que se tiene que proteger el interés del menor como lo hagamos para prohibirlo que sea eficaz,instead against the surrogacy given that has to protect  the interest of the minor how make it to prohibit it that it was effective
185,ARG2,3,AGAINST,183;184,RA,,,en espanya existeix una una legislació per a protegir les dones i una legislació per a protegir a les dones és per exemple que el fet de la gestació subrogada estiga il·legalitzada,en espanya existe una una legislación para proteger las mujeres y una legislación para proteger a las mujeres es por ejemplo que el hecho de la gestación subrogada esté ilegalizada,at espanya exists one a legislation to protect the wives and a legislation to protect at the wives is for example that the fact of the surrogacy was outlawed
186,ARG2,1,AGAINST,,,,,l'avortament és una cosa que afegix drets a les dones no li lleva,el aborto es una cosa que añade derechos a las mujeres no le quita,the abortion is a thing that appends laws to the wives does not remove him
187,ARG2,3,AGAINST,6;7;103;106,MA,,,ser pare o mare és un desig i no un dret ,ser padre o madre es un deseo y no un derecho,be father or mother is a wish and no a law
188,ARG2,1,FAVOUR,165;166,RA,,,aleshores com podem provar que legalitzant aquestes garanties que diuen que amb l'avortament s'estan donant també es donarien a la maternitat subrogada,entonces como podemos probar que legalizando estas garantías que dicen que con el aborto se están dando también se darían a la maternidad subrogada,then how can prove that legalising these guarantees that say that with the abortion are giving  also would give  at the surrogacy
189,ARG2,1,AGAINST,,,,,si l'altre equip el que vol és obrir un altre meló en el que les dones siguem explotades maltractades i tractades com a simple objectes de producció perfecte,si el otro equipo el que quiere es abrir otro melón en el que las mujeres seamos explotadas maltratadas y tratadas como simple objetos de producción perfecto,if the other squad what wants to is to open another melon at what the wives are exploded abused and treated as a simple objects of perfect production
190,ARG2,1,AGAINST,188;189,CA,,,però el nostre equip diu una altra vegada que no s'hauria de legalitzar la gestació subrogada de cap manera i sí que aboga per garantir els drets de les dones,pero nuestro equipo dice otra vez que no se tendría que legalizar la gestación subrogada de ninguna forma y sí que aboga para garantizar los derechos de las mujeres,but our squad says again that it would not have to  legalise the surrogacy by no means and aye that aboga to guarantee the laws of the wives
191,ARG2,2,FAVOUR,,,,,referiu que s'exploti a altres països o que és garantits i a dins d'espanya ,referís que se explote en otros países o que es garantizados y adentro de espanya,refer that it explode  at other countries or that it is guaranteed and in espanya
192,ARG2,1;2,AGAINST,,,,,no podem regular el que passa altres països i de fet si deneguen l'entrada als xiquets sí que estem confrontant els drets humans,no podemos regular el que pasa otros países y de hecho si deniegan la entrada a los niños sí que estamos confrontando los derechos humanos,can not regulate what passes other countries and in fact if deneguen the entry at the children aye that we are confrontant the human laws
193,ARG2,3,AGAINST,179;180,RA,,,tot el que estiga legalitzat en altres països s'ha de legalitzar a espanya anem a legalitzar que apedreguen a les dones pel simple fet de de ser infidels,todo el que esté legalizado en otros países se tiene que legalizar a espanya vayamos a legalizar que apedreen a las mujeres por el simple hecho de de ser infieles,everything what was legalised at other countries has to legalise  at espanya go at legalising that they stone at the wives for the simple fact of of being infidels
194,ARG2,1;3,AGAINST,80;94;96;97;175,RA,,,l'altre equip vol con l'altruisme és colar-nos el caballo de troya perquè les dones siguen explotades siguen utilitzades com a simples fàbriques,el otro equipo quiere cono el altruismo es colarnos lo caballo de troya porque las mujeres sean explotadas sean utilizadas como simples fábricas,the other squad wants to cone the altruism is colar-nos it caballo of troya so that the wives are exploded are utilised as a simple factories
195,ARG2,2,AGAINST,17;18;22;23;24;25;85;86;87,RA,,,la lliure elecció,la libre elección,the free election
196,ARG2,2,AGAINST,17;18;22;23;24;25;85;86;87;195,RA,86;87,MA,una dona no és lliure de triar si ser mare gestant o no,una mujer no es libre de elegir si ser madre gestante o no,a wife is not free to elect if be mother gestant or no
197,ARG2,2,AGAINST,17;18;22;23;24;25;85;86;87;195;196,RA,86;87,MA,ja que el que han de triar és si donar de menjar als seus fills o ser mares gestants,puesto que el que tienen que elegir es si dar de comer a sus hijos o ser madres gestantes,since what have to elect is if give to eat at his children or be mothers gestants
198,ARG2,2,AGAINST,,,,,també diem que una dona no pot ser lliure i no pot comportar afegir drets a una dona el fet de que es retalle la seua llibertat,también decimos que una mujer no puede ser libre y no puede comportar añadir derechos a una mujer el hecho de que se recorte su libertad,also say that a wife can not be free and can not comport append laws to a wife the fact of that it trim  his liberty
199,ARG2,2,AGAINST,198,RA,,,en el moment en el que es plasmen una sèrie de punts en un contracte que limita certes coses com l'avortament no pot ser llibertat,en el momento en el que se plasman una serie de puntos en un contrato que limita ciertas cosas como el aborto no puede ser libertado,at the moment at what reflect  a dotted series at an agreement that limits some things like the abortion can not be liberty
200,ARG2,1,AGAINST,192,RA,,,els drets del xiquets,los derechos del niños,the laws of the children
201,ARG2,1,AGAINST,200,RA,,,es crea un vincle emocional,se crea un vínculo emocional,creates  an emotional tie
202,ARG2,1,AGAINST,201,RA,,,no li interessa parlar d'emocions i de sentiments perquè saben que astó perjudica moltíssim a les dones i els fills,no le interesa hablar de emociones y de sentimientos porque saben que astó perjudica muchísimo a las mujeres y los hijos,does not interest him talk of emotions and of sentiments so that they know that astó prejudices very a lot of at the wives and the children
203,ARG2,1;2,FAVOUR,,,,,legislació com a sud-àfrica on la mare gestant pot decidir avortar si està en risc hi ha algun problema no seria adequada per solucionar el seu problema,legislación como sur-àfrica donde la madre gestante puede decidir abortar si está en riesgo hay algún problema no sería adecuada para solucionar su problema,legislation as a south-àfrica where the mother gestant can decide abort if it is at risk there is some problem would not be adapted to solve his problem
204,ARG2,1,AGAINST,198;199,RA,,,ser una mare gestant ha de tindre certes restriccions i açò atempta directament en la seua llibertat com a dona,ser una madre gestante tiene que tener ciertas restricciones y esto atenta directamente en su libertad como mujer,be a mother gestant has to have some constraints and this attacks directly at his liberty as a wife
205,ARG2,1;3,FAVOUR,204,CA,,,estan vostés d'acord que les restriccions seran les que la legislació els vulgui donar no,están ustedes de acuerdo que las restricciones serán las que la legislación los quiera dar no,are you of chord that the constraints will be those that the legislation want to give the ones no
206,ARG2,3,AGAINST,,,,,ja està legislat i està il·legalitzat,ya está legislado y está ilegalizado,already is legislated and is outlawed
207,ARG2,1,AGAINST,206,RA,,,és l'única manera de defensar els drets humans,es la única manera de defender los derechos humanos,is the only mode to defend the human laws
208,ARG2,1,AGAINST,207,RA,,,de defensar els drets de les dones,de defender los derechos de las mujeres,to defend the laws of the wives
209,ARG2,1,AGAINST,207,RA,,,de defensar els drets dels fills,de defender los derechos de los hijos,to defend the children's laws
210,ARG2,1,AGAINST,80;94;96;97;175;194,RA,80;97,MA,la gestació subrogada altruista és un cavall de troia,la gestación subrogada altruista es un caballo de troia,the surrogacy altruist is a horse of troia
211,ARG2,1;2,AGAINST,5;17;19,RA,,,per a l'explotació de les dones per a la feminització de la pobresa,para la explotación de las mujeres para la feminización de la pobreza,for the exploitation of the wives for it feminització of the poverty
212,ARG2,3,AGAINST,6;7;103;106;187,MA,,,ser pare o mare és un desig,ser padre o madre es un deseo,be father or mother is a wish
213,ARG2,3,AGAINST,212,RA,,,no es poden legalitzar tots aquells desitjos de les persones,no se pueden legalizar todos aquellos deseos de las personas,can not  legalise all those wishes of the persons
214,ARG2,1;2;3,FAVOUR,122;129;131;133;134;135;177;19;146,RA,,,tot això és el resultat d'una mala legislació,todo esto es el resultado de una mala legislación,everything this is the result of a bad legislation
215,ARG2,1,FAVOUR,124;172;191,RA,,,hi ha una hi ha una realitat a espanya que no podem negar que significa que hi ha una permissivitat d'aquesta pràctica quan es du a terme en altres països,hay una hay una realidad a espanya que no podemos negar que significa que hay una permisividad de esta práctica cuando se lleva a cabo en otros países,there is one there is a reality at espanya that we can not deny that it means that there is a permissiveness of this practice when carries out  at other countries
216,ARG2,1,FAVOUR,215,RA,,,és a dir la prohibició no és eficaç,es decir la prohibición no es eficaz,that is to say the ban is not effective
217,ARG2,1,FAVOUR,216,RA,,,hi ha una permissivitat de facto,hay una permisividad de facto,there is a permissiveness of facto
218,ARG2,1,FAVOUR,216,MA,,,s'ha provat que aquesta prohibició no pot ser eficaç,se ha probado que esta prohibición no puede ser eficaz,has proved  that this ban can not be effective
219,ARG2,2,FAVOUR,40;154;158,RA,,,al menor sempre es registrarà a espanya,al menor siempre se registrará a espanya,at the minor always will register  at espanya
220,ARG2,2,FAVOUR,124;172;191;40;154;158,RA,,,les parelles amb suficient capacitat econòmica s'aniran a països on s'estan explotant les dones per dur a terme aquestes pràctiques,las parejas con suficiente capacidad económica se irán a países donde se están explotando las mujeres para llevar a cabo estas prácticas,the couples with sufficient economic capacity will go  at countries where are exploding  the wives to carry out these practices
221,ARG2,2,FAVOUR,220,RA,,,concretament a països on sigui molt més barat com pot ser ucrania com pot ser cambodja com pot ser georgia,concretamente a países donde sea mucho más barato como puede ser ucrania como puede ser cambodja como puede ser georgia,concretely at countries where was much cheaper and can be ucrania how can be cambodja how can be georgia
222,ARG2,2,FAVOUR,146;40;154;158;220,RA,,,aleshores tornaran a espanya on es registrarà el menor al final la pràctica,entonces volverán a espanya donde se registrará el menor al final la práctica,then will return at espanya where will register  the minor at the end the practice
223,ARG2,2,FAVOUR,,,,,tenim el tercer millor sistema sanitari de tot el món,tenemos el tercero mejor sistema sanitario de todo el mundo,have the third better sanitary system of all the world
224,ARG2,2,FAVOUR,223,RA,,,tenim el primer millor sistema sanitari de la unió europea,tenemos el primero mejor sistema sanitario de la unión europea,have the first better sanitary system of the European union
225,ARG2,2,FAVOUR,223;224,RA,,,estem vivim en un estat de dret amb uns drets fonamentals i una realitat on s'estan protegint tots els drets que tinguin dones homes i nens a dins d'aquesta relació,estamos vivimos en un estado de derecho con unos derechos fundamentales y una realidad donde se están protegiendo todos los derechos que tengan mujeres hombres y niños adentro de esta relación,are live at a state by right with some fundamental laws and a reality where are protecting  all the laws that have wives men and boys in this account
226,ARG2,2,AGAINST,,,,,no permeten que els nadons inscriuen a espanya i penseu que és de garantir els drets humans,no permiten que los bebés inscriben a espanya y pensáis que es de garantizar los derechos humanos,do not permit that the babies inscribe at espanya and think that it is to guarantee the human laws
227,ARG2,2,FAVOUR,226,CA,,,estem completament a favor de què s'inscrigui i aquest nen ,estamos completamente a favor de que se inscriba y este niño,are entirely in favour of what inscribe  and this boy
228,ARG2,2,FAVOUR,227,RA,226,CA,de fet el tribunal europeu de drets humans obliga que aquests nadons s'escrigui a espanya,de hecho el tribunal europeo de derechos humanos obliga que estos bebés se escriba a espanya,in fact the European tribunal of human laws obliges that these babies write  at espanya
229,ARG2,2,FAVOUR,40;154;158;227;228,RA,,,tenir una nacionalitat forma part del dret a la identitat d'aquests nadons,tener una nacionalidad forma parte del derecho a la identidad de estos bebés,have a nationality forms part of the law to the identity of these babies
230,ARG2,1;2,FAVOUR,40;158,RA,,,aquesta inscripció el que demostra és que la prohibició fàctica és impossible,esta inscripción el que demuestra es que la prohibición fáctica es imposible,this inscription what evidences is that the ban fàctica is impossible
231,ARG2,1;2,FAVOUR,230,RA,,,donada que la prohibició fàctica és impossible garantim tots els drets de totes les persones que hi ha dins d'aquesta col·laboració,dada que la prohibición fáctica es imposible garantizamos todos los derechos de todas las personas que hay dentro de esta colaboración,given that the ban fàctica is impossible guarantee all the laws of all the persons that there is in this collaboration
232,ARG2,2,FAVOUR,231,RA,,,podem garantir un sistema on totes els mitjans sanitaris i els mitjans de dret ilegals i d'acompanyament a aquesta dona es puguin garantir,podemos garantizar un sistema donde todas los medios sanitarios y los medios de derecho ilegals y de acompañamiento a esta mujer se puedan garantizar,can guarantee a system where all the sanitary modes and the modes by right ilegals and of accompaniment at this wife can guarantee
233,ARG2,2,FAVOUR,231;232,RA,,,tenim els mitjans per fer-ho,tenemos los medios para hacerlo,have the modes to make it
234,ARG2,2,FAVOUR,233,MA,231;232,RA,tenim els mitjans per evitar que els drets fonamentals com ens està obligant a l'alt comissionat de les nacions unides es vegin protegits a dins del nostre estat,tenemos los medios para evitar que los derechos fundamentales como nos está obligando al alto comisionado de las naciones unidas se vean protegidos adentro de nuestro sido,have the modes to eschew that the fundamental laws and is obliging us at the tall comissionat of the nations united view  protected in our state
235,ARG2,1,FAVOUR,43;50;158;93;99;100;129;132;137;177,RA,,,a canadà quan es va regular adequadament el que va succeir és que el turisme reproductiu es va tallar,a canadà cuando se reguló adecuadamente el que sucedió es que el turismo reproductivo se cortó,at canadà when regulated  suitably what goes succeir is that the reproductive tourism hacked
236,ARG2,1,FAVOUR,43;50;158;93;99;100;129;132;137;177;235,RA,,,la gent va deixar d'anar a països com podia ser ucrania o l'índia o cambodja per quedar-se al canadà,la gente dejó de ir a países como podía ser ucrania o la india o cambodja para quedarse al canadà,the persons let to go at countries and could be ucrania or the Indian or cambodja to stay  at the canadà
237,ARG2,1,FAVOUR,236,RA,,,per quedar-se al canadà,para quedarse al canadà,to stay  at the canadà
238,ARG2,1,FAVOUR,237,RA,,,on les qüestions de garantia de sanitat i legals s'estaven donant i s'estaven garantint,donde las cuestiones de garantía de sanidad y legales se estaban dando y se estaban garantizando,where the questions of guarantee of health and legal were giving  and were guaranteeing
239,ARG2,1,FAVOUR,36;230;231,RA,,,tenim una prohibició que no és possible,tenemos una prohibición que no es posible,have a ban that is not possible
240,ARG2,1;2;3,FAVOUR,239,RA,,,donat que volem acabar amb una explotació i una feminització de la pobresa que s'està donant a països on no es poden protegir aquestes dones donem les garanties aquí,dado que queremos acabar con una explotación y una feminización de la pobreza que se está dando en países donde no se pueden proteger estas mujeres damos las garantías aquí,given that want to end with an exploitation and a feminització of the poverty that is giving  at countries where can not  protect these wives give the guarantees here
241,ARG2,3,FAVOUR,93;137;138;177,RA,,,adoptar els mitjans islàndia,adoptar los medios islàndia,adopt the modes islàndia
242,ARG2,3,FAVOUR,241,RA,,,que sigui altruista,que sea altruista,that it was altruist
243,ARG2,3,FAVOUR,241,RA,,,que doni la sanitat pública,que dé la sanidad pública,that it give the public health
244,ARG2,3,FAVOUR,241,RA,,,que s'estiguin respectant les llibertats de la dona,que se estén respetando las libertades de la mujer,that they are respecting  the liberties of the wife
245,ARG2,3,FAVOUR,241,RA,,,la dona que pugui decidir quines decisions prendre durant tot el procés de gestació,la mujer que pueda decidir qué decisiones tomar durante todo el proceso de gestación,the wife that can decide which decisions take during all the process of gestation
246,ARG2,3,FAVOUR,241,RA,,,que hi hagi fins i tot un comitè on s'estigui analitzant l'interès del menor,que haya incluso un comité donde se esté analizando el interés del menor,that there is even a committee where was analysing  the interest of the minor
247,ARG2,3,FAVOUR,241;246,RA,,,totes les parts s'han de veure protegides però sobretot s'ha de veure protegit qui més vulnerable és  en aquest cas és el nen i és la mare gestant,todas las partes se tienen que ver protegidas pero sobre todo se tiene que ver protegido quienes más vulnerable es en este caso es el niño y es la madre gestante,all the parts have to view  protected but especially has to  view protected who more vulnerable is at this case is the boy and is the mother gestant
248,ARG2,3,FAVOUR,246,RA,,,és la mare gestant,es la madre gestante,is the mother gestant
249,ARG2,3,AGAINST,247,CA,,,parleu de protegir els drets i totes les parts implicades i ser pare o mare no és un dret ,habláis de proteger los derechos y todas las partes implicadas y ser padre o madre no es un derecho,talk to protect the laws and all the parts implied and be father or mother is not a law
250,ARG2,3,FAVOUR,249,CA,,,és un desig,es un deseo,is a wish
251,ARG2,3,FAVOUR,249;250,CA,,,però el fet és que s'està donant una col·laboració altruista on amb les persones sí que tenen un dret,pero el hecho es que se está dando una colaboración altruista donde con las personas sí que tienen un derecho,but the fact is that it is giving  an altruistic collaboration where with the persons aye that have a law
252,ARG2,3,FAVOUR,251,RA,,,la llibertat a entrar en aquesta col·laboració,la libertad a entrar en esta colaboración,the liberty at entering at this collaboration
253,ARG2,3,FAVOUR,252,RA,,,una col·laboració que de fet defensem que és lliure perquè és altruista,una colaboración que de hecho defendemos que es libre porque es altruista,a collaboration that in fact defend that it is free so that it is altruistic
254,ARG2,3,FAVOUR,151,RA,,,que no depengui d'una situació econòmica en la que tu vulguis entrar perquè necessites el diners,que no dependa de una situación económica en la que tú quieras entrar porque necesitas el dinero,that it do not depend of an economic situation at what you want to enter so that you need the money
255,ARG2,3,FAVOUR,254,RA,,,si traiem això convertim que aquesta llibertat sigui una altruisme real,si sacamos esto convertimos que esta libertad sea una altruismo real,if we remove this convert that this liberty was one real altruism
256,ARG2,3,FAVOUR,251;252;253,RA,,,un altruisme és una expressió de la llibertat entre dues persones que volen col·laborar pel desig d'unes,un altruismo es una expresión de la libertad entre dos personas que quieren colaborar por el deseo de unas,an altruism is an expression of the liberty among two persons that want to collaborate for the wish of some
257,ARG2,3,FAVOUR,122;129;131;133;134;135;177;146,RA,,,els seus tres arguments són resultats d'una mala legislació,sus tres argumentos son resultados de una mala legislación,his three arguments are resulted of a bad legislation
258,ARG2,3,FAVOUR,257,RA,,,no tan legislar-ho,no tan legislarlo,no as legislate it
259,ARG2,3,FAVOUR,258,MA,,,sinó de legislar-ho malament ,sino de legislarlo mal,but to legislate it poorly
260,ARG2,3,FAVOUR,122;129;131;133;134;135;177;146,RA,19,MA,estan dient totes les coses dolentes que poden succeir si els estats no són suficientment garantistes,están diciendo todas las cosas malas que pueden suceder si los estados no son suficientemente garantistas,are saying all the mean things that can succeir if the states are not sufficiently garantistes
261,ARG2,3,FAVOUR,119,MA,,,la maternitat subrogada és bona o és dolenta,la maternidad subrogada es buena o es mala,the surrogacy is good or is mean
262,ARG2,3,FAVOUR,244;245;246;247,RA,,,espanya de veritat pot protegir la dignitat i els drets fonamentals de totes les persones que es veuen involucrades en aquesta pràctica,espanya de verdad puede proteger la dignidad y los derechos fundamentales de todas las personas que se ven involucradas en esta práctica,espanya for real can protect the dignity and the fundamental laws of all the persons that view  involved at this practice
263,ARG2,3,FAVOUR,,,,,la prohibició no és eficaç,la prohibición no es eficaz,the ban is not effective
264,ARG2,3,FAVOUR,49;56,RA,,,la millor manera és fent una legalització garantista,la mejor manera es haciendo una legalización garantista,the best mode is making a legalisation garantista
265,ARG2,3,FAVOUR,232,RA,233,MA,tenim els mitjans,tenemos los medianos,have the modes
266,ARG2,3,FAVOUR,,,,,tenim la intenció,tenemos la intención,have the intent
267,ARG2,3,FAVOUR,43;50;158;93;99;100;129;132;137;177;235,RA,,,tenim totes les maneres i els exemples on ja s'han provat que això es pot aconseguir,tenemos todas las maneras y los ejemplos donde ya se han probado que esto se puede conseguir,have all the manners and the examples where already have proved  that this can achieve
268,ARG2,3,FAVOUR,267,RA,,,aconseguir-ho a espanya,conseguirlo a espanya,achieve it at espanya
