ID (Chronological),TYPE (Part + Person),ARGUMENT NUMBER,TEAM STANCE,RELATED ID,ARGUMENTAL RELATION  TYPE,RELATED ID.1,ARGUMENTAL RELATION  TYPE.1,ADU_CAT,ADU_ES,ADU_EN
115,ARG1,1.0,AGAINST,114,RA,,,aquest rol reproductiu ha estat sempre associat a la dona,este rol reproductivo ha sido siempre asociado a la mujer,this rol reproductive has been always associated at the wife
116,ARG1,1.0,AGAINST,115,RA,,,i fa aquesta dona siga culpable,y hace esta mujer sea culpable,and makes this wife was culprit
117,ARG1,1.0,AGAINST,,,,,si jo li dic a la meua germana que vull que tinga un fill meu,si yo le digo a mi hermana que quiero que tenga un hijo mío,if I say him at my sister that want to that have a mine son
118,ARG1,1.0,AGAINST,117,RA,,,la meua germana es pot sentir culpable si no vol,mi hermana se puede sentir culpable si no quiere,my sister can hear  culprit if it does not want to
119,ARG1,1.0,AGAINST,110,MA,,,i és que l'altruisme no existeix,y es que el altruismo no existe,and is that the altruism does not exist
120,ARG1,2.0,AGAINST,119,RA,,,en la mesura que pot haver suborns,en la medida que puede haber sobornos,at the size that can have payoffs
121,ARG1,2.0,AGAINST,119,RA,,,pot haver-hi economia submergida,puede haber economía sumergida,can have economics submerged
122,ARG1,2.0,AGAINST,119,RA,,,es manté la qüestió de classe,se mantiene la cuestión de clase,maintains  the question of class
123,ARG1,,AGAINST,,,,,anem a definir les prioritats segons l'informe brandant,vayamos a definir las prioridades según el informe blandiendo,go at defining the priorities according to the report wielding
124,ARG1,,AGAINST,123,RA,,,que la definix a tres nivells a nivell mediambiental a nivell social i a nivell econòmic,que la define a tres niveles a nivel medioambiental a nivel social y a nivel económico,that it defines it at three levels at environmental level at social level and at economic level
125,ARG1,3.0,AGAINST,124,RA,,,a nivell mediambiental,a nivel medioambiental,at environmental level
126,ARG1,1.0,AGAINST,124,RA,,,a nivell social,a nivel social,at social level
127,ARG1,2.0,AGAINST,124,RA,,,i a nivell econòmic,y a nivel económico,and at economic level
128,ARG1,,AGAINST,,,,,els efectes negatius d'aquesta legalització són majors que els efectes positius per al conjunt de la societat,los efectos negativos de esta legalización son mayores que los efectos positivos para el conjunto de la sociedad,the negative effects of this legalisation are main that the positive effects for the pool of the society
129,ARG1,,FAVOUR,119,MA,,,ens ha parlat que no existix l'altruisme,nos ha hablado que no existe el altruismo,has talked us that it does not exist the altruism
130,ARG1,,FAVOUR,129,RA,,,per tant està en contra de totes les persones que de manera altruista donem sang o donem òrgans,por lo tanto está en contra de todas las personas que de manera altruista demos sangre o demos órganos,therefore it is against of all the persons that of altruistic mode give blood or give organs
131,ARG1,,AGAINST,,,,,Donar sang és per satisfer una necessitat,Dar sangre es para satisfacer una necesitado,Give blood is to satisfy a necessity
132,ARG1,,AGAINST,131,RA,,,com no ho és el fet de tindre fills,como no lo es el hecho de tener hijos,how is not it the fact to have children
133,ARG1,3.0,AGAINST,,,,,el creixement de la població actualment és una realitat,el crecimiento de la población actualmente es una realidad,the growth of the populace at present is a reality
134,ARG1,3.0,AGAINST,133,RA,,,segons un estudi de british antàrtic servei actualment n'hi ha set mil cinc-cents milions de persones al món en dos mil cinquanta haurà vuit mil milions més i diuen en aquest estudi que per satisfer una vida digna i unes garanties de vida digna per a totes les persones hauriem de ser entre dos mil i tres mil milions,según un estudio de british antártico servicio actualmente hay siete mil quinientos millones de personas al mundo en dos mil cincuenta habrá ocho mil millones más y dicen en este estudio que para satisfacer una vida digna y unas garantías de vida digna para todas las personas hauriem de ser entre dos mil y tres mil millones,according to a survey of british Antarctic kick at present there are seven thousand five hundred million of persons at the world at two thousand fifty will have eight thousand million more and say at this survey that to satisfy a worthy life and some worthy living guarantees for all the persons hauriem of being among two thousand and three thousand million
135,ARG1,3.0,AGAINST,134,RA,,,no n'hi ha suficients recursos,no hay suficientes recursos,no there is sufficient resources
136,ARG1,3.0,AGAINST,135,RA,,,i podríem arribar a un punt de no retorn en dos mil quaranta-cinc,y podríamos llegar a un punto de no retorno en dos mil cuarenta y cinco,and could reach a point of no return at two thousand forty-five
137,ARG1,3.0,AGAINST,135,RA,,,però és que segons un informe del fons mundial per a la natura ens diu que en dos mil vint ens caldrien u coma setanta-cinc planetes i en dos mil cinquanta dos coma cinc planetes per a satisfer les necessitats d'una població creixent,pero es que según un informe del fondo mundial para la natura nos dice que en dos mil veinte nos harían falta uno coma setenta y cinco planetas y en dos mil cincuenta dos coma cinco planetas para satisfacer las necesidades de una población creciente,but is that according to a report of the world fund for the nature says us that at two thousand twenty would be necessary us u comma seventy-five planets and at two thousand fifty two comma five planets to satisfy the necessities of a growing populace
138,ARG1,3.0,AGAINST,137,RA,,,dos coma cinc planetes que no tenim,dos coma cinco planetas que no tenemos,two comma five planets that do not have
139,ARG1,3.0,AGAINST,133;134,RA,,,la gestació subrogada i la seua legalització atenen a una lògica de continuar amb polítiques natalistes,la gestación subrogada y su legalización atienen a una lógica de continuar con políticas natalistes,the surrogacy and his legalisation attend at a logic to continue with politicians natalistes
140,ARG1,3.0,AGAINST,134,RA,,,hi ha un excés de població actualment,hay un exceso de población actualmente,there is an excess of populace at present
141,ARG1,3.0,AGAINST,,,,,n'hi ha suficients xiquets per adoptar,hay suficientes niños para adoptar,there is sufficient children to adopt
142,ARG1,3.0,AGAINST,141,RA,,,si no els haguera existeixen xiquets en cíes existeixen xiquets migrants i si no els haguera el que falten són mecanismes,si no los hubiera existen niños en cíes existen niños migrantes y si no los hubiera el que faltan son mecanismos,if it did not have the ones exist children  cíes exist children migrants and if it did not have the ones what are missing are mechanisms
143,ARG1,,FAVOUR,,,,,no creieu que amb un model gestionat a través del sistema públic de salut igual que la donació d'òrgans garantiria una pràctica ètica d'aquesta gestació,no creéis que con un modelo gestionado a través del sistema público de salud igual que la donación de órganos garantizaría una práctica ética de esta gestación,do not think that with a model managed through the public system of equal health that the donation of organs would guarantee an ethic practice of this gestation
144,ARG1,3.0,AGAINST,143,CA,,,per suposat que no ,por supuesto que no,for supposed that no
145,ARG1,3.0,AGAINST,140,RA,,,no és que vullguem que hi haja més xiquets,no es que vullguem que haya más niños,is not that vullguem that there is more children
146,ARG1,3.0,AGAINST,145,MA,,,sinó tot el contrari,sino todo el contrario,but all the opposite
147,ARG1,3.0,AGAINST,146,RA,,,el que necessitem és que hi haja menys persones en el món,el que necesitamos es que haya menos personas en el mundo,what need is that there is less persons at the world
148,ARG1,3.0,AGAINST,147,RA,,,potser no és la proposta més popular,quizás no es la propuesta más popular,perhaps is not the most popular proposal
149,ARG1,3.0,AGAINST,134;137;148,RA,,,però és el que estan dient aquests estudis,pero es el que están diciendo estos estudios,but is what are saying these surveys
150,ARG1,3.0,AGAINST,149,RA,,,que per a garantir a un futur calen menys persones ,que para garantizar a un futuro hacen falta menos personas,that to guarantee at a future are necessary less persons
151,ARG1,3.0,AGAINST,150,RA,,,si volem salvar el planeta,si queremos salvar el planeta,if we want to save the planet
152,ARG1,3.0,AGAINST,151,RA,,,s'han d'impulsar polítiques anti natalistes,se tienen que impulsar políticas anti natalistes,have to further  politicians anti natalistes
153,ARG1,3.0,AGAINST,152,RA,,,com bé defensa el premi príncep d'astúries i divulgador científic david aterhoff,como bien defiende el premio príncipe de astúries y divulgador científico david aterhoff,how well defends the prize prince of astúries and popularising scientist david aterhoff
154,ARG1,3.0,AGAINST,152,RA,,,a través primer de les polítiques anti natalistes,a través primero de las políticas anti natalistes,at través first of the politicians anti natalistes
155,ARG1,3.0,AGAINST,154,RA,,,fomentar campanyes de promoció d'aquestes polítiques,fomentar campañas de promoción de estas políticas,foster campaigns of promotion of these politicians
156,ARG1,3.0,AGAINST,155,RA,,,facilitar l'ús d'anticonceptius permanents i distribuir en funció de la taxa de natalitat,facilitar el uso de anticonceptivos permanentes y distribuir en función de la tasa de natalidad,facilitate the use of contraceptive permanent and distribute at function of the tax of natality
157,ARG1,3.0,AGAINST,155,RA,,,donar uns beneficis a les famílies que tinguen menys xiquets,dar unos beneficios a las familias que tengan menos niños,give some benefits at the families that have less children
158,ARG1,3.0,AGAINST,155,RA,,,però també a través del segon punt el de la prohibició global de la gestació subrogada a través de organismes internacionals,pero también a través del segundo punto el de la prohibición global de la gestación subrogada a través de organismos internacionales,but also through the second point the of the global ban of the surrogacy through international organisms
159,ARG1,3.0,AGAINST,158,RA,,,o com ocorre en nova gal·les on és delicte de presó,o como ocurre en nueva galas donde es delito de prisión,or how occurs at new Frenchwomen where is crime of prison
160,ARG1,3.0,AGAINST,,,,,i en tercer punt promoure l'adopció i l'acollida de xiquets migrants  o amb diversitat funcional,y en tercer punto promover la adopción y la acogida de niños migrantes o con diversidad funcional,and at third point promote the adoption and the received of children migrants or with functional diversity
161,ARG1,3.0,AGAINST,160,RA,,,També donar-los beneficis a aquestes famílies,También darlos beneficios a estas familias,Also give them benefits at these families
162,ARG1,1.0,AGAINST,,,,,les dones no les entenem com a mitjans per satisfer els desitjos individuals d'uns pocs,las mujeres no las entendemos como medios para satisfacer los deseos individuales de unos pocos,the wives no the understand as a modes to satisfy the individual wishes of some few
163,ARG1,1.0,AGAINST,162,RA,,,perquè la gestació subrogada nega la capacitat de decidir a aquestes dones durant el procés ja que haurà un moment de no retractació,porque la gestación subrogada niega la capacidad de decidir a estas mujeres durante el proceso puesto que habrá un momento de no retractación,so that the surrogacy denies the capacity to decide at these wives during the process since it will have a moment of no retractation
164,ARG1,1.0,AGAINST,163,RA,,,abans del procés per les condicions socioeconòmiques en les que es troben,antes del proceso por las condiciones socioeconómicas en las que se encuentran,before the process for the socioeconomic conditions at those that find
165,ARG1,1.0,AGAINST,163,RA,,,i després d'aquest procés en les decisions sobre la criança,y después de este proceso en las decisiones sobre la crianza,and after this process at the decisions on the breeding
166,ARG1,1.0,FAVOUR,,,,,l'actual pràctica és bestial dius ,la actual práctica es bestial dices,the ongoing practice is bestial say
167,ARG1,1.0,FAVOUR,166,RA,,,per això tenim que acotar-la,por eso tenemos que acotar-la,therefore have that acotar-it
168,ARG1,1.0,FAVOUR,167,RA,,,però perquè la prohibició no garanteix res,pero porque la prohibición no garantiza nada,but so that the ban does not guarantee anything
169,ARG1,1.0,FAVOUR,75;168,RA,,,al igual que no garanteix que no es consumisquen drogues,al igual que no garantiza que no se consuman drogues,at the the same that it does not guarantee that they do not consume  drugs
170,ARG2,1.0,FAVOUR,168,RA,,,i a l'igual que no és garantia fa anys les persones se n'anaren a altres països a avortar,y al igual que no es garantía hace años las personas se fueron a otros países a abortar,and at the equal that is not guarantee makes years the persons went  at other countries at aborting
171,ARG2,1.0,FAVOUR,,,,,quina diferència hi ha entre legalitzar i educar o legalitzar i prohibir,qué diferencia hay entre legalizar y educar o legalizar y prohibir,which difference there is among legalising and educate or legalise and prohibit
172,ARG2,1.0,FAVOUR,171,RA,,,crear una nova realitat,crear una nueva realidad,create a new reality
173,ARG2,1.0,FAVOUR,172,RA,,,una realitat que avui dia no existeix,una realidad que hoy en día no existe,a reality that nowadays does not exist
174,ARG2,1.0,FAVOUR,166,RA,,,la pràctica és aberrant,la práctica es aberrante,the practice is aberrant
175,ARG2,1.0,FAVOUR,174,RA,,,ficar tanques per a protegir,meter vallas para proteger,put fences to protect
176,ARG2,1.0,FAVOUR,175,RA,,,el nadó en primer lloc a la mare gestant,el bebé en primer lugar a la madre gestante,the baby in the first place at the mother gestant
177,ARG2,1.0,FAVOUR,175,RA,,,a la mare gestant,a la madre gestante,at the mother gestant
178,ARG2,1.0,FAVOUR,177,RA,,,sí és la mare del xiquet la mare que gesta,sí es la madre del niño la madre que gesta,aye is the mother of the child the mother that feat
179,ARG2,1.0,FAVOUR,175,RA,,,i dels pares convidents en tercer lloc,y de los padres convidents en tercer lugar,and of the parents convidents thirdly
180,ARG2,1.0,FAVOUR,,,,,el rol de productiu de la dona no ve donat pel que el meu company s'haja dit,el rol de productivo de la mujer no viene dado por el que mi compañero se haya dicho,it rol of productive of the wife does not come given by the that my partner have said
181,ARG2,1.0,FAVOUR,180,MA,,,ve per natura,viene por natura,comes by nature
182,ARG2,1.0,FAVOUR,150,MA,,,després estan dient que sobra gent en el planeta,después están diciendo que sobra gente en el planeta,next are saying that sobra persons at the planet
183,ARG2,1.0,FAVOUR,135,MA,,,i que no hi han recursos suficients per a abastir-ho,y que no han recursos suficientes para alcanzarlo,and that they do not have  sufficient resources to achieve it
184,ARG2,1.0,FAVOUR,183,RA,,,tot això és culpa de la població o de l'opulència del capitalisme del mercat,todo esto es culpa de la población o de la opulencia del capitalismo del mercado,everything this is fault of the populace or of the opulence of the capitalism of the market
185,,1.0,FAVOUR,184,RA,,,o de l'opulència del capitalisme del mercat,o de la opulencia del capitalismo del mercado,or of the opulence of the capitalism of the market
186,ARG2,1.0,FAVOUR,185,RA,,,un mercat que el nostre equip vol acotar,un mercado que nuestro equipo quiere acotar,a market that our squad wants to acotar
187,ARG2,1.0,FAVOUR,186,RA,,,perquè aquesta pràctica no pot ser ni mercantilista,porque esta práctica no puede ser ni mercantilista,so that this practice can not be or mercantilista
188,ARG2,1.0,FAVOUR,187,RA,,,no pot cosificar a la dona i no pot instrumentar-la,no puede cosificar a la mujer y no puede instrumentarla,can not cosificar at the wife and can not notarise it
189,ARG2,,AGAINST,,,,,no considera que la societat ha establert que la dona ha de tindre este rol reproductiu i ho ha fomentat,no considera que la sociedad ha establecido que la mujer tiene que tener este rol reproductivo y lo ha fomentado,does not consider that the society has established that the wife has to have este rol reproductive and has fostered it
190,ARG2,1.0,FAVOUR,,,,,sí estic d'acord parcialment,sí estoy de acuerdo parcialmente,aye agree partially
191,ARG2,1.0,FAVOUR,190,MA,,,però també crec que les persones són prou intel·ligents per a decidir per nosaltres mateixes,pero también creo que las personas son bastante inteligentes para decidir por nosotros mismas,but also think that the persons are enough intelligent to decide for us same
192,ARG2,1.0,FAVOUR,,,,,la societat pot dir moltes coses,la sociedad puede decir muchas cosas,the society can say a lot of things
193,ARG2,1.0,FAVOUR,192,RA,,,jo sóc lliure,yo soy libre,I am free
194,ARG2,,AGAINST,,,,,les nostres mesures pro mediambientals també preteníem reduir eixa opulència,nuestras medidas pro medioambientales también pretendíamos reducir esa opulencia,our sizes pro environmental also pretended to reduce eixa opulence
195,ARG2,,AGAINST,194,MA,,,però que també eixa opulència es dóna per les persones que la gasten i que reduiríem,pero que también esa opulencia se da por las personas que la gasten y que reduciríamos,but that also eixa opulence gives  for the persons that spend it and that would reduce
196,ARG2,,AGAINST,195,RA,,,per tant no podrien consumir,por lo tanto no podrían consumir,therefore they could not consume
197,ARG2,,FAVOUR,,,,,no podrà negar l'evidència que és més per l'opulència d'occident,no podrá negar la evidencia que es más por la opulencia de occidente,will not be able to deny the evidence that is more for the opulence of occident
198,ARG2,,FAVOUR,197,RA,,,és més per l'opulència d'un xicotet grup de persones,es más por la opulencia de un pequeño grupo de personas,is more for the opulence of a little band of persons
199,ARG2,,AGAINST,,,,,està clar que el vostre discurs esteu defenent l'educació per a revertir aquest cas,está claro que vuestro discurso estáis defendiendo la educación para revertir este caso,is clear that your speech are defending the nurture to revert this case
200,ARG2,,AGAINST,,,,,en quin moment esteu defensant que deu ser legalitzada i no deu ser prohibida mentre que s'educa,en qué momento estáis defendiendo que debe de ser legalizada y no debe de ser prohibida mientras que se educa,at which moment are defending that it owes being legalised and does not owe being prohibited whereas it educates
201,ARG2,1.0,FAVOUR,,,,,la legalització el que permitix és construir unes noves realitats,la legalización el que permitix es construir unas nuevas realidades,the legalisation what permitix is to construct some new realities
202,ARG2,1.0,FAVOUR,,,,,la legalització el que permitix és una protecció exhaustiva,la legalización el que permitix es una protección exhaustiva,the legalisation what permitix is an exhaustive protection
203,ARG2,1.0,FAVOUR,,,,,la legalització el que permitix que tot el que quede fora d'aquest marc siga considerat el que avui passa exclusivament compravenda de nadons,la legalización el que permitix que todo el que quedo fuera de este marco sea considerado el que hoy pasa exclusivamente compraventa de bebés,the legalisation what permitix that everything what stay out of this frame was considered what today passes exclusively compravenda of babies
204,ARG2,1.0,FAVOUR,203,RA,,,què és el que avui estan fent,qué es el que hoy están haciendo,what is what today are making
205,ARG2,1.0,FAVOUR,204,RA,,,no és gestació subrogada,no es gestación subrogada,is not surrogacy
206,ARG2,1.0,FAVOUR,204,RA,,,és gestació per altres,es gestación por otras,is gestation for others
207,ARG2,1.0,FAVOUR,204,RA,,,és compra-venda de nadons,es compra-venta de bebés,is purchase-sale of babies
208,ARG2,,FAVOUR,207,RA,,,gent rica que se'n va a països pobres a comprar,gente rica que se va a países pobres a comprar,affluent persons that goes  at poor countries at buying
209,ARG2,,FAVOUR,,,,,és un marc garantista,es un marco garantista,is a frame garantista
210,ARG2,,FAVOUR,,,,,perquè senyors senyores la societat canvia,porque señores señoras la sociedad cambia,so that gentlemen ladies the society capsizes
211,ARG2,,FAVOUR,210,RA,,,les lleis tenen que canviar amb esta societat,las leyes tienen que cambiar con esta sociedad,the laws have that capsize with esta society
212,ARG2,,FAVOUR,,,,,tamara gorro juntament albert rivera va pregonant el que és per a ells la gestació subrogada,tamara gorro juntamente albert rivera va pregonando el que es para ellos la gestación subrogada,tamara gorro jointly albert rivera goes heralding what is for them the surrogacy
213,ARG2,,FAVOUR,212,RA,,,no volem defensar eixa postura,no queremos defender esa postura,do not want to defend eixa posture
214,ARG2,,FAVOUR,,,,,és d'extrema necessitat que es creen noves realitats,es de extrema necesidad que se crean nuevas realidades,is of dire necessity that create  new realities
215,ARG2,,FAVOUR,214,RA,,,legalitzant i educant,legalizando y educando,legalising and educating
216,ARG2,,FAVOUR,,,,,perquè prohibir no garanteix res,porque prohibir no garantiza nada,so that prohibit does not guarantee anything
217,ARG2,,FAVOUR,74;216,RA,,,no es droga ningun en espanya,no se droga ningun en espanya,does not drug  ningun  espanya
218,ARG2,,FAVOUR,216,RA,,,fa cinquanta o seixanta anys ninguna dona anava a avortar fora d'espanya,hace cincuenta o sesenta años ninguna mujer iba a abortar fuera de espanya,makes fifty or sixty years ninguna wife went at aborting out of espanya
219,ARG2,,FAVOUR,215,RA,,,si es legalitza si s'educa el que permetem és controlar-lo,si se legaliza si se educa el que permitimos es controlarlo,if it legalises  if it educates  what permit is to control it
220,ARG2,,FAVOUR,,,,,no anem a basar-nos en models com el canadenc o el regne unit,no vayamos a basarnos en modelos como el canadiense o el reino unido,do not go at basing us at models like the Canadian or the realm united
221,ARG2,,FAVOUR,220,RA,,,altruistes entre comillas,altruistas entre comillas,altruists among comillas
222,ARG2,,FAVOUR,220,RA,,,o l'ucraïnès i el rus o l'estadounidens,o el ucraniano y el ruso o el estadounidens,or the Ukrainian and the Russian or it estadounidens
223,ARG2,,FAVOUR,222,RA,,,mercantilitzant instrumentalitzant i cossificant a la dona,mercantilizando instrumentalizando y cossificant a la mujer,mercantilitzant instrumentalitzant and cossificant at the wife
224,ARG2,,FAVOUR,,,,,legislar per a casos extrems i concrets,legislar para casos extremos y concretos,legislate for dire and concrete cases
225,ARG2,,FAVOUR,224,RA,,,un comitè de garanties s'encarregarà,un comité de garantías se encargará,a committee of guarantees will commission
226,ARG2,,FAVOUR,225,RA,,,on no hi haja una jerarquia ni econòmicani per exemple de treball entre la mare gestant i la família comitent,donde no haya una jerarquía ni econòmicani por ejemplo de trabajo entre la madre gestante y la familia comitente,where there is not a hierarchy or econòmicani for example of work among the mother gestant and the family comitent
227,ARG2,,FAVOUR,,,,,eradicar la comercialització,erradicar la comercialización,eradicate the commercialization
228,ARG2,,FAVOUR,227,RA,,,no hi hauran empreses intermediàries,no habrán emprendidas intermediarias,will not have undertaken  intermediaries
229,ARG2,,FAVOUR,227,RA,,,la mare no cobrarà,la madre no cobrará,the mother will not charge
230,ARG2,,FAVOUR,229,RA,,,això és altruisme,esto es altruismo,this is altruism
231,ARG2,,FAVOUR,229,RA,,,que si aquesta mare vol per la seua llibertat pot fer-ho amb accions paral·leles i mantenint eixos drets,que si esta madre quiere por su libertad puede hacerlo con acciones paralelas y manteniendo esos derechos,that if this mother wants to for his liberty can make it with parallel acts and maintaining right axes
232,ARG2,,FAVOUR,,,,,a més de crear un nou règim sancionador,además de crear un nuevo régimen sancionador,in addition to creating a new penalising diet
233,ARG2,,FAVOUR,,,,,com ho controlarem,como lo controlaremos,how will control it
234,ARG2,,FAVOUR,233,RA,,,com se fa la donació d'òrgans,como se hace la donación de órganos,how makes  the donation of organs
235,ARG2,,FAVOUR,234,RA,,,mitjançant el ent públic,mediante el ent público,mediating it ent public
236,ARG2,3.0,AGAINST,,,,,sóc un depredador,soy un depredador,am a predator
237,ARG2,3.0,AGAINST,236,RA,,,perquè perteneixem a una espècie que al par d'anys està creixent cada vegada més i més a augmentat el nostre consum per la societat consumista,porque perteneixem a una especie que al par de años está creciendo cada vez más y más a aumentado nuestro consumo por la sociedad consumista,so that perteneixem at a species that at the par of years is growing increasingly and more at augmented our consumption for the society consumista
238,ARG2,3.0,AGAINST,237,RA,,,estem un sistema capitalista,estamos un sistema capitalista,are a capitalist system
239,ARG2,3.0,AGAINST,238,RA,,,i aquest sistema se fica ben primer el consum sobre la sostenibilitat,y este sistema se mete bien primero el consumo sobre la sostenibilidad,and this system puts  well first the consumption on the sustainability
240,ARG2,3.0,AGAINST,239,RA,,,és aquesta aquestes sostenibilitat la que és important garantir,es esta estas sostenibilidad la que es importante garantizar,is this this sustainability what is important to guarantee
