ID (Chronological),TYPE (Part + Person),ARGUMENT NUMBER,TEAM STANCE,RELATED ID,ARGUMENTAL RELATION  TYPE,RELATED ID.1,ARGUMENTAL RELATION  TYPE.1,ADU_CAT,ADU_ES,ADU_EN
241,ARG2,3.0,AGAINST,240,RA,,,perquè la sostenibilitat no és una opció,porque la sostenibilidad no es una opción,so that the sustainability is not an option
242,ARG2,3.0,AGAINST,,,,,si continuem aixina no apleguem a ningun lloc,si continuamos así no reunimos a ningun lugar,if we continue like this do not reunite at ningun place
243,ARG2,,AGAINST,186,MA,,,la seua tesi era legalitzar per acotar,su tesis era legalizar por acotar,his thesis was to legalise for acotar
244,ARG2,,AGAINST,,,,,però en ningun lloc hem vist el nexe causal entre legalitzar i educar ,pero en ningun lugar hemos visto el nexo causal entre legalizar y educar,but  ningun place have viewed the causal link among legalising and educate
245,ARG2,,AGAINST,244,RA,,,per supost que estem a favor d'educar,por supost que estamos a favor de educar,for supost that are in favour to educate
246,ARG2,,AGAINST,,,,,que la gestació subrogada com actualment estem veient és algo completament ruin,que la gestación subrogada como actualmente estamos viendo es algo completamente ruin,that the surrogacy how at present are viewing is algo entirely ruin
247,ARG2,,AGAINST,245,MA,,,però és que en ningun moment hi ha que legalitzar per a poder educar,pero es que en ningun momento hay que legalizar para poder educar,but is that  ningun moment there is that legalise to be able to educate
248,ARG2,,AGAINST,,,,,heu ficat el símil de les drogues,habéis metido el símil de las drogas,have put the simile of the drugs
249,ARG2,,AGAINST,248,RA,,,legalitzar és apoyar,legalizar es apoyar,legalise is apoyar
250,ARG2,,AGAINST,249,RA,,,és que el propi estat estiga defenent aquestes pràctiques,es que el propio estado esté defendiendo estas prácticas,is that the own state was defending these practices
251,ARG2,,AGAINST,249,RA,,,el nostre cas a espanya la gestació subrogada està prohibida,nuestro caso a espanya la gestación subrogada está prohibida,our case at espanya the surrogacy is prohibited
252,ARG2,,AGAINST,251,RA,,,i què fan les famílies que la volen practicar,y que hacen las familias que la quieren practicar,and what make the families that want to practice it
253,ARG2,,AGAINST,252,RA,,,ho fan espanya,lo hacen espanya,make it espanya
254,ARG2,,AGAINST,,,,,no,no,no
255,ARG2,,AGAINST,253,MA,,,van a l'estranger,van a la extranjero,go abroad
256,ARG2,,AGAINST,255,RA,,,dins de les nostres propostes antinatalistes està la prohibició internacional de la gestació subrogada,dentro de nuestras propuestas antinatalistas está la prohibición internacional de la gestación subrogada,in our proposals antinatalistes is the international ban of the surrogacy
257,ARG2,,AGAINST,248,CA,,,açò no és com les drogues on pot continuar el tràfic,esto no es como las drogas donde puede continuar el tráfico,this is not like the drugs where can continue the traffic
258,ARG2,,AGAINST,256,RA,,,és tan senzill com aplicar una medida en la qual no se pot escriure un xiquet si ve de l'estranger a partir de la gestació subrogada,es tan sencillo como aplicar una medida en la cual no se puede escribir un niño si viene del extranjero a partir de la gestación subrogada,is as simple like applying a sized at which can not  write a child if it comes of the foreigner from the surrogacy
259,ARG2,,AGAINST,258,RA,,,en el moment que les famílies tinguen el gran risc de no poder entrar el xiquet a espanya no ho faran,en el momento que las familias tengan el gran riesgo de no poder entrar el niño a espanya no lo harán,at the moment that the families have the big risk of not being able to enter the child at espanya will not make it
260,ARG2,,AGAINST,259,RA,,,preferiràn l'adopció,preferiràn la adopción,preferiràn the adoption
261,ARG2,,AGAINST,260,RA,,,una via la qual soluciona els actuals problemes de sostenibilitat,una vía la cual soluciona los actuales problemas de sostenibilidad,one via which solves the ongoing problems of sustainability
262,ARG2,,FAVOUR,,,,,ha dit vosté que està prohibida internacionalment i en espanya,ha dicho usted que está prohibida internacionalmente y en espanya,has said you that is prohibited internationally and  espanya
263,ARG2,,FAVOUR,262,RA,,,això està garantint que no s'inscriguen xiquets en aquest país,esto está garantizando que no se inscriban niños en este país,this is guaranteeing that they do not inscribe  children at this country
264,ARG2,,AGAINST,,,,,el que n'hi ha que fer no és defensar no és permitir aquestes empreses i legalitzar per a encara donar més força des del propi estat,el que hay que hacer no es defender no es permitir estas empresas y legalizar para todavía dar más fuerza desde el propio sido,what there is that make is not to defend is not permitir these companies and legalise for still give more forces since the own state
265,ARG2,,AGAINST,264,MA,,,el que hi ha que fer com és una pràctica aberrant és prohibir-la i negar la inscripció de nous xiquets,el que hay que hacer cómo es una práctica aberrante es prohibirla y negar la inscripción de nuevos niños,what there is that make how is an aberrant practice is to prohibit it and deny the inscription of new children
266,ARG2,,AGAINST,,,,,la gestació subrogada no està bé ,la gestación subrogada no está bueno,the surrogacy is not well
267,,,AGAINST,266,RA,,,està explotant la dona per una raó de gènere i de classe,está explotando la mujer por una razón de género y de clase,is exploding the wife for a reason of genus and of class
268,ARG2,,AGAINST,,,,,la seua proposta volia legalitzar per a fer una pràctica semblant al altruista,su propuesta quería legalizar para hacer una práctica parecida al altruista,his proposal wanted to legalise to make an alike practice at the altruist
269,ARG2,2.0,AGAINST,268,MA,,,la gestació subrogada altruista no pot existir perquè o bé va haver una compensació econòmica,la gestación subrogada altruista no puede existir porque o bien hubo una compensación económica,the surrogacy altruist can not exist so that or had an economic compensation
270,ARG2,2.0,AGAINST,269,RA,,,o va haver-hi una compensació sentimental,o hubo una compensación sentimental,or had  a sentimental compensation
271,ARG2,1.0,AGAINST,269,RA,,,o va haver algun tipus de pressionament cap a la dona,o hubo algún tipo de pressionament hacia la mujer,or had some type of pressionament to the wife
272,ARG2,1.0,AGAINST,271,RA,,,debut a la societat patriarcal en la que estem,debut a la sociedad patriarcal en la que estamos,debut at the patriarchal society at what are
273,ARG2,,FAVOUR,,,,,han parlat de paternalisme,han hablado de paternalismo,have talked of paternalisme
274,ARG2,,FAVOUR,,,,,no creuen que jo com a dona amb sentit crític no tinc la suficient autonomia per decidir,no creen que yo como mujer con sentido crítico no tengo la suficiente autonomía para decidir,do not think that I as a wife with critical sense do not have the sufficient autonomy to decide
275,ARG2,,AGAINST,273,CA,,,això no és paternalisme,esto no es paternalismo,this is not paternalisme
276,ARG2,,AGAINST,,,,,més que lo que nosaltres proposem,más que lo que nosotros proponemos,more that lo that we propose
277,ARG2,1.0,AGAINST,275,RA,,,per a poder garantir una lliure elecció hi ha que tindre una una sèrie de circumstàncies socioeconòmiques i culturals molt grans,para poder garantizar una libre elección hay que tener una una serie de circunstancias socioeconómicas y culturales muy grandes,to be able to guarantee a free election there is that have one a series of socioeconomic and cultural circumstances very big
278,ARG2,1.0,AGAINST,277,MA,,,i a l'actualitat aquestes circumstàncies no es compleixen,y a la actualidad estas circunstancias no se cumplen,and at the actuality these circumstances do not conform
279,ARG2,2.0,AGAINST,277,RA,,,perquè les persones tenim una sèrie necessitats econòmiques tenim una sèrie de pressions socials i una serie de pressions culturals,porque las personas tenemos una serie necesitados económicas tenemos una serie de presiones sociales y una serio de presiones culturales,so that the persons have a series needed economic have a series of social pressures and a serie of cultural pressures
280,ARG2,2.0,AGAINST,277,RA,,,i degut a estar en un sistema capitalista i poder estar en l'elecció de o no treballar o cobrar cinc-cents euros,y debido a estar en un sistema capitalista y poder estar en la elección de o no trabajar o cobrar quinientos euros,and owed to be at a capitalist system and can be at the election of or not working or charge five hundred euros
281,ARG2,2.0,AGAINST,280,RA,,,doncs per supost que anem cobrar cinc-cents euros,pues por supost que cobramos quinientos euros,then for supost that charged five hundred euros
282,ARG2,2.0,AGAINST,280;281,RA,,,lo mateix que està passant ara mateix a ucraïna a les granges de dones que per necessitat econòmica estan siguent explotades i estan siguent segrestades per a tindre fills per a famílies de països rics,lo mismo que está pasando ahora mismo a ucraïna en las granjas de mujeres que por necesidad económica están siguent explotadas y están siguent secuestradas para tener hijos para familias de países ricos,lo same that is passing right now at ucraïna at the farms of wives that for economic necessity are siguent exploded and are siguent hijacked to have children for families of affluent countries
283,ARG2,2.0,AGAINST,282,RA,,,i és per això mateix que pensem que no,y es por eso mismo que pensemos que no,and is therefore same that we think that no
284,ARG2,2.0,AGAINST,283,RA,,,El estat no ha de ser en ningun moment complix de la gestació subrogada,El estado no tiene que ser en ningun momento cumple de la gestación subrogada,The state does not have to be  ningun moment conforms of the surrogacy
285,ARG2,2.0,AGAINST,284,RA,,,no és possible legalitzar la gestació subrogada ,no es posible legalizar la gestación subrogada,is not possible to legalise the surrogacy
286,ARG2,2.0,AGAINST,285,RA,,,perquè perpetua la desigualtat,porque perpetúa la desigualdad,so that it perpetuates the inequality
287,ARG2,2.0,AGAINST,,,,,una desigualtat en la qual veiem que la dona està siguent explotada ja que s'està veient abocada a aquestes pràctiques per una necessitat econòmica,una desigualdad en la cual vemos que la mujer está siguent explotada puesto que se está viendo abocada a estas prácticas por una necesidad económica,an inequality at which view that the wife is siguent exploded since it is viewing  tipped at these practices for an economic necessity
288,ARG2,2.0,AGAINST,,,,,és un procés que multa al cos,es un proceso que multa en el cuerpo,is a process that fine at the body
289,ARG2,2.0,AGAINST,287,RA,,,únicament està reservat per unes poques parelles adinerades,únicamente está reservado por unas pocas parejas adineradas,only is reserved by some few couples adinerades
290,ARG2,2.0,AGAINST,288,RA,,,és un procés que estigmatitza i amb uns riscos molt grans,es un proceso que estigmatiza y con unos riesgos muy grandes,is a process that stigmatises and with some very big risks
291,ARG2,2.0,AGAINST,288,RA,,,i una repercussió per a la dona físiques i emocionals enormes,y una repercusión para la mujer físicas y emocionales enormes,and a repercussion for the physical and emotional wife huge
292,ARG2,2.0,AGAINST,291,RA,,,ja que es veu desprenguda del seu propi fill i es veu obligada a teràpies d'hormonació a teràpia de fecundació in vitro,puesto que se ve desprenguda de su propio hijo y se ve obligada a terapias de hormonació a terapia de fecundación in vitro,since it views  desprenguda of his own son and views  obliged at therapies of hormonació at therapy of fecundació in vitro
293,ARG2,2.0,AGAINST,,,,,i lo pitjor de tot de tot aquest procés la dona a penes té benefici,y lo peor de todo de todo este proceso la mujer apenas tiene beneficio,and lo worse of everything of all this process the wife hardly has benefit
294,ARG2,2.0,AGAINST,293,RA,,,quasi tot s'ho endú els intermediaris,casi todo se lo lleva los intermediarios,almost everything wears it the intermediaries
295,ARG2,2.0,AGAINST,,,,,la gestació subrogada no es pot definir d'altra forma que persones riques que alquilen el cos de persones pobre,la gestación subrogada no se puede definir de otra forma que personas ricas que alquilen el cuerpo de personas pobre,the surrogacy can not  define of other form that affluent persons that alquilen the body of poor persons
296,ARG2,2.0,AGAINST,,,,,aquesta pràctica està portant a una deslocalització i un turisme reproductiu,esta práctica está llevando a una deslocalización y un turismo reproductivo,this practice is taking at a deslocalització and a reproductive tourism
297,ARG2,2.0,AGAINST,296,RA,,,un turisme reproductiu que bé vosaltres heu defingut,un turismo reproductivo que bien vosotros habéis defingut,a reproductive tourism that well you have defended
298,CONC,,AGAINST,,,,,bon dia a tot el món m'agradaria començar a concloure este meravellós debat  gràcies a l'equip contrari jurat i públic assistent per tota aquesta companyia sí  i m'agradaria començar amb un petit recolliment del  que avui hem sentit en primer lugar els punts en comú i és  que han estat molt l'equip contrari ens ha comprat que som depredadors  i que la nostra condició de depredadors s'unix al lliure comerç el equip contrari  ens ha comprat que l'estat ha de posar límits  i que hi ha que legalitzar les coses per la seua pròpia existència  els meus companys els han dit una i una altra vegada l'exemple  de l'esclavitud que no tot el que existeix s'ha de legalitzar  i davant del seu exemple de la droga els meus companys lis han dit  si algú dels ací presents pensa que la solució al problema de la droga  és legalitzar-la i és que ens han parlat de l'educació i lis diem  sí a l'educació unida a la prohibició per evitar aquests casos mala praxis  que ocorre avui en dia ens han dit que no prohibixen perquè és paternalista  però ells han decidit intervindre i quan han parlat que és  paternalista perquè decidís sobre la dona li hem contestat  que no n'hi ha lliure elecció sinó si n'hi ha una situació de necessitat  perquè eixos xiquets de les fàbriques no és paternalista  prohibir que se'ls explote no ens han proposat ningun model  però n'hem entés que és un altruista no s'han demostrat les garanties d'aquest model  ni que no classificarà a la dona per a tu a banda el meu company raúl  els s'ha contestat en tot moment aquesta pràctica segueix explotar-la i damunt  s'ha de fer de forma gratuïta és com si aquestes fàbriques damunt  no es pagara i que si cossifica la dona igualment perquè la  uníx a uns rols reproductius a una responsabilitat de parir eixos fills  però no sols per a d'ella sinó per la resta de la societat  a que al final la dona serveix per a parir i la responsabilitat  i la culpabilitat intrínseca en aquest fet  en canvi la nostra tesi s'ha mantés al llarg de tot el debat  en primer lloc davant de la necessitat extrema necessitat i  la que es parla a l'equip contrari hem contestat extremes solucions  la càrrega de la prova estava en qui quina política protegia més la ciutadania  quin estat garantiria un benefici major per a la societat per  a tota la societat a llarg plaç i hem demostrat que han sigut el nostres  mitjançant una tesi de sostenibilitat en primer lloc una sostenibilitat mediambiental  perquè augmentar la població és també fomentar el consum  perquè augmentar la població amb tots els estudis que hem aportat  sols ens pot abocar a una ruïna  no no n'hi ha que augmentar la població ni mitjançant la gestació subrogada  ni mitjançat cap sistema al contrari l'estat ha de lluitar en un mecanisme  i promoure per exemple ajudes a les famílies que tinguen pocs xiquets  de promoure els mètodes anticonceptius permanents  que se limite a aquesta població situació subrogada ja queda superada  que no és necessari ara mateix que sols perjudica  a més hem parlat d'un argument de responsabilitat més sostenibilitat social  i també econòmica perquè  esta pràctica no sols és desastrosa per al medi ambient  sinó també és desastrosa per a tota la societat  de tota la societat especialment del feminisme a les dones a qui afecta  mitjançant eixa cosificació és a unió dels rols reproductius  perquè si al final estem parlant d'efectes de que beneficia més  i unes poques famílies altruistes fent balanç no comparen  res al medi ambient a tota la població i a tot el col·lectiu  de la resta de les dones serien preses per aquesta condició  i mitjançant un econòmic perquè al final parlem d'una pressió de classes  parlem una explotació i parlem una deslocalització cap a les zones  més pobres no senyores i senyors ajudeu-me avui a cremar aquest  déu que és diners ajudeu-nos a fer-nos responsables i a deixar de ser  uns depredadors a no legalitzar la gestació subrogada,buenos días en todo el mundo me gustaría empezar a concluir este maravilloso debate gracias al equipo contrario jurado y público asistente por toda esta compañía sí y me gustaría empezar con un pequeño recogimiento del que hoy hemos sentido en primero lugar los puntos en común y es que han sido mucho el equipo contrario nos ha comprado que somos depredadores y que nuestra condición de depredadores se une al libre comercio el equipo contrario nos ha comprado que el estado tiene que poner límites y que hay que legalizar las cosas por su propia existencia mis compañeros los han dicho una y otra vez el ejemplo de la esclavitud que no todo el que existe se tiene que legalizar y ante su ejemplo de la droga mis compañeros lis han dicho si alguien de los aquí presentes piensa que la solución al problema de la droga es legalizarla y es que nos han hablado de la educación y lis decimos sí a la educación unida a la prohibición para evitar estos casos mala praxis que ocurre hoy en día nos han dicho que no prohíben porque es paternalista pero ellos han decidido intervenir y cuando han hablado que es paternalista porque decidiera sobre la mujer le hemos contestado que no hay libre elección sino si hay una situación de necesidad porque esos niños de las fábricas no es paternalista prohibir que se los explote no nos han propuesto ningun modelo pero hemos entendido que es un altruista no se han demostrado las garantías de este modelo ni que no clasificará a la mujer para tú a banda mi compañero raúl los se ha contestado en todo momento esta práctica sigue explotarla y encima se tiene que hacer de forma gratuita es cómo si estas fábricas encima no se pagara y que si cossifica la mujer igualmente porque la uníx a unos roles reproductivos a una responsabilidad de parir esos hijos pero no solo para de ella sino por el resto de la sociedad a que al final la mujer sirve para parir y la responsabilidad y la culpabilidad intrínseca en este hecho en cambio nuestra tesis se ha mantés a lo largo de todo el debate en primer lugar ante la necesidad extrema necesidad y la que se habla al equipo contrario hemos contestado extremas soluciones la carga de la prueba estaba en quién qué política protegía más la ciudadanía qué sido garantizaría un beneficio mayor para la sociedad para toda la sociedad a largo plaç y hemos demostrado que han sido lo nuestros mediante una tesis de sostenibilidad en primer lugar una sostenibilidad medioambiental porque aumentar la población es también fomentar el consumo porque aumentar la población con todos los estudios que hemos aportado solos nos puede abocar a una ruina no no hay que aumentar la población ni mediante la gestación subrogada ni intermediado ningún sistema al contrario el estado tiene que luchar en un mecanismo y promover por ejemplo ayudas a las familias que tengan pocos niños de promover los métodos anticonceptivos permanentes que se limite en esta población situación subrogada ya queda superada que no es necesario ahora mismo que solo perjudica además hemos hablado de un argumento de responsabilidad más sostenibilidad social y también económica porque esta práctica no solo es desastrosa para el medio ambiente sino también es desastrosa para toda la sociedad de toda la sociedad especialmente del feminismo a las mujeres a quienes afecta mediante esa cosificación es a unión de los roles reproductivos porque si al final estamos hablando de efectos de que beneficia más y unas pocas familias altruistas haciendo balance no comparan nada al medio ambiente en toda la población y a todo el colectivo del resto de las mujeres serían tomadas por esta condición y mediante un económico porque al final hablamos de una presión de clases hablamos una explotación y hablamos una deslocalización hacia las zonas más pobres no señoras y señores ayudadme hoy a quemar este dios que es dinero ayudadnos a hacernos responsables y a dejar de ser unos depredadores a no legalizar la gestación subrogada,good morning all over the world would like me commence at concluding este wonderful debate thanks to the contrary squad vowed and public assistant for all this company aye and would like me commence with a small recolliment of the that today have heard at first lugar the points in common and is that they have been a lot of the contrary squad has bought us that we are predatory and that our condition of predators unites  at the free trade the contrary squad has bought us that the state has to pose limits and that there is that legalise the things for his own existence my partners have the onessaid one and again the example of the slavery that no everything what exists has to legalise  and in front of his example of the drug my partners lis have said if somebody of the here present thinks that the solution at the problem of the drug is to legalise it and is that they have talked us of the nurture and lis say aye at the nurture united at the ban to eschew these bad cases praxis that occurs today at day have said us that they do not prohibit so that it is paternalista but they have decided to intervene and when have talked that it is paternalista so that it decidedon the wife have answered him that no there is free election but if there is a situation of necessity so that axes children of the factories is not paternalista prohibit that it explode the ones have not proposed us ningun model but have understood  that it is an altruist have not evidenced  the guarantees of this model or that it will not classify at the wife for you at band my partner raúl the has answered  at all times this practice tracks to explode it and on has to  make of free form is as if these factories on did not pay  and that if cossificathe wife equally so that it uníx at some rols reproductive at a responsibility to bear axes children but no only for of her but for the rest of the society at that at the end the wife serves to bear and the responsibility and the intrinsic culpability at this fact instead our thesis has  mantés along all the debate in the first place in front of the dire necessity necessity and what talks  at the contrary squad have answered dire solutions the charge of the proof was at who which political protected more the which citizenry beenwould guarantee a main benefit for the society for all the society at long plaç and have evidenced that they have been the ours by means of a thesis of sustainability in the first place an environmental sustainability so that augment the populace is also foster the consumption so that augment the populace with all the surveys that have contributed only can tip us at a ruin no no there is that augment the populace or by means of the surrogacy or mediated any system on the contrary the state has to battle at a mechanism and promote for example aids at the families that have few childrento promote the permanent contraceptive methods that limit  at this populace situation subrogada already stays surpassed that it is not necessary right now that only prejudices besides have talked of an argument of more responsibility social sustainability and also economic so that esta practical no only is disastrous for the environment but also is disastrous for all the society of all the society especially of the feminism at the wives at who affects mediating eixa reification is at union of the rols reproductive so that if at the end are talking of effects of that it benefits more and some few altruistic families making balancedo not compare anything at the environment at all the populace and at all the community of the rest of the wives would be inmates for this condition and by means of an economic so that at the end talk of a pressure of classes talk an exploitation and talk a deslocalització to the poorest zones no ladies and gentlemen aid me today at burning this god that is money aid us at making us managers and at ceasing being some predators at not legalising the surrogacy
