ID (Chronological),TYPE (Part + Person),ARGUMENT NUMBER,TEAM STANCE,RELATED ID,ARGUMENTAL RELATION  TYPE,RELATED ID.1,ARGUMENTAL RELATION  TYPE.1,ADU_CAT,ADU_ES,ADU_EN
92,ARG1,2,AGAINST,88;89;90;91,RA,,,això és el que passa a països com a ucraïna en què estan creant-se orfenats únicament per a aquestos xiquets i xiquetes que ixen defectuosos,esto es el que pasa en países como ucraïna en que están creándose orfanatos únicamente para estos niños y niñas que salen defectuosos,this is what passes at countries as a ucraïna at what are creating  orphanages only for these children and infants that exit defective
93,ARG1,3,FAVOUR,,,,,tota aquesta explotació els conflictes d'interessos es poguessin solucionar amb una legislació adequada com la d'islàndia o canadà,toda esta explotación los conflictos de intereses se pudieran solucionar con una legislación adecuada como la de islàndia o canadà,all this exploitation the conflicts of interests could solve  with a suitable legislation how the of islàndia or canadà
94,ARG1,3,AGAINST,,,,,canadà és un país en què la gestació subrogada altruista està legalitzada,canadà es un país en que la gestación subrogada altruista está legalizada,canadà is a country at what the surrogacy altruist is legalised
95,ARG1,3,AGAINST,,,,,però tenim proves que demostren que estan plantejant-se la seua regulació remunerada,pero tenemos pruebas que demuestren que están planteándose su regulación remunerada,but have proofs that evidence that they are posing  his regulation remunerada
96,ARG1,1,AGAINST,95,RA,73,MA,la gestació subrogada altruista no és realista,la gestación subrogada altruista no es realista,the surrogacy altruistic is not realistic
97,ARG1,1,AGAINST,96,RA,80,MA,és un cavall de troia per a legalitzar la gestació subrogada remunerada ,es un caballo de troia para legalizar la gestación subrogada remunerada,is a horse of troia to legalise the surrogacy remunerada
98,ARG1,3,FAVOUR,95,CA,,,aquesta proposta de llei va ser denegada fa mig any,esta propuesta de ley fue denegada hace medio año,this proposal of law was denegada makes half year
99,ARG1,3,FAVOUR,95,CA,98,MA,la proposta de llei de que fos comercial fos denegada al canadà fa mig any,la propuesta de ley de que fuera comercial fuera denegada al canadà hace medio año,the proposal of law of that it was trading was denegada at the canadà makes half year
100,ARG1,3,FAVOUR,95,CA,98;99,MA,aquesta proposta de llei perquè la maternitat subrogada fos comercial al canadà es denegues fa mig any,esta propuesta de ley porque la maternidad subrogada fuera comercial al canadà se deniegas hace medio año,this proposal of law so that the surrogacy was trading at the canadà  denegues makes half year
101,ARG1,3,AGAINST,,,,,el que voleu és garantir drets,el que voláis es garantizar derechos,what blast is to guarantee right
102,ARG1,3,AGAINST,101,CA,,,garantir drets i protegir-los és el que volem fer amb la il·legalització,garantizar derechos y protegerlos es el que queremos hacer con la ilegalización,guarantee laws and protect them is what want to make with the il·legalització
103,ARG1,3,AGAINST,6;7,MA,,,ser mare i pare és un desig no és un dret,ser madre y padre es un deseo no es un derecho,be mother and father is a wish is not a law
104,ARG1,3,AGAINST,103,RA,,,hi ha nombroses alternatives,hay numerosas alternativas,there is numerous alternatives
105,ARG1,2,AGAINST,103,RA,,,tan sols les persones que poden pagar ho faríem,tan solo las personas que pueden pagar lo haríamos,as only the persons that can pay would make it
106,ARG1,3,AGAINST,105,RA,,,és que és un desig i no un dret,es que es un deseo y no un derecho,is that it is a wish and no a law
107,ARG1,3,FAVOUR,56,RA,,,aquesta regulació pugui evitar que hi hagi una explotació i un estat de dret que tenim a espanya i un sistema sanitari garanteixi totes tots els drets fonamentals,esta regulación pueda evitar que haya una explotación y un estado de derecho que tenemos a espanya y un sistema sanitario garantice todas todos los derechos fundamentales,this regulation can eschew that there is an exploitation and a state by right that have at espanya and a sanitary system guarantee all all the fundamental laws
108,ARG1,3,AGAINST,107,CA,,,el sistema sanitari que tenim actualment garanteix els drets de les dones independentment de si els seus bebès són per gestació subrogada o no ,el sistema sanitario que tenemos actualmente garantiza los derechos de las mujeres independientemente de si sus bebés son por gestación subrogada o no,the sanitary system that have at present guarantees the laws of the wives independently of if his babies are for surrogacy or no
109,ARG1,1,AGAINST,108;102;3,RA,,, legalitzar-lo o no no comportaria cap diferència en la protecció de la dona,legalizarlo o no no comportaría ninguna diferencia en la protección de la mujer,legalise it or no would not comport any difference at the protection of the wife
110,ARG1,3,AGAINST,6;103;106,RA,,,una família no és més que un constructe social és egoista voler traure més nadons al món,una familia no es más que un constructo social es egoísta querer sacar más bebés al mundo,a family is not more that a constructe social is selfish to want to remove more babies at the world
111,ARG1,,AGAINST,,,,,hi ha un col·lectiu que té referent a valència que ja s'ha posicionat en contra de la gestació subrogada,hay un colectivo que tiene en lo referente a valencia que ya se ha posicionado en contra de la gestación subrogada,there is a community that has referent at valence that already has positioned  against of the surrogacy
112,ARG1,3,AGAINST,,,,,parlar d'economia desitjos percentatges i drets està molt bé,hablar de economía deseos porcentajes y derechos está muy bien,talk of economics wishes percentages and laws is very good
113,ARG1,1,AGAINST,,,,,però no ens pot desviar del que estem parlant realment que són éssers humans amb sentiments i amb particularitats que els fan éssers humans,pero no nos puede desviar del que estamos hablando realmente que son seres humanos con sentimientos y con particularidades que los hacen seres humanos,but can not us deflect of the that are talking really that they are human beings with sentiments and with peculiarities that make the ones human beings
114,ARG1,1,AGAINST,,,,,el neonatòleg nils bergman diu que el pitjor que li pot passar a un nounat és que el separen de la seua mare,lo neonatòleg nils bergman dice que el peor que le puede pasar a un neonato es que lo separan de su madre,the neonatòleg nils bergman says that the worst that can pass him at a nounat is that they part his mother's it
115,ARG1,1,AGAINST,3;70;114;6;103,RA,,, això ens deriva al nostre posicionament que és revisar els tràmits de l'adopció sempre en benefici del xiquet,esto nos deriva a nuestro posicionamiento que es revisar los trámites de la adopción siempre en beneficio del niño,this derives us at our positioning that is to revise the formalities of the adoption always for the benefit of the child
116,ARG1,1,AGAINST,3;70;114;115,RA,,,això acabaria amb la mercantilització explotació i aprofitament de les dones,esto acabaría con la mercantilización explotación y aprovechamiento de las mujeres,this would end with the mercantilització exploitation and aprofitament of the wives
117,ARG1,,FAVOUR,,,,,la gestació subrogada és molt dolenta,la gestación subrogada es muy mala,the surrogacy is very mean
118,ARG1,,FAVOUR,,,,,no obstant això és un altre debat,sin embargo es otro debate,nevertheless is another debate
119,ARG1,,FAVOUR,117;118,RA,,,la gestació subrogada és bona dolenta,la gestación subrogada es buena mala,the surrogacy is good mean
120,ARG1,3,FAVOUR,,,,,s'ha de legalitzar o no,se tiene que legalizar o no,has to legalise  or no
121,ARG1,3,FAVOUR,,,,,generalització del regne unit,generalización del reino unido,generalisation of the realm united
122,ARG1,3,FAVOUR,121,RA,71,CA,només un exemple dient que al final el regne unit no era altruista,solo un ejemplo diciendo que al final el reino unido no era altruista,only an example saying that at the end the realm united was not altruist
123,ARG1,3,FAVOUR,122,RA,,,és d'una mala legislació i d'una mala legalització com ja es va demostrar,es de una mala legislación y de una mala legalización como ya se demostró,is of a bad legislation and of a bad legalisation how already evidenced
124,ARG1,3,FAVOUR,123,MA,,,al regne unit acudir en altres països per explotar les dones allà perquè no s'estava legislant correctament,en el reino unido acudir en otros países para explotar las mujeres allá porque no se estaba legislando correctamente,at the realm united attend at other countries to explode the wives there so that it was not  legislating properly
125,ARG1,3,FAVOUR,95,CA,,,al canadà ara s'està fent comercial,al canadà ahora se está haciendo comercial,at the canadà now is  making trading
126,ARG1,3,FAVOUR,94;95,CA,,,no és cert,no es cierto,is not some
127,ARG1,3,FAVOUR,95,CA,,,es va fer una proposta de llei per tal que es fes comercial,se hizo una propuesta de ley para que se hiciera comercial,made  a proposal of law in order that it made  trading
128,ARG1,3,FAVOUR,94;95,CA,,,però aquesta proposta es va denegar fa mig any perquè anava contra la constitució del canadà,pero esta propuesta se denegó hace medio año porque iba contra la constitución del canadà,but this proposal goes  denegar makes half year so that it went against the constitution of the canadà
129,ARG1,3,FAVOUR,128,RA,,,ho diuen el cbc com també l'informe de pamela uve doble white que és experta constitucionalista del canadà en el qual parla de la gestació subrogada en el marc del canadà i parlava que només podia ser altruista,lo dicen el cbc como también el informe de pamela uve doble white que es experta constitucionalista del canadà en el cual habla de la gestación subrogada en el marco del canadà y hablaba que solo podía ser altruista,say it the cbc how also the report of pamela uve double white that it is expert constitucionalista of the canadà at which talks of the surrogacy at the frame of the canadà and talked that only could be altruist
130,ARG1,3,FAVOUR,129,RA,,,per això es va rebutjar aquesta gestació comercial,por eso se rechazó esta gestación comercial,therefore it rebuffed  this trading gestation
131,ARG1,1,FAVOUR,,,,,l'altruisme no existeix,el altruismo no existe,the altruism does not exist
132,ARG1,1,FAVOUR,73;96,CA,,,no obstant per l'informe realitzat per la bbc en el qual es feia entrevistes justament a les dones gestants al canadà justament el que aquestes dones estan fent en una voluntat d'ajudar aquelles que no podien gestar per diferents condicions,no obstante por el informe realizado por la bbc en el cual se hacía entrevistas justamente a las mujeres gestantes al canadà justamente el que estas mujeres están haciendo en una voluntad de ayudar aquellas que no podían gestar por diferentes condiciones,no obstant for the report realised by the bbc at which made  glimpsed justly at the wives gestants at the canadà justly what these wives are making at a will to aid those that could not gestar for distinct conditions
133,ARG1,1,FAVOUR,131,RA,,,es feia una anàlisi de per què es podia arribar a pensar que l'altruisme no existeix ,se hacía un análisis de por qué se podía llegar a pensar que el altruismo no existe,made  an analysis of how come could reach  think that the altruism does not exist
134,ARG1,1,FAVOUR,,,,,vostés no se'n poden adonar que l'altruisme sí que existeix,ustedes no se pueden dar cuenta que el altruismo sí que existe,you no can  adonar that the altruism aye that it exists
135,ARG1,1,FAVOUR,134,RA,,,si no existís no existirien coses com ong o com donacions entre altres coses,si no existiera no existirían cosas como ong o como donaciones entre otras cosas,if it did not exist would not exist things how ong or how donations among other things
136,ARG1,3,FAVOUR,33,RA,,,parleu de regular i legalitzar la gestació subrogada podríeu posar exemples de com fer-ho,habláis de regular y legalizar la gestación subrogada podríais poner ejemplos de cómo hacerlo,talk to regulate and legalise the surrogacy could pose examples of how make it
137,ARG1,3,FAVOUR,33;136,RA,,,la gestació subrogada s'ha de legalitzar com ho estan fent islàndia canadà i sud-àfrica,la gestación subrogada se tiene que legalizar como lo están haciendo islàndia canadà y sur-àfrica,the surrogacy has to legalise  how are it making islàndia canadà and south-àfrica
138,ARG1,,FAVOUR,137,RA,,,l'exemple d'islàndia és el més paradigmàtic perquè justament es basa en les nostres idees,el ejemplo de islàndia es lo más paradigmático porque justamente se basa en nuestras ideas,the example of islàndia is the most paradigmatic so that justly bases  at our ideas
139,ARG1,1,FAVOUR,36,RA,,,s'ha de legalitzar en primer lloc perquè és una realitat que existeix,se tiene que legalizar en primer lugar porque es una realidad que existe,has to legalise  in the first place so that it is a reality that exists
140,ARG1,1,FAVOUR,139,RA,4;102,CA,si no es legalitza s'arriba a una situació de tracta de persones,si no se legaliza se llega a una situación de trata de personas,if it does not legalise  reaches  a situation of treats of persons
141,ARG1,3,FAVOUR,,,,,les directrius per legalitzar-ho les estableix el comitè de bioètica espanyol així com el comitè de d'antologia ,las directrices para legalizarlo las establece el comité de bioética español así como el comité de de antología,the guidelines to legalise it the establishes the committee of Spanish bioethics as well as the committee of of anthology
142,ARG1,,AGAINST,139,CA,,,no creieu que és molt perillós legalitzar tot totes aquelles realitats que existeixen,no creéis que es muy peligroso legalizar todo todas aquellas realidades que existen,do not think that it is very dangerous to legalise every all those realities that exist
143,ARG1,,FAVOUR,142,MA,,,és perillós legalitzar totes les realitats que existeixen,es peligroso legalizar todas las realidades que existen,is dangerous to legalise all the realities that exist
144,ARG1,,FAVOUR,143,CA,,,però la maternitat subrogada el que és perillós és no legalitzar-la,pero la maternidad subrogada el que es peligroso es no legalizarla,but the surrogacy what is dangerous is to not to legalise it
145,ARG1,1,FAVOUR,4;8,MA,,,legalitzar-la legitima la cosificació perquè no es pot mercantilitzen el cos de la dona,legalizarla legitima la cosificación porque no se puede mercantilizan el cuerpo de la mujer,legalise it legitimates the reification so that it can not  mercantilitzen the body of the wife
146,ARG1,2,FAVOUR,5;19,MA,,,la feminització de la pobresa de les dones més vulnerables i de les desigualtats,la feminización de la pobreza de las mujeres más vulnerables y de las desigualdades,the feminització of the poverty of the most vulnerable wives and of the inequalities
147,ARG1,1;2,FAVOUR,146,RA,,,s'ha de legalitzar perquè espanya ha de deixar de ser còmplice de les violacions de drets humans,se tiene que legalizar porque espanya tiene que dejar de ser cómplice de las violaciones de derechos humanos,has to legalise  so that espanya has to cease be accomplice of the rapes of human laws
148,ARG1,1,FAVOUR,,,,,la realitat espanyola es basa en dos pilars,la realidad española se basa en dos pilares,the Spanish reality bases  at two pillars
149,ARG1,1,FAVOUR,148,RA,,,demostren informes de l'oms una creixent infertilitat,demuestran informes del olmos una creciente infertilidad,evidence reports of the elms a growing infertility
150,ARG1,1,FAVOUR,148,RA,,,una distribució del mercat laboral que és discriminatòria per la dona,una distribución del mercado laboral que es discriminatoria por la mujer,a distribution of the labour market that is discriminatory for the wife
151,ARG1,3,FAVOUR,,,,,tenim la previsió de l'article deu de la llei de tècniques de reproducció assistida que ja prohibeix aquests contractes de gestació subrogada,tenemos la previsión del artículo debe de la ley de técnicas de reproducción asistida que ya prohíbe estos contratos de gestación subrogada,have the forecast of the article owes of the law of technicians of reproduction assisted that already prohibits these agreements of surrogacy
152,ARG1,3,FAVOUR,,,,,però per l'interès del menor perquè sempre s'ha de protegir més els nens,pero por el interés del menor porque siempre se tiene que proteger más los niños,but for the interest of the minor so that always has to  protect more the boys
153,ARG1,1,FAVOUR,,,,,l'exemple paradigmàtic d'ucraïna,el ejemplo paradigmático de ucraïna,the paradigmatic example of ucraïna
154,ARG1,1,FAVOUR,,,,,va un espanyol i té tota llibertat pot anar a ucrania tenir un fill inscrit a espanya,va un español y tiene toda libertad puede ir a ucrania tener un hijo inscrito a espanya,futile a Spaniard and has every liberty can go at ucrania have a son inscribed at espanya
155,ARG1,1,FAVOUR,153;154,RA,152,MA,és protegir l'interés del menor,es proteger el interés del menor,is to protect the interest of the minor
156,ARG1,1,FAVOUR,151;152;153;154;155,RA,,,al final el que es produeix a espanya és que hi ha una prohibició que no serveix per res,al final el que se produce a espanya es que hay una prohibición que no sirve por nada,at the end what produces  at espanya is that there is a ban that does not serve for nothing
157,ARG1,1,FAVOUR,,,,,hi ha una falta d'harmonització internacional com defensen ronald cohen o el propi comitè de bioètica espanyol,hay una falta de armonización internacional como defienden ronald cohen o el propio comité de bioética español,there is a fault of international harmonisation how defend ronald cohen or the own committee of Spanish bioethics
158,ARG1,1,FAVOUR,43;50,RA,,,això ens dóna un turisme reproductiu que es tradueix en nou-cents setanta-sis nens inscrits i els quals només ho poden fer les elits domèstiques,esto nos da un turismo reproductivo que se traduce en novecientos setenta y seis niños inscritos y los cuales solo lo pueden hacer las élites domésticas,this gives us a reproductive tourism that translates  at nine hundred seventy-six boys inscribed and which only can it make the domestic elites
159,ARG1,1,FAVOUR,158,MA,43;50,RA,una de les conseqüències d'aquesta no legalització és que és una desigualtat dins del país que és una tècnica que només poden acudir les elits domèstiques,una de las consecuencias de esta no legalización es que es una desigualdad dentro del país que es una técnica que solo pueden acudir las élites domésticas,one of the consequences of this no legalisation is that it is an inequality in the country that is a technician that only can attend the domestic elites
160,ARG1,3,AGAINST,,,,,què en penseu de què es faci un projecte comú internacional on es prohibeixi tot tots la legislació subroga ,qué pensáis de que se haga un proyecto común internacional donde se prohíba todo todos la legislación subroga,what think  of what make  an international common project where prohibit  every all the legislation subroga
161,ARG1,3,FAVOUR,,,,,això no és possible com com demostra el dret internacional públic,esto no es posible como cómo demuestra el derecho internacional público,this is not possible how how evidences the public international law
162,ARG1,3,FAVOUR,161,RA,,,hi ha una falta harmonització internacional,hay una falta armonización internacional,there is a fault international harmonisation
163,ARG1,3,FAVOUR,161;162,RA,,,com defensa també ronald cohen a la seva en el seu informe sobre turisme circumentiu i és que això aniria atemptaria contra sobirania d'altres estats i llavors no es podria donar terme a la realitat,como defensa también ronald cohen a la suya en su informe sobre turismo circumentiu y es que esto iría atentaría contra soberanía otros estados y entonces no se podría dar término a la realidad,how defence also ronald cohen at his at his report on tourism circumentiu and is that this would go would attack against statehood of other states and then could not  give term at the reality
164,ARG1,2,FAVOUR,69;148;163,RA,69;148,MA,espanya està només sent còmplice d'aquests estats puguin regular com vulguin,espanya está solo siendo cómplice de estos estados puedan regular como quieran,espanya is only being accomplice of these states can regulate how want to
165,ARG1,1;2,FAVOUR,164,RA,,, això passa com diuen en la recta internacional de metges del món igual que passava amb l'avortament es prohibia espanya però al final els rics acudien un altre país ja avortàven quan volien,esto pasa como dicen en la recta internacional de médicos del mundo igual que pasaba con el aborto se prohibía espanya pero al final los ricos acudían otro país ya avortàven cuando querían,this passes how say at the straight international of doctors in the world the same that it passed with the abortion prohibited  espanya but at the end the affluent attended another country already avortàven when wanted to
166,ARG1,2,FAVOUR,165,RA,,,demostren l'isaki moto doctora en dret i bioètica com també demostra kristin bergen doctora en constitucional de la universitat de fordham i és que la falta d'estats garantistes del que es produeix és que hi hagi una explotació de la dona en aquests països,demuestran la isaki moto doctora en derecho y bioética como también demuestra kristin bergen doctora en constitucional de la universidad de fordham y es que la falta de estados garantistas del que se produce es que haya una explotación de la mujer en estos países,evidence the isaki motorbike doctor at law and bioethics how also evidences kristin bergen doctor at constitutional of the university of fordham and is that the fault of states garantistes of the that produces  is that there is an exploitation of the wife at these countries
167,ARG1,2,FAVOUR,69;148;163;164;165,RA,69;148;164,MA,espanya estigui sent només còmplice,espanya esté siendo solo cómplice,espanya was being only accomplice
168,ARG1,2,FAVOUR,146,RA,,,feminització de la pobresa i les dones es veurien advocades a aquesta esclavitud,feminización de la pobreza y las mujeres se verían abogadas a esta esclavitud,feminització of the poverty and the wives would view  lawyers at this slavery
169,ARG1,1;2,FAVOUR,,,,,ja es veuen abocades a aquesta esclavitud abocades a ucrania es veuen abocades a geòrgia es veuen abocades a l'índia abocades en molts casos als estats units,ya se ven abocadas a esta esclavitud abocadas a ucrania se ven abocadas a geòrgia se ven abocadas a la india abocadas en muchos casos en los estados unidos,already view  tipped at this slavery tipped at ucrania view  tipped at geòrgia view  tipped at the Indian tipped at a lot of cases at the states united
170,ARG1,1;2,FAVOUR,69;148;163;164;165;167;168;169,RA,,,que no estigui donant-se espanya no vol dir que els espanyols no estiguem sent responsables de que s'estigui donant en altres llocs,que no esté dándose espanya no quiere decir que los españoles no estemos siendo responsables de que se esté dando en otros lugares,that was not giving espanya does not mean that the Spanish are not being managers of that it was giving  at other places
171,ARG1,1;2,FAVOUR,69;148;163;164;165;167;168;169;170,RA,,,és més l'alt comissionat de l'onu defensa que espanya ha de vetllar no només per la dignitat dels espanyols sinó per la dignitat de tots els ciutadans del món,es más el alto comisionado del onu defiende que espanya tiene que velar no solo por la dignidad de los españoles sino por la dignidad de todos los ciudadanos del mundo,is more the tall comissionat of the onu defence that espanya has to watch no only for the dignity of the Spanish but for the dignity of all the citizens in the world
172,ARG1,1;2,FAVOUR,69;148;163;164;165;167;168;169;170;171,RA,,,les conseqüències que estan tenint els espanyols en altres països és aquesta explotació de la dona,las consecuencias que están teniendo los españoles en otros países es esta explotación de la mujer,the consequences that are having the Spanish at other countries is this exploitation of the wife
173,ARG1,1;2,FAVOUR,69;148;163;164;165;167;168;169;170;171;172,RA,69;148;164;167,MA,l'estat espanyol està sent còmplice,el estado español está siendo cómplice,the Spanish state is being accomplice
174,ARG1,1;2,FAVOUR,165;166;167;168;169;170;171;172;173,RA,,,això es soluciona legalitzant,esto se soluciona legalizando,this solves  legalising
175,ARG2,1,AGAINST,73;96,MA,,,la legalització de la gestació subrogada de manera altruista no és realista,la legalización de la gestación subrogada de manera altruista no es realista,the legalisation of the surrogacy of altruistic mode is not realistic
176,ARG2,1,AGAINST,73;96;131,RA,,,hem vingut a aquest debat a parlar de fades i a parlar de coses que no són reals m'agradaria que l'altre equip m'haguera avisat abans per a preparar-me un debat sobre fades i sobre coses irreals i no un debat sobre gestació subrogada,hemos venido a este debate a habla de hadas y a habla de cosas que no son reales me gustaría que el otro equipo me hubiera avisado antes para prepararme un debate sobre hadas y sobre cosas irreales y no un debate sobre gestación subrogada,have come at this debate at speech of fairies and at speech of things that are not real would like me that the other squad had warned me before to prepare me a debate on fairies and on unreal things and no a debate on surrogacy
