ID (Chronological),TYPE (Part + Person),ARGUMENT NUMBER,TEAM STANCE,RELATED ID,ARGUMENTAL RELATION  TYPE,RELATED ID.1,ARGUMENTAL RELATION  TYPE.1,RELATED ID.2,ARGUMENTAL RELATION  TYPE.2,ADU_CAT,ADU_ES,ADU_EN
87,ARG1,3,FAVOUR,86,RA,,,,,no només es tradueix en les nou-cents setanta-sis inscripcions d'aquests nens actualment,no solo se traduce en las nueve-cents setenta y seis inscripciones de estos niños actualmente,no only translates  at the nine-cents seventy-six inscriptions of these boys at present
88,ARG1,2;3,FAVOUR,17;18;19;20;21;22;23;83;84;85,RA,,,,,només siguin les elits domèstiques que puguin acudir aquesta pràctica donant una desigualtat dins el país,solo sean las élites domésticas que puedan acudir esta práctica dando una desigualdad dentro del país,only are the domestic elites that can attend this practice giving an inequality in the country
89,ARG1,2;3,AGAINST,83,CA,,,,,està suggerint que seria millor no deixar entrar els nens que neixen en països estrangers,está sugiriendo que sería mejor no dejar entrar los niños que nacen en países extranjeros,is suggesting that it would be better not letting enter the boys that are born at foreign countries
90,ARG1,1;2;3,FAVOUR,89,CA,,,,,legalització d'aquesta maternitat subrogada a espanya,legalización de esta maternidad subrogada a espanya,legalisation of this surrogacy at espanya
91,ARG1,2,FAVOUR,,,,,,,segons la red internacional de metges del món fa un símil entre la maternitat subrogada i l'avortament,según la red internacional de médicos del mundo hace un símil entre la maternidad subrogada y el aborto,according to the red international of doctors in the world makes a simile among the surrogacy and the abortion
92,ARG1,2,FAVOUR,91,RA,,,,,quan l'avortament està prohibit que només els rics aportaven en uns altres llocs i  l'avortament era precari,cuando el aborto está prohibido que solo los ricos aportaban en otros lugares y el aborto era precario,when the abortion is prohibited that only the affluent contributed at other places and the abortion was precarious
93,ARG1,2,FAVOUR,17;88;92,RA,,,,,contradicció amb la pròpia igualtat,contradicción con la propia igualdad,contradiction with the own equality
94,ARG1,2,FAVOUR,92;93,RA,,,,,pobresa és nom de dona,pobreza es nombre de mujer,poverty is name of wife
95,ARG1,2,FAVOUR,12;16;17;21;84;86,RA,,,,,com diu l'isaki moto així com cristina broker catedràtica de la universitat de fordham la principal conseqüència del turisme reproductiu és justament que els espanyols marxin a altres països en el qual les legislacions són súper laxes i no es protegeix a les dones per tenir aquells fills que els agradaria tenir aquí,como dice la isaki moto así como cristina broker catedrática de la universidad de fordham la principal consecuencia del turismo reproductivo es justamente que los españoles marchen a otros países en el cual las legislaciones son súper laxas y no se protege a las mujeres para tener aquellos hijos que los gustaría tener aquí,how says the isaki motorbike as well as cristina broker catedràtica of the university of fordham the principal consequence of the reproductive tourism is justly that the Spanish leave at other countries at which the legislations are súper laxes and does not protect  at the wives to have those children that would like the ones have here
96,ARG1,2,FAVOUR,95,RA,,,,,se'n van molts cops a canadà estats units com ucrania,se van muchos golpes a canadà estados unidos como ucrania,go  a lot of bumps at canadà states united how ucrania
97,ARG1,2;3,FAVOUR,,,,,,,segons l'alt comissionat de l'onu els drets humans i la dignitat humana no depèn només dels ciutadans o del que estigui passant a espanya,según el alto comisionado del onu los derechos humanos y la dignidad humana no depende solo de los ciudadanos o del que esté pasando a espanya,according to the tall comissionat of the onu the human laws and the human dignity does not depend only of the citizens or of the that was passing at espanya
98,ARG1,2;3,FAVOUR,,,,,,,a espanya com a qualsevol altre país s'ha de vetllar pels drets humans arreu del món,a espanya como cualquier otro país se tiene que velar por los derechos humanos en todo el mundo,at espanya as a any one other country has to watch  for the human laws all over in the world
99,ARG1,2;3,FAVOUR,74,MA,,,,,espanya és còmplice d'aquestes violacions de drets humans,espanya es cómplice de estas violaciones de derechos humanos,espanya is accomplice of these rapes of human laws
100,ARG1,2;3,FAVOUR,99,RA,,,,,les està permetent,las está permitiendo,the is permitting
101,ARG1,2;3,FAVOUR,99;100,RA,,,,,s'està mirant el melic,se está mirando el ombligo,is looking  the navel
102,ARG1,2;3,FAVOUR,101,MA,,,,,està tancant els ulls contra la realitat que ja existeix,está cerrando los ojos contra la realidad que ya existe,is shutting the eyes against the reality that already exists
103,ARG1,2;3,FAVOUR,74;99,CA,,,,,espanya deixi de ser còmplice,espanya deje de ser cómplice,espanya cease to be accomplice
104,ARG1,2;3,FAVOUR,103,RA,,,,,evitar que hi hagi aquestes granges a ucrania aquestes granges a geòrgia dels quals els espanyols estem contribuint activament,evitar que haya estas granjas a ucrania estas granjas a geòrgia de los cuales los españoles estamos contribuyendo activamente,eschew that there are these farms at ucrania these farms at geòrgia of which the Spanish are contributing actively
105,ARG1,2;3,FAVOUR,103;104,RA,,,,,agafant el model d'islàndia agafant el model de canadà i el model de sud-àfrica,cogiendo el modelo de islàndia cogiendo el modelo de canadà y el modelo de sur-àfrica,seizing the model of islàndia seizing the model of canadà and the model of south-àfrica
106,ARG1,2;3,FAVOUR,7;8;9;10;11;12;13;14;15;16;17;18;19;20;21;22;23;24;97,RA,,,,,a islàndia es va plantejar aquest mateix dilema moral,a islàndia se planteó este mismo dilema moral,at islàndia posed  this same moral dilemma
107,ARG1,2;3,FAVOUR,106,RA,,,,,no podem deixar que es cosifiqui la dona,no podemos dejar que se cosifiqui la mujer,can not let that  cosifiqui the wife
108,ARG1,2;3,FAVOUR,106;107,RA,,,,,no podem deixar que es pagui pels úters de les dones,no podemos dejar que se pague por los úteros de las mujeres,can not let that it pay  for the wombs of the wives
109,ARG1,2;3,FAVOUR,106;107;108,RA,,,,,no podem privar de drets a les dones,no podemos privar de derechos a las mujeres,can not deprive of laws to the wives
110,ARG1,2;3,FAVOUR,104,RA,,,,,agafem aquesta pràctica la legalitzem al nostre país i fem que sigui un estat garantista,cogemos esta práctica la legalizamos en nuestro país y basura que sea un estado garantista,seize this practice legalise it at our country and muck that was a state garantista
111,ARG1,2;3,FAVOUR,110,RA,,,,,s'estableixen certes condicions que vénen establertes pel mateix comitè de bioètica el mateix comitè deontologia,se establecen ciertas condiciones que vienen establecidas por el mismo comité de bioética el mismo comité deontología,establish  some conditions that come established by the same committee of bioethics the same committee deontology
112,ARG1,2;3,FAVOUR,96;105,RA,,,,,pamela white de la universitat de kent va fer un estudi de com havia canviat la regulació de canadà des de que s'havia legislat,pamela white de la universidad de kent hizo un estudio de cómo había cambiado la regulación de canadà desde que se había legislado,pamela white of the university of kent made a survey of how had capsized the regulation of canadà since that it had legislated
113,ARG1,2;3,FAVOUR,,,,,,,va trobar és que els canadencs s'acullen a aquesta legislació garantista dels drets de les dones no se les cosificava per poder realitzar aquestes pràctiques,encontró es que los canadienses se acogen a esta legislación garantista de los derechos de las mujeres no se las cosificava para poder realizar estas prácticas,found is that the Canadians receive  at this legislation garantista of the laws of the wives no  the cosificava to be able to realise these practices
114,ARG1,2;3,FAVOUR,,,,,,,no acudien a tercers països,no acudían a terceros países,did not attend at third countries
115,ARG1,2;3,FAVOUR,43,CA,,,,,no contribuien en aquesta explotació,no contribuien en esta explotación,no contribuien at this exploitation
116,ARG1,3,AGAINST,,,,,,,la llei seca dels anys vint i trenta,la ley seca de los años veinte y treinta,the dry law of the years twenty and thirty
117,ARG1,3,AGAINST,116,RA,,,,,ja sabien què feien quan il·legalitzen una pràctica com aquesta,ya sabían qué hacían cuando ilegalizan una práctica como esta,already knew what made when outlaw a practice how this
118,ARG1,3,AGAINST,116;117,RA,,,,,la gent que participava a les màfies per introduir l'alcohol al país ja sabia què és lo que estàven proporcionant a la gent local,la gente que participaba a las mafias para introducir el alcohol en el país ya sabía qué es lo que estàven proporcionando a la gente local,the persons that took part at the mafias to introduce the alcohol at the country already knew what is lo that estàven providing at the local persons
119,ARG1,3,AGAINST,117,RA,,,,,si nosaltres ens plantegem legalitzar la gestació subrogada estarem donant la possibilitat a un munt de gent d'utilitzar aquestes instal·lacions tan absolutament cares que s'instal·len als hospitals per practicar aquesta pràctica de forma completament il·legítima ,si nosotros nos planteamos legalizar la gestación subrogada estaremos dando la posibilidad a un montón de gente de utilizar estas instalaciones tan absolutamente caras que se instalan en los hospitales para practicar esta práctica de forma completamente ilegítima,if we pose us legalise the surrogacy will be giving the possibility at a pile of persons to utilise these installations as absolutely expensive that install  at the hospitals to practice this practice of form entirely illegitimate
120,ARG1,2;3,AGAINST,,,,,,,perquè no és millor legalitzar amb unes garanties que prohibir-ho i crear mercats negres o màfies,porque no es mejor legalizar con unas garantías que prohibirlo y crear mercados negros o mafias,so that it is not better to legalise with some guarantees that prohibit it and create black markets or mafias
121,ARG1,3,AGAINST,,,,,,,és molt difícil fer un sistema on totes aquestes garanties siguin infal·libles i siguin dignes per totes les parts involucrades,es muy difícil hacer un sistema donde todas estas garantías sean infalibles y sean dignas por todas las partes involucradas,is very difficult to make a system where all these guarantees are infallible and are worthy for all the parts involved
122,ARG1,3,AGAINST,,,,,,,no legalitzar un tipus d'explotació sobre una dona és dolent,no legalizar un tipo de explotación sobre una mujer es doliendo,not legalising a type of exploitation on a wife is hurting
123,ARG1,3,AGAINST,,,,,,,la documentació que reben els nens que neixen en gestació subrogada en altres països,la documentación que reciben los niños que nacen en gestación subrogada en otros países,the documentation that get the boys that are born at surrogacy at other countries
124,ARG1,3,AGAINST,122;123,RA,,,,,quan una persona vol morir vol practicar eutanàsia el seu patiment personal i sap que està una malaltia terminal va a un altre país ho practica,cuando una persona quiere morir quiere practicar eutanasia su sufrimiento personal y sabe que está una enfermedad terminal va a otro país lo practica,when a person wants to die wants to practice euthanasia his personal suffering and knows that it is a terminal sickness goes at another country practices it
125,ARG1,3,AGAINST,124,RA,,,,,espanya es documenta que aquesta persona ho ha fet,espanya se documenta que esta persona lo ha hecho,espanya documents  that this person has made it
126,ARG1,3,FAVOUR,,,,,,,no creu vosté que espanya tenint el tercer millor sistema sanitari del món podria garantir una llibertat psicològica moral i física per les mares gestants,no cree usted que espanya teniendo lo tercero mejor sistema sanitario del mundo podría garantizar una libertad psicológica moral y física por las madres gestantes,does not think you that espanya having the third better sanitary system in the world could guarantee a moral psychological liberty and physicist for the mothers gestants
127,ARG1,3,AGAINST,126,CA,,,,,no es pot fer una valoració psicològica completa d'una persona per garantir que aquesta persona pot fer una gestació amb totes les garanties suficients,no se puede hacer una valoración psicológica completa de una persona para garantizar que esta persona puede hacer una gestación con todas las garantías suficientes,can not  make a complete psychological appraisal of a person to guarantee that this person can make a gestation with all the sufficient guarantees
128,ARG1,3,AGAINST,,,,,,,molts d'aquests sistemes a favor de la subrogada diuen que garantiran tots els drets de les persones involucrades,muchos de estos sistemas a favor de la subrogada dicen que garantizarán todos los derechos de las personas involucradas,many of these systems in favour of the subrogada say that they will guarantee all the laws of the persons involved
129,ARG1,2,AGAINST,128,RA,,,,,garanteixes el dret de la gestant a decidir si vol quedar-se el nen o vol donar-lo a la família on hauria signat prèviament ho faria,garantizas el derecho de la gestante a decidir si quiere quedarse el niño o quiere darlo a la familia donde habría firmado previamente lo haría,guarantee the law of the gestant at deciding if it wants to stay the boy or wants to give it at the family where would have signed previously would make it
130,ARG1,2,AGAINST,,,,,,,exposant el menor,exponiendo el menor,exposing the minor
131,ARG1,2,AGAINST,129;130,RA,,,,,hi haurà un temps que el menor no tindrà pares,habrá un tiempo que el menor no tendrá pares,there will be a time that the minor will not parents
132,ARG1,2,AGAINST,129;130;131,RA,,,,,hi haurà un temps que la mare estarà decidint si realment vol tenir aquest nen per ella o vol donar-lo ,habrá un tiempo que la madre estará decidiendo si realmente quiere tener este niño por ella o quiere darlo,there will be a time that the mother will be deciding if really wants to have this boy for her sake or wants to give it
133,ARG1,2,AGAINST,43;122,RA,,,,,regularitzant això  desapareixeria ,regularizando esto desaparecería,regularitzant this would disappear
134,ARG1,2,AGAINST,119,MA,,,,,no tenim les instal·lacions per crear tantes estacions com perquè apareguin granges de dones,no tenemos las instalaciones para crear tantas estaciones como porque aparezcan granjas de mujeres,do not have the installations to create so many seasons how so that they appear farms of wives
135,ARG1,2,AGAINST,118;119;120;134,RA,,,,,les màfies s'apoderen d'aquestes instal·lacions,las mafias se apoderan de estas instalaciones,the mafias  apoderen of these installations
136,ARG1,2,AGAINST,,,,,,,quina opinió li mereix que la la legislació garantista d'islàndia ha impedit que hi hagi una explotació a països en vies de desenvolupament hi hagi unes estructures on s'estan garantint aquests drets de totes les dones,qué opinión le merece que la la legislación garantista de islàndia ha impedido que haya una explotación a países en vías de desarrollo haya unas estructuras donde se están garantizando estos derechos de todas las mujeres,which opinion merits him that the the legislation garantista of islàndia has impeded that there is an exploitation at countries at roads of development there are some structures where are guaranteeing  these laws of all the wives
137,ARG1,2,AGAINST,,,,,,,es garantien tots els drets,se garantizaban todos los derechos,guaranteed  all the laws
138,ARG1,2,AGAINST,136;137,RA,114,CA,,,hi ha dades amb múltiples estudis i múltiples diaris on el setanta-cinc per cent de les estacions subrogades del canadà es realitzen a l'exterior,hay datos con múltiples estudios y múltiplos diarios donde el setenta y cinco por ciento de las estaciones subrogadas del canadà se realizan a la exterior,there are data with multiple surveys and daily multiples where the seventy-five percent of the seasons subrogades of the canadà realise  at the exterior
139,ARG1,2,AGAINST,,,,,,,no els agraden les seves condicions,no los gustan sus condiciones,do not like the ones his conditions
140,ARG1,2,AGAINST,139,RA,,,,,tenen condicions massa estrictes,tienen condiciones demasiado estrictas,have conditions too exacting
141,ARG1,3,AGAINST,59,RA,,,,,entre set-cents i mil nens a l'any documentats cada any a espanya per gestació subrogada,entre setecientos y mil niños en el año documentados cada año a espanya por gestación subrogada,among seven hundred and one thousand by the year documented boys every year at espanya for surrogacy
142,ARG1,3,AGAINST,141,RA,,,,,un míser zero coma dos per cent ,un míser cero coma dos por ciento,a míser zero comma two percent
143,ARG1,3,AGAINST,141;142,RA,,,,,no és una demanda social un zero coma dos per cent dels naixements a espanya,no es una demanda social un cero coma dos por ciento de los nacimientos a espanya,is not a social demand a zero coma two percent of the births at espanya
144,ARG1,3,AGAINST,42;59;61;66;119;123;128;138,RA,,,,,legalitzar una pràctica com aquesta és mercantilitzar directament el cos de la dona,legalizar una práctica como esta es mercantilizar directamente el cuerpo de la mujer,legalise a practice how this is mercantilitzar directly the body of the wife
145,ARG1,3,AGAINST,144,RA,,,,,mercantilitzar el nen,mercantilizar el niño,mercantilitzar the boy
146,ARG1,3,AGAINST,144,MA,43;122,RA,73,CA,crear una nova forma d'esclavitud,crear una nueva forma de esclavitud,create a new form of slavery
147,ARG1,2;3,AGAINST,,,,,,,una poca elit de gent que vulgui perpetrar els seus gens,una poca élite de gente que quiera perpetrar sus nada,a little elite of persons that want to perpetrate his genes
148,ARG1,2;3,AGAINST,147,RA,,,,, una poca gent que cregui que el seu ego sigui superior al d'altres persones ,una poca gente que crea que su ego sea superior al otras personas,some little persons that think that his ego was superior at the of other persons
149,ARG1,2;3,AGAINST,148,MA,,,,,una poca gent que creu que els seus gens són superiors a les altres persones ,una poca gente que cree que sus genes son superiores a las otras personas,some little persons that thinks that his genes are superior at the others persons
150,ARG1,2;3,AGAINST,147,MA,,,,,volen transmetre aquesta descendència de forma pura,quieren transmitir esta descendencia de forma pura,want to transmit these descendants of pure form
151,ARG1,2;3,AGAINST,147;148;149;150,RA,,,,,volen evitar l'adopció,quieren evitar la adopción,want to eschew the adoption
152,ARG2,2,FAVOUR,12;29;75;76;83;84;86;87,RA,,,,,hi ha països on s'està duent una explotació sense garanties,hay países donde se está llevando una explotación sin garantías,there are countries where is taking  an exploitation without guarantees
153,ARG2,2,FAVOUR,73;115,RA,,,,,gestant en uns estats on no es poden donar una capacitat ni jurídica ni sanitària per poder asegurar els drets d'aquestes dones gestants,gestante en unos estados donde no se pueden dar una capacidad ni jurídica ni sanitaria para poder asegurar los derechos de estas mujeres gestantes,gestant at some states where can not  give a capacity or juridical or sanitary to be able to asegurar the laws of these wives gestants
154,ARG2,2,FAVOUR,130;131;132,RA,,,,,dels nens que es tindran a continuació,de los niños que se tendrán a continuación,of the boys that will have  at continuation
155,ARG2,2,FAVOUR,154,RA,,,,,ni dels pares que han contractat aquesta col·laboració per poder aconseguir el seu desig de tenir un fill,ni de los padres que han contratado esta colaboración para poder conseguir su deseo de tener un hijo,or of the parents that have hired this collaboration to be able to achieve his wish to have a son
156,ARG2,2,FAVOUR,73;115,RA,,,,,l'esclavatge econòmic,la esclavitud económica,the economic slavery
157,ARG2,3,FAVOUR,105;106,RA,,,,,islàndia és un país on es va fer un projecte de llei on s'intentava fer una maternitat subrogada altruista ,islàndia es un país donde se hizo un proyecto de ley donde se intentaba hacer una maternidad subrogada altruista,islàndia is a country where made  a bill where attempted  make a surrogacy altruist
158,ARG2,3,FAVOUR,157,RA,,,,,on la mare  gestant tingués la capacitat de poder decidir a partir de les sis setmanes després d'haver gestat i d'haver tingut el nen on s'estaven respectant tots els drets de decisió durant tot el procés gestant per decidir sobre el seu mitjà de vida i sense cap ningun tipus de retribució ni de compensació encoberta per què ho faria la sanitat pública,donde la madre gestando tuviera la capacidad de poder decidir a partir de las seis semanas después de haber gestado y de haber tenido el niño donde se estaban respetando todos los derechos de decisión durante todo el proceso gestante para decidir sobre su medio de vida y sin jefe ningun tipo de retribución ni de compensación encubierta por qué lo haría la sanidad pública,where the mother gestant had the capacity to be able to decide from the six weeks after having gestat and of having had the boy where were respecting  all the laws of decision during all the process gestant to decide on his living mode and without cape ningun type of reward or of compensation concealed how come would make it the public health
159,ARG2,3,FAVOUR,,,,,,,es va crear una comissió per determinar la filiació per el millor interés del nen per assegurar que durant tot el procèss'estigués duent de forma garantista,se creó una comisión para determinar la filiación por el mejor interés del niño para asegurar que durando todo lo procèss'estuviera llevando de forma garantista,created  a commission to determine the filiació for the best interest of the boy to assure that during all the procèss'was taking of form garantista
160,ARG2,3,FAVOUR,138,CA,,,,,tenim estudis oficials del govern de canadà on podem veure que des que es va legislar la maternitat subrogada ha augmentat en un quatre-cents per cent evitant el turisme reproductiu en països en vies de desenvolupament,tenemos estudios oficiales del gobierno de canadà donde podemos ver que desde que se legisló la maternidad subrogada ha aumentado en un cuatrocientos por ciento evitando el turismo reproductivo en países en vías de desarrollo,have official surveys of the governance of canadà where can view that since it legislated  the surrogacy has augmented at a four hundred percent eschewing the reproductive tourism at countries at roads of development
161,ARG2,3,AGAINST,138,RA,,,,,m'agradaria saber si coneix l'informe wendel perquè explica que els models altruistes no són viables perquè la demanda anirà creixent llavors acabarem amb un sistema de gestació subrogada econòmica ,me gustaría saber si conoce el informe wendel porque explica que los modelos altruistas no son viables porque la demanda irá creciendo entonces acabaremos con un sistema de gestación subrogada económica,would like me know if it meets the report wendel so that it explains that the altruistic models are not viable so that the demand will go growing then will end with a system of surrogacy economic
162,ARG2,3,FAVOUR,161,CA,,,,,aquest mateix informe wendel el que parla és que la demanda anirà creixent i que hi ha ocasions com també ha previst la legislació islandesa on l'oferta potser no creix al mateix ritme,este mismo informe wendel el que habla es que la demanda irá creciente y que hay ocasiones como también ha previsto la legislación islandesa donde la oferta quizás no crece al mismo ritmo,this same report wendel what talks is that the demand will go growing and that there are occasions how also has foreseen the Icelandic legislation where the offer perhaps does not grow at the same rate
163,ARG2,3,FAVOUR,160;162,RA,,,,,no creixerà la oferta al mateix ritme perquè les circumstàncies en les que s'estiguin donant no siguin suficientment garantistes,no crecerá la oferta al mismo ritmo porque las circunstancias en las que se estén dando no sean suficientemente garantistas,will not grow the offer at the same rate so that the circumstances at those that are giving  are not sufficiently garantistes
164,ARG2,3,FAVOUR,157;158;159,RA,,,,,hi ha països on la mare gestant si sap que no tindrà les garanties necessàries per poder dur a terme tota aquest procés no voldrà ser una oferta d'aquest servei o d'aquesta col·laboració amb els pares que volen contractar,hay países donde la madre gestante si sabe que no tendrá las garantías necesarias para poder llevar a cabo toda este proceso no querrá ser una oferta de este servicio o de esta colaboración con los padres que quieren contratar,there are countries where the mother gestant if it knows that will not the necessary guarantees to be able to carry out all this process will not want to be an offer of this kick or of this collaboration with the parents that want to hire
165,ARG2,3,FAVOUR,126,MA,,,,,espanya és el primer sistema sanitari segons la unió europea de tota la unió europea i el millor tercer al món,espanya es el primer sistema sanitario según la unión europea de toda la unión europea y el mejor tercero al mundo,espanya is the first sanitary system according to the European union of all the European union and the best third at the world
166,ARG2,3,FAVOUR,165,RA,,,,,l'oferta d'aquesta maternitat subrogada altruista es pugui mantenir,la oferta de esta maternidad subrogada altruista se pueda mantener,the offer of this surrogacy altruist can maintain
