ID (Chronological),TYPE (Part + Person),ARGUMENT NUMBER,TEAM STANCE,RELATED ID,ARGUMENTAL RELATION  TYPE,RELATED ID.1,ARGUMENTAL RELATION  TYPE.1,ADU_CAT,ADU_ES,ADU_EN
262,ARG2,2.0,FAVOUR,261,RA,,,el millor mètode és el d'observar triar i crear,el mejor método es el de observar elegir y crear,the best method is the to observe elect and create
263,ARG2,2.0,FAVOUR,262,RA,,,observar aquests països en la gestació subrogada és legal,observar estos países en la gestación subrogada es legal,observe these countries at the surrogacy is legal
264,ARG2,2.0,FAVOUR,262,RA,,,triar aquests aspectes positius que han aconseguit,elegir estos aspectos positivos que han conseguido,elect these positive aspects that have achieved
265,ARG2,2.0,FAVOUR,262,RA,,,i crear el nostre propi model de regulació,y crear nuestro propio modelo de regulación,and create our own model of regulation
266,ARG2,1.0,FAVOUR,263,RA,,,un reportatge basat en els estudis de delphine noos que va dur a terme estats units que on hi veiem testimonis dones que han dut a terme una gestació subrogada de motivació econòmica,un reportaje basado en los estudios de delphine noos que llevó a cabo estados unidos que donde vemos testigos mujeres que han llevado a cabo una gestación subrogada de motivación económica,a report based at the surveys of delphine noos that carried out states united that where view  witnesses wives that have carried out a surrogacy of economic motivation
267,ARG2,1.0,FAVOUR,266,RA,,,és que hi ha una motivació econòmica,es que hay una motivación económica,is that there is an economic motivation
268,ARG2,1.0,FAVOUR,,,,,però  també hi havia solidaritat,pero también había solidaridad,but also there was solidarity
269,ARG2,1.0,FAVOUR,268,RA,,,hi ha solidaritat per la religió,hay solidaridad por la religión,there is solidarity for the religion
270,ARG2,1.0,FAVOUR,269,RA,,,El cristianisme és molt establert,El cristianismo es muy establecido,The Christianity is very established
271,ARG2,1.0,FAVOUR,270,RA,,,i la bona acció és valorada pel cristianisme,y la buena acción es valorada por el cristianismo,and the good act is valued by the Christianity
272,ARG2,1.0,FAVOUR,271,RA,,,hi havia una dona que volia dur a terme una gestació subrogada però no volien en contra de seva religió ho van a consultar i simplement li van dir que la verge maria li van fer l'analogia que la verge maria ho havia fet ella mateixa,había una mujer que quería llevar a cabo una gestación subrogada pero no querían en contra de suya religión lo van a consultar y simplemente le dijeron que la virgen maría le hicieron la analogía que la virgen maría lo había hecho ella misma,there was a wife that wanted to carry out a surrogacy but did not want to against of his religion go it at consulting and simply said him that the virgin maria made him the analogy that the virgin maria had made it she same
273,ARG2,1.0,FAVOUR,,,,,no és l'única raó,no es la única razón,is not the only reason
274,ARG2,1.0,FAVOUR,262,RA,,,l'índia el dos mil quinze van decidir tancar la gestació subrogada a nivell Nacional,la india el dos mil quince decidieron cerrar la gestación subrogada a nivel Nacional,the Indian the two thousand fifteen decided to shut the surrogacy nationally
275,ARG2,1.0,FAVOUR,274,RA,,,també que siguin de nacionalitat espanyola,también que sean de nacionalidad española,also that they are of Spanish nationality
276,ARG2,,AGAINST,,,,,com és possible que si está regulat per altruisme,como es posible que si está regulado por altruismo,how is possible that if está regulated by altruism
277,ARG2,,AGAINST,,,,,no s'està respectant la dignitat del menor,no se está respetando la dignidad del menor,is not  respecting the dignity of the minor
278,ARG2,2.0,FAVOUR,,,,,si l'estat intervé és com va passar amb la llei de donació d'òrgans un cop ho van regular la situació es va millorar,si el estado interviene es como pasó con la ley de donación de órganos una vez lo regularon la situación se mejoró,if the state intervenes is how passed with the law of donation of organs once regulated it the situation improved
279,ARG2,2.0,FAVOUR,278,RA,,,ja no podem parlar de màfies aquí a espanya,ya no podemos hablar de mafias aquí a espanya,no longer can talk of mafias here at espanya
280,ARG2,2.0,FAVOUR,,,,,finlàndia on l'altruisme funciona i hi ha dones que ho volen fer i on nosaltres considerem que el drets dels nadons no són vulnerat,finlàndia donde el altruismo funciona y hay mujeres que lo vuelen hacer y donde nosotros consideramos que el derechos de los bebés no son vulnerado,finlàndia where the altruism functions and there are wives that blast it make and where we consider that the laws of the babies are not vulnerat
281,ARG2,2.0,FAVOUR,280,RA,,,hi ha solidaritat ja que una dona és la que entendrà,hay solidaridad puesto que una mujer es la que entenderá,there is solidarity since a wife is what will understand
282,ARG2,2.0,FAVOUR,281,RA,,, i no un home,y no un hombre,and no a man
283,ARG2,2.0,FAVOUR,282,RA,,,perquè no pot tenir l'experiència de gestar,porque no puede tener la experiencia de gestar,so that it can not have the experience of gestar
284,ARG2,2.0,FAVOUR,281,RA,,,què implica una gestació,que implica una gestación,what implies a gestation
285,ARG2,2.0,FAVOUR,281,RA,,,que implica no poder tenir fills,que implica no poder tener hijos,that implies not being able to have children
286,ARG2,2.0,FAVOUR,281;284;285,RA,,,per això hi haurà sempre solidaritat,por eso habrá siempre solidaridad,therefore there will be always solidarity
287,ARG2,2.0,FAVOUR,193,RA,,,ho volem limitar a nivell nacional,lo queremos limitar a nivel nacional,want to limit it nationally
288,ARG2,2.0,FAVOUR,252;287,RA,,,perquè no passi com a frança,porque no pase como frança,so that it do not pass as a frança
289,ARG2,2.0,FAVOUR,88;275,RA,,,ho volem per nacionalitat espanyola,lo queremos por nacionalidad española,want to it for Spanish nationality
290,ARG2,2.0,FAVOUR,289,RA,,,perquè no volem crear un turisme reproductiu,porque no queremos crear un turismo reproductivo,so that we do not want to create a reproductive tourism
291,ARG2,,AGAINST,,,,,perquè creu que si a espanya existeixen màfies com per exemple de la droga o de la prostitució,porque cree que si a espanya existen mafias como por ejemplo de la droga o de la prostitución,so that it thinks that if at espanya exist mafias how for example of the drug or of the prostitution
292,ARG2,,AGAINST,291,RA,,,la gestació subrogada seria un cas a part,la gestación subrogada sería un caso aparte,the surrogacy would be a case aside
293,ARG2,1.0,FAVOUR,,,,,però les drogues no són legals,pero las drogas no son legales,but the drugs are not legal
294,ARG2,1.0,FAVOUR,293,RA,,, això afavoreix un mercat negre,esto favorece un mercado negro,this favours a black market
295,ARG2,1.0,FAVOUR,262,RA,,,en la nostra regulació,en nuestra regulación,at our regulation
296,ARG2,1.0,FAVOUR,295,RA,,,un rang d'edat,un rango de edad,a rank of age
297,ARG2,1.0,FAVOUR,296,RA,,,l'informe que va emetre el departament de salut de catalunya que diu protocol de seguiment de l'embaràs a catalunya explica que una dona que gesta amb menys de disset anys i més de trenta-vuit anys és considerada una gestació de risc mitjà,el informe que emitió el departamento de salud de catalunya que dice protocolo de seguimiento del embarazo a catalunya explica que una mujer que gesta con menos de diecisiete años y más de treinta y ocho años es considerada una gestación de riesgo mediano,the report that emitted the department of health of catalunya that it says protocol of follow-up of the pregnancy at catalunya explains that a wife that feat with less of seventeen years and more of thirty-eight years is considered a gestation of half risk
298,ARG2,1.0,FAVOUR,297,RA,,,per això en primer termini vam posar el rang entre disset i trenta-vuit anys,por eso en primer plazo pusimos el rango entre diecisiete y treinta y ocho años,therefore at first term posed the rank among seventeen and thirty-eight years
299,ARG2,1.0,FAVOUR,,,,,però després vam augmentar el mínim vam passar de disset a vint-i-cinc,pero después aumentamos el mínimo pasamos de diecisiete a veinticinco,but next augmented the minimum passed of seventeen at twenty-five
300,ARG2,1.0,FAVOUR,299,RA,,,perquè creiem que a vint-i-cinc anys una dona haurà dut a terme estudis superiors,porque creemos que a veinticinco años una mujer habrá llevado a cabo estudios superiores,so that we think that at twenty-five years a wife will have carried out superior surveys
301,ARG2,1.0,FAVOUR,300,RA,,,o haurà estat en el món laboral,o habrá estado en el mundo laboral,or will have been at the labour world
302,ARG2,1.0,FAVOUR,301,RA,,,això ajudarà a les dones a prendre decisions amb més consciència,esto ayudará a las mujeres a tomar decisiones con más conciencia,this will aid at the wives at taking decisions with more conscience
303,ARG2,1.0,FAVOUR,302,RA,,,una experiència que creiem necessària,una experiencia que creemos necesaria,an experience that think necessary
304,ARG2,1.0,FAVOUR,295,RA,,,limitar intents d'inseminació,limitar intentos de inseminación,limit bids of insemination
305,ARG2,1.0,FAVOUR,304,RA,,,perquè com més intens inseminació més probabilitat que la dona gesti bessons,porque cuanto más intenso inseminación más probabilidad que la mujer geste gemelos,so that how more intense more insemination probability that the wife gesti twins
306,ARG2,1.0,FAVOUR,297;305,RA,,,i aquest informe ens diu que  la gestació de bessons és una gestació de risc alt,y este informe nos dice que la gestación de gemelos es una gestación de riesgo alto,and this report says us that the gestation of twins is a gestation of tall risk
307,ARG2,1.0,FAVOUR,295,RA,,,i finalment que només ho faci un cop,y finalmente que solo lo haga una vez,and finally that only make it once
308,ARG2,1.0,FAVOUR,297;307,RA,,,ja que aquest informe ens explica que la gestació múltiple a partir de quatre i més gestacions és considerat una gestació de risc molt alt,puesto que este informe nos explica que la gestación múltiple a partir de cuatro y más gestaciones es considerado una gestación de riesgo muy alto,since this report explains us that the multiple gestation from four and more gestations is considered a gestation of risk very tall
309,CONC,,FAVOUR,,,,,bona tarda sóc l'eloi blanes de la universitat de vic i avui tindré el plaer de concloure aquest debat primer de tot voldria donar les gràcies als nostres companys de l abat oliva per haver fet possible aquest debat i sobretot per la vostra actitud perquè pensem que és d'aquesta manera amb la qual es poden elaborar debats que siguin enriquidors per tots primer de tot en aquest debat el que hem vist ha sigut que existeixen posicions confrontades com passa a la societat no però sí que coincidim tots en un punt i aquest punt és que veiem que la gestació subrogada s'ha convertit en un problema un problema com a tota problemàtica cal trobar una solució la veritat és que en aquest debat només hi ha hagut un equip que ha portat una possible solució viable llavors jo em pregunto companys si veieu que existeix una problemàtica com pot ser que vingueu sense cap alternativa sinó amb un no absolut la negació absoluta em costa d'entendre-ho perquè sempre aquesta postura de negació absoluta perquè al cap i a la fi aquest és un dels problemes que tenim en aquest país que existeixen problemes però hi ha poca gent que aporta solucions nosaltres durant totes aquestes setmanes hem empapat sobre la gestació subrogada i és per això justament que la meva companya ha parlat de testimonis un d'aquests testimonis és el voldria ensenyar és la iolanda angles aquest és un testimoni d'una mare catalana que va tenir un fill per una filla per subrogació que es diu estel doncs bé amb aquest testimoni podem veure algunes algunes coses que són molt interessants i sobretot que es poden extrapolar a altres situacions amb altres dones de d'aquest país ens heu parlat d'alternatives per exemple les alternatives que ja existeixen doncs bé la iolanda per exemple va recórrer aquelles alternatives que vosaltres heu esmentat una d'elles per exemple va ser la fecundació in vitro però per exemple hi ha dones que per una qüestió biològica  no funciona la fecundació in vitro per exemple va recórrer a l'adopció bé l'adopció tots sabem en quin moment es troba ha baixat més d'un noranta per cent en l'última dècada de fet jo mateix tinc una germana que és adoptada i vam vam haver d'esperar durant més de vuit anys per una resolució final és aquí on hem de veure com no és una solució possible i així li va passar la iolanda com li passa a moltes dones que va passar al final dels que va trobar la seva solució on en la gestació subrogada i és per això que creiem que hem de aportar una solució a totes aquestes dones no val tampoc qualsevol solució sinó una solució amb un model que sigui totalment garantista i que sobretot ajudi i a complir la dignitat de totes les dones i els seus drets hem parlat també per exemple de la regulació de la llei d'òrgans veureu en aquest país ja va passar això hi havia una part que per temor per prejudicis per por però una altra part sí que volia i avui tenim el resultat aquesta llei és pionera i fins i tot no sabien si hi hauria algú disposat a donar els seus òrgans voluntàriament però es va fer i ara ha servit de model per molts altres països com va dir en el seu moment benjamin franklin els qui són capaços de renunciar a la llibertat essencial a canvi d'una seguretat transitòria no són mereixedors ni de la llibertat ni de la seguretat però no us preocupeu no us traurem la vostra llibertat però si us plau no ens la tragueu vosaltres a nosaltres així que sisplau siguem valents i regulem Gràcies,buenas tardes soy la eloi blandas de la universidad de vic y hoy tendré el placer de concluir este debate antes que nada querría dar las gracias a nuestros compañeros de l abate oliva por haber hecho posible este debate y sobre todo por vuestra actitud porque pensamos que es de este modo con la cual se pueden elaborar debates que sean enriquecedores por todos antes que nada en este debate el que hemos visto ha sido que existen posiciones confrontadas cómo pasa a la sociedad no pero sí que coincidimos todos en un punto y este punto es que vemos que la gestación subrogada se ha convertido en un problema un problema como toda problemática hay que encontrar una solución bien es verdad que en este debate solo ha habido un equipo que ha llevado una posible solución viable entonces yo me pregunto compañeros si veis que existe una problemática como puede ser que vengáis sin ninguna alternativa sino con un no absoluto la negación absoluta me cuesta de entenderlo porque siempre esta postura de negación absoluta porque al fin y al cabo este es uno de los problemas que tenemos en este país que existen problemas pero hay poca gente que aporta soluciones nosotros durante todas estas semanas hemos empapat sobre la gestación subrogada y es por eso justamente que mi compañera ha hablado de testigos uno de estos testigos es lo querría enseñar es la iolanda ángulos este es un testigo de una madre catalana que tuvo un hijo por una hija por subrogación que se llama estrella pues bien con este testigo podemos ver algunas algunas cosas que son muy interesantes y sobre todo que se pueden extrapolar a otras situaciones con otras mujeres de de este país nos habéis hablado de alternativas por ejemplo las alternativas que ya existen pues bien la iolanda por ejemplo recorrió aquellas alternativas que vosotros habéis mencionado una de ellas por ejemplo fue la fecundación in vitro pero por ejemplo hay mujeres que por una cuestión biológica no funciona la fecundación in vitro por ejemplo recurrió a la adopción bien la adopción todos sabemos en qué momento se encuentra ha bajado más de un noventa por ciento en la última década de hecho yo mismo tengo una hermana que es adoptada y vamos tuvimos que esperar durante más de ocho años por una resolución final es aquí donde tenemos que ver como no es una solución posible y así le pasó la iolanda como le pasa a muchas mujeres que pasó al final de los que encontró su solución dónde en la gestación subrogada y es por eso que creemos que tenemos que aportar una solución a todas estas mujeres no vale tampoco cualquier solución sino una solución con un modelo que sea totalmente garantista y que sobre todo ayude y a cumplir la dignidad de todas las mujeres y sus derechos hemos hablado también por ejemplo de la regulación de la ley de órganos veréis en este país ya pasó esto había una parte que por temor por prejuicios por miedo pero otra parte sí que quería y hoy tenemos el resultado esta ley es pionera e incluso no sabían si habría alguien dispuesto a dar sus órganos voluntariamente pero se hizo y ahora ha servido de modelo por otros muchos países como dijo en su momento benjamin franklin quienes son capaces de renunciar a la libertad esencial a cambio de una seguridad transitoria no son merecedores ni de la libertad ni de la seguridad pero no os preocupáis no os sacaremos la vuestra libertad pero por favor no nos la saquéis vosotros a nosotros así que por favor seamos valientes y regulamos Gracias ,good afternoon am the eloi soft of the university of vic and today will the pleasure to conclude this debate first of all would want to thank at our partners of l pulls down olive for having made possible this debate and especially for your attitude so that we think that it is in this way with which can elaborate  debates that are enriquidors for all first of all at this debate what have viewed has been that they exist positions confrontades how passes at the society no but aye that we coincide all at a point and this point is that we view that the surrogacy has converted  at a problem a problem as a every problematic it is necessary to find a solution the truth is that at this debate only there has been a squad that has taken a possible viable solution then I ask me partners if you view that it exists a problematic and can be that you come without any alternative but with one no absolute the absolute negation costs me to understand it so that always this posture of absolute negation so that after all this is one of the problems that have at this country that exist problems but there is little persons that contributes solutions we during all these weeks have empapat on the surrogacy and is therefore justly that my partner has talked of witnesses one of these witnesses is would want to teach it is the iolanda angles this is a Catalan mother's a witness that had a son for a daughter for subrogation that says  star then well with this witness can view some some things that are very interesting and especially that can extrapolate  at other situations with other wives of of this country have talked us of alternatives for example the alternatives that already exist then well the iolanda for example resorted those alternatives that you have mentioned one of them for example was the fecundació in vitro but for example there are wives that for a biological question does not function the fecundació in vitro for example resorted to the adoption well the adoption all know at which moment finds  has lowered more of a ninety percent at the last decade in fact I same have a sister that is adopted and go had to expect during more of eight years for a final resolution is here where have to view how is not a solution possible and like this passed him the iolanda how passes him at a lot of wives that passed at the end of the that found his solution whither at the surrogacy and that is why we think that we have to contribute a solution at all these wives does not cost neither any solution but a solution with a model that was totally garantista and that especially aid and at conforming the dignity of all the wives and his laws have talked also for example of the regulation of the law of organs will view at this country already passed this had a part that for fear for prejudices for fear but another part aye that it wanted to and today have the result this law is pioneering and even did not know if there would be somebody had to give his organs voluntarily but made  and now has served of model for many other countries and said at his moment benjamin franklin those who are capable to renounce at the essential liberty in return of a transitory security are not mereixedors or of the liberty or of the security but do not preoccupy you will not remove you the yours liberty but please no remove it to us you at us so sisplau are lion-hearted and regulate Thank you
