ID (Chronological),TYPE (Part + Person),ARGUMENT NUMBER,TEAM STANCE,RELATED ID,ARGUMENTAL RELATION  TYPE,RELATED ID.1,ARGUMENTAL RELATION  TYPE.1,RELATED ID.2,ARGUMENTAL RELATION  TYPE.2,ADU_CAT,ADU_ES,ADU_EN
167,ARG2,3,FAVOUR,,,,,,,el problema no és que no es vulgui,el problema no es que no se quiera,the problem is not that it do not want to
168,ARG2,3,FAVOUR,167,CA,,,,,el problema és que les condicions no siguin els suficientment favorables perquè les dones i les parelles puguin acudir a aquesta solució,el problema es que las condiciones no sean los suficientemente favorables porque las mujeres y las parejas puedan acudir a esta solución,the problem is that the conditions are not the sufficiently favourable so that the wives and the couples can attend at this solution
169,ARG2,3,AGAINST,42;59;61;66;119;123;128;138,RA,,,,,la pràctica amb la que feu tan èmfasi en que a l'estranger és tan agressiva i violenta tot i que espanya sigui la primera sanitat del món com teniu tan clar que aquí funcionaria i no seria agressiva en cap cas per a la dona ,la práctica con la que feudo tan énfasis en que al extranjero es tan agresiva y violenta a pesar de que espanya sea la primera sanidad del mundo como tenéis tan claro que aquí funcionaría y no sería agresiva en ningún caso para la mujer,the practice with what make as emphasis at that abroad is as aggressive and violent although espanya was the first health in the world how have as clear that here would function and would not be aggressive at any case for the wife
170,ARG2,3,FAVOUR,169,RA,,,,,això ja ha succeït en pràctiques com pot ser l'avortament o com poden ser els mitjans de reproducció assistida,esto ya ha sucedido en prácticas como puede ser el aborto o como pueden ser los medios de reproducción asistida,this already has succeït at practices how can be the abortion or how can be the modes of reproduction assisted
171,ARG2,3,FAVOUR,91;92;170;170,RA,,,,,des de que es van regular aquestes dues pràctiques espanya es va poder garantitzar que les dones i tots aquells que estiguin implicats durant tot el procés tindrien tots els drets fonamentals que la nostra pròpia constitució i que la carta dels drets humans que han firmat els països estiguin respectats,desde que se regularon estas dos prácticas espanya se pudo garantitzar que las mujeres y todos aquellos que estén implicados durante todo el proceso tendrían todos los derechos fundamentales que nuestra propia constitución y que la carta de los derechos humanos que han firmado los países estén respetados,since that they regulated  these two practices espanya could  garantitzar that the wives and all those that are implied during all the process would all the fundamental laws that our own constitution and that the card of the human laws that have signed the countries are respected
172,ARG2,,FAVOUR,169,CA,,,,,no estem debatint si la maternitat subrogada és una cosa bona o dolenta,no estamos debatint si la maternidad subrogada es una cosa buena o mala,are not debatint if the surrogacy is a good or mean thing
173,ARG2,1;2;3,FAVOUR,172,MA,,,,,estem debatint si és una realitat que s'està donant al nostre país i si donaria més beneficis legalitzar-lo que no legalitzar-lo,estamos debatint sí es una realidad que se está dando en nuestro país y si daría más beneficios legalizarlo que no legalizarlo,are debatint if it is a reality that is giving  at our country and if it would give more benefits legalise it that not to legalise it
174,ARG2,2;3,FAVOUR,130,CA,,,,,s'ha de protegir l'interès del menor,se tiene que proteger el interés del menor,has to protect  the interest of the minor
175,ARG2,2;3,FAVOUR,174,RA,,,,,fem girar l'esquena cap a tots els països on s'està fent d'una forma poc garantista,hacemos girar la espalda hacia todos los países donde se está haciendo de una forma poco garantista,make to turn the back to all the countries where is making  of a little form garantista
176,ARG2,2;3,FAVOUR,174,MA,,,,,hem de respectar l'interès del menor i la filiació i la documentació,tenemos que respetar el interés del menor y la filiación y la documentación,have to respect the interest of the minor and the filiació and the documentation
177,ARG2,2;3,FAVOUR,12;29;75;76;83;84;86;87,RA,,,,,la nacionalitat és un dret de la identitat d'aquest menor,la nacionalidad es un derecho de la identidad de este menor,the nationality is a law of the identity of this minor
178,ARG2,2;3,FAVOUR,5;6;12;16;17;18;19;20;21;22;23;24;84;86;88;95;115;156,RA,,,,,se li està permetent a tots els pares a totes aquelles parelles o persones solteres amb la suficient capacitat econòmica que vagin a un país  com  ucrania cambodja indonèsia països on és encara molt més barat i no hi ha ningun tipus de garantia i que es faci,se le está permitiendo a todos los padres a todas aquellas parejas o personas solteras con la suficiente capacidad económica que vayan a un país como ucrania cambodja indonesia países donde es todavía mucho más barato y no hay ningun tipo de garantía y que se haga,is him permitting at all the parents at all those couples or persons solteres with the sufficient economic capacity that go at a country how ucrania cambodja Indonesian countries where is still much cheaper and there is not ningun type of guarantee and that make
179,ARG2,2;3,FAVOUR,17;88;178,RA,,,,,perpetrar la desigualtat social dins del nostre propi país,perpetrar la desigualdad social dentro de nuestro propio país,perpetrate the social inequality in our own country
180,ARG2,2;3,FAVOUR,12;13;16;17;21;28;77;84;85;86;95;178,RA,,,,,donada aquesta prohibició ineficaç legalitzar-lo per evitar que en països on s'està fent malament s'eviti aquest turisme reproductiu,dada esta prohibición ineficaz legalizarlo para evitar que en países donde se está haciendo mal se evite este turismo reproductivo,given this ineffective ban legalise it to eschew that at countries where is making  poorly eschew  this reproductive tourism
181,ARG2,2;3,FAVOUR,157;158;159,RA,180,MA,,,es donin totes les garanties necessàries perquè la llibertat la integritat física i la integritat moral de totes les parts del procés incluit el nen la mare gestant o la parella estiguin respectades,se den todas las garantías necesarias porque la libertad la integridad física y la integridad moral de todas las partes del proceso incluit el niño la madre gestante o la pareja estén respetadas,give  all the necessary guarantees so that the liberty the physical integrity and the moral integrity of all the parts of the process incluit the boy the mother gestant or the couple are respected
182,ARG2,3,FAVOUR,96;105;106;112;115;157;158;159;160;183;184;185,RA,,,,,ho farem imitant aquells exemples on ja   ha funcionat,lo haremos imitando aquellos ejemplos donde ya ha funcionado,will make it imitating those examples where already has functioned
183,ARG2,3,FAVOUR,,,,,,,ja ha funcionat al canadà,ya ha funcionado al canadà,already has functioned at the canadà
184,ARG2,3,FAVOUR,183,RA,,,,,ja ha funcionat a islàndia,ya ha funcionado a islàndia,already has functioned at islàndia
185,ARG2,3,FAVOUR,183;184,RA,,,,,ja ha funcionat a sud-àfrica,ya ha funcionado a sur-àfrica,already has functioned at south-àfrica
186,ARG2,2;3,FAVOUR,96;105;106;112;115;157;158;159;160;180;181,RA,,,,,no hi ha turisme reproductiu i els drets fonamentals s'estan respectant,no hay turismo reproductivo y los derechos fundamentales se están respetando,there is not reproductive tourism and the fundamental laws are respecting
187,ARG2,2,FAVOUR,157;158;159,RA,,,,,s'està acompanyant a la dona,se está acompañando a la mujer,is accompanying  at the wife
188,ARG2,2,FAVOUR,157;158;159;166,RA,,,,,és un procés on no hi ha cap tipus de remuneració ni de contribució perquè s'està duent a terme per la sanitat pública,es un proceso donde no hay ningún tipo de remuneración ni de contribución porque se está llevando a cabo por la sanidad pública,is a process where there is not any type of remuneration or of contribution so that it is carrying out  for the public health
189,ARG2,2;3,FAVOUR,24;25;74;99;103,RA,,,,,evitar que els drets humans es vegin violats en uns altres països és responsabilitat de tots els estats,evitar que los derechos humanos se vean violados en otros países es responsabilidad de todos los estados,eschew that the human laws view  violets at other countries is responsibility of all the states
190,ARG2,2;3,AGAINST,59,RA,,,,,la gent rica d'alguna manera podria anar a un altre país a practicar la gestació subrogada,la gente rica de alguna manera podría ir a otro país a practicar la gestación subrogada,the affluent persons somehow could go at another country at practicing the surrogacy
191,ARG2,2,AGAINST,190,RA,,,,,s'ha de ser ric per demanar una gestació subrogada,se tiene que ser rico para pedir una gestación subrogada,has to be  affluent to request a surrogacy
192,ARG2,2,AGAINST,191,RA,,,,,quan una persona s'ofereix voluntària per practicar la gestació subrogada es posa a nou mesos de no treballar nou mesos d'està completament pel nadó nou mesos de gestar,cuando una persona se ofrece voluntaria para practicar la gestación subrogada se pone a nueve meses de no trabajar nueve meses de está completamente por el bebé nueve meses de gestar,when a person offers  volunteer to practice the surrogacy poses  at nine months of not working nine months of is entirely for the baby nine months of gestar
193,ARG2,2,AGAINST,191;192,RA,,,,,les empreses avui en dia ja no garantixen a una dona que tornarà a recuperar el seu lloc de feina sobretot les feines més precàries després de la gestació,las empresas hoy en día ya no garantizan a una mujer que volverá a recuperar su lugar de trabajo sobre todo los trabajos más precarios después de la gestación,the companies today at day no longer guarantee at a wife that will return at recovering his place of work especially the most precarious works after the gestation
194,ARG2,2,AGAINST,193,RA,,,,,com podran garantir que després de practicar una gestació familiar de forma completament altruista recuperin la feina de la que ja tenen assignada,como podrán garantizar que después de practicar una gestación familiar de forma completamente altruista recuperen el trabajo de la que ya tienen asignada,how will be able to guarantee that after practicing a familiar gestation of form entirely altruistic recover the work of what already have assigned
195,ARG2,2,FAVOUR,192;193;194,CA,,,,,perquè això no es pot aconseguir legalitzar-lo adequadament,porque esto no se puede conseguir legalizarlo adecuadamente,so that this can not  achieve legalise it suitably
196,ARG2,2,AGAINST,195,CA,,,,,seria molt complicat ja que ara avui en dia ja és difícil adequar una legalització que garanteix a les dones a que recuperin la feina després d'una gestació,sería muy complicado puesto que ahora hoy en día ya es difícil adecuar una legalización que garantiza a las mujeres a que recuperen el trabajo después de una gestación,would be very complicated since now today at day already is difficult to adapt a legalisation that guarantees at the wives at that they recover the work after a gestation
197,ARG2,2,FAVOUR,196,CA,,,,,i la solució no seria legalitzar-lo tot bé,y la solución no seria legalizarlo todo bueno,and the solution would not be to legalise it every sake
198,ARG2,2,AGAINST,197,CA,,,,,seria una solució,sería una solución,would be a solution
199,ARG2,2,AGAINST,,,,,,,més del cinquanta per cent de les dones que practiquen aquestes pràctiques estan per sota del llindar de la pobresa,más del cincuenta por ciento de las mujeres que practiquen estas prácticas están por debajo del umbral de la pobreza,more of the fifty percent of the wives that practice these practices are underneath of the threshold of the poverty
200,ARG2,2,AGAINST,,,,,,,el quatre per cent de les dones que practiquen aquestes pràctiques   no tenen estudis universitaris,el cuatro por ciento de las mujeres que practiquen estas prácticas no tienen estudios universitarios,the four percent of the wives that practice these practices do not have university surveys
201,ARG2,2,AGAINST,192;193;194;196;199;200,RA,,,,,el quaranta per cent d'aquestes dones necessiten cobrar atur i múltiples ajudes de govern local,el cuarenta por ciento de estas mujeres necesiten cobrar paro y múltiplos ayudes de gobierno local,the forty percent of these wives need to charge unemployment and multiples aid of local governance
202,ARG2,2,AGAINST,42;59;61;66;119;123;128;138;141;144,RA,,,,,quan una dona practica una pràctica com l'estació subrogada reben entre mil i quinze mil euros de diners negres de part de la família que demana el servei,cuando una mujer practica una práctica como la estación subrogada reciben entre mil y quince mil euros de dinero negro de parte de la familia que pide el servicio,when a wife practices a practice how the season subrogada get among one thousand and fifteen thousand euros of black money of part of the family that requests the kick
203,ARG2,2,AGAINST,,,,,,,trenca amb qualsevol tipus de llei que s'hagi imposat prèviament,rompe con cualquier tipo de ley que se haya impuesto previamente,smashes with any type of law that have imposed  previously
204,ARG2,2;3,FAVOUR,126;157;158;159;165;188,RA,199;200;201;202;203,CA,,,quina opinió li mereix aleshores que sigui a través de la sanitat pública tot el procés en comptes d'amb compensacions i retribucions ,qué opinión le merece entonces que sea a través de la sanidad pública todo el proceso en vez de con compensaciones y retribuciones,which opinion merits him then that it was through the public health all the process instead of with compensations and rewards
205,ARG2,3,AGAINST,169;199;200;201;202;203,RA,188,MA,,,tot això es practica des de la sanitat pública,todo esto se practica desde la sanidad pública,everything this practices  since the public health
206,ARG2,3,AGAINST,190;191;192;193;194;196;199;200;201;202,RA,,,,,la sanitat pública trobaria dones disposades a practicar gestacions subrogades de forma completament altruista sense cap tipus de benefici deixant enrere tota la seva vida deixant enrere qualsevol tipus de diners,la sanidad pública encontraría mujeres dispuestas a practicar gestaciones subrogadas de forma completamente altruista sin ningún tipo de beneficio dejando atrás toda su vida dejando atrás cualquier tipo de dinero,the public health would find wives had to practice gestations subrogades of form entirely altruistic without any type of benefit letting back all his life letting back any type of money
207,ARG2,3,AGAINST,206,RA,,,,,les persones hem de viure que d'alguna manera,las personas tenemos que vivir que de alguna manera,the persons have to live that somehow
208,ARG2,3,AGAINST,206;207,RA,,,,,se cobrarien tots els seus gastos durant aquest procés tot per la sanitat pública,se cobrarían todos sus gastos durante este proceso todo por la sanidad pública,would charge  all his gastos during this process everything for the public health
209,ARG2,3,FAVOUR,96;105;106;112;115;157;158;159;160;166;183;184;185;188,RA,,,,,donats els exemples d'altruisme altres països no creu que el seu pensament es un cap a un capitalisme negant que l'altruisme existeix ,dados los ejemplos de altruismo otros países no cree que su pensamiento se uno hacia un capitalismo negando que el altruismo existe,given the examples of altruism other countries does not think that his thought  one to a capitalism denying that the altruism exists
210,ARG2,3,AGAINST,161;194,RA,209,CA,,,l'altruisme si ens hi parem a pensar a gran escala és mínim,el altruismo si nos paramos a pensar a gran escala es mínimo,the altruism if we pause  us at thinking on a large scale is minimal
211,ARG2,3,AGAINST,194,RA,,,,,la gran majoria de països que donen la possibilitat a donar lloc a gestacions altruistes acaben perdent gent i se'n van a països on la gestació subrogada és completament mercantil,la gran mayoría de países que dan la posibilidad a dar lugar en gestaciones altruistas acaban perdiendo gente y se van a países donde la gestación subrogada es completamente mercantil,the big majority of countries that give the possibility at giving place at altruistic gestations end missing persons and go  at countries where the surrogacy is entirely mercantile
212,ARG2,1;2,AGAINST,213;214;215;216;217;218,RA,5;6;11;20;28;77;82;84;88;90;110;128;157,CA,,,al dos mil quinze el conveni de l'haia del dret internacional privat troben sis raons on es vulneren els drets humans a l'hora de practicar la gestació subrogada,al dos mil quince el convenio del haia del derecho internacional privado encuentran seis razones donde se vulneran los derechos humanos en la hora de practicar la gestación subrogada,at the two thousand fifteen the agreement of the haia of the private international law find six reasons where  vulneren the human laws at the hour to practice the surrogacy
213,ARG2,2,AGAINST,,,,,,,hi ha múltiples abandonaments de nens durant aquest procés,hay múltiples abandonos de niños durante este proceso,there is multiple abandonments of boys during this process
214,ARG2,2,AGAINST,213,RA,,,,,apareix la possibilitat del tràfic de nens,aparece la posibilidad del tráfico de niños,appears the possibility of the traffic of boys
215,ARG2,2,AGAINST,213;214,RA,,,,,trenquen el dret del nen a conèixer els seus orígens,rompen el derecho del niño a conocer sus orígenes,smash the law of the boy at meeting his origins
216,ARG2,2,AGAINST,213;214;215,RA,,,,,el nen perd molt dels drets quan li dónes els drets a la mare gestant,el niño pierde mucho de los derechos cuando le das los derechos a la madre gestante,the boy misses a lot of the laws when give him the laws to the mother gestant
217,ARG2,2,AGAINST,213;214;215;216,RA,,,,,es perd gran quantitat de llibertat de consentiment,se pierde gran cantidad de libertad de consentimiento,misses  big quantity of liberty of consent
218,ARG2,2,AGAINST,213;214;215;216;217,RA,,,,,done gran possibilitat a la gent a practicar males gestacions subrogades on hi hagi grans quantitats d'explotació,doy gran posibilidad a la gente a practicar malas gestaciones subrogadas donde haya grandes cantidades de explotación,give big possibility at the persons at practicing bad gestations subrogades where there is big quantities of exploitation
219,ARG2,2;3,FAVOUR,5;6;11;20;28;77;82;84;88;90;110;138;157,RA,,,,,opina vosté que aquests sis punts que menciona no s'acabaria amb ells legislant adequadament,opina usted que estos seis puntos que menciona no se acabaría con ellos legislando adecuadamente,opines you that these six points that menciona would not end  with them legislating suitably
220,ARG2,2;3,AGAINST,42;59;61;66;119;123;128;138;141;144,RA,92,MA,,,hem comparat molt la gestació subrogada amb l'avortament on antigament la gent havia de marxar del país per practicar,hemos comparado mucho la gestación subrogada con el aborto donde antiguamente la gente tenía que marchar del país para practicar,have compared a lot the surrogacy with the abortion where anciently the persons had to leave of the country to practice
221,ARG2,1;2,AGAINST,220,RA,,,,,una pràctica sanitària on només involucrava la mare amb la seva llibertat pròpia de seguir la seva vida,una práctica sanitaria donde solo involucraba la madre con su libertad propia de seguir su vida,a sanitary practice where only involved the mother with his own liberty to track his life
222,ARG2,1,AGAINST,220;221;223;224;225;226;227,RA,,,,,quan comparem aquesta pràctica amb l'estació subrogada estem abarcant molta més gent,cuando comparamos esta práctica con la estación subrogada estamos abarcando mucha más gente,when compare this practice with the season subrogada are spanning a lot of more persons
223,ARG2,1,AGAINST,222;224;225;226;227,RA,,,,,a la pràctica estem embarcant amb molts més factors,a la práctica estamos embarcando con muchos más factores,in all but name are embarking with a lot of more factors
224,ARG2,1,AGAINST,,,,,,,estem abarcant les famílies,estamos abarcando las familias,are spanning the families
225,ARG2,1,AGAINST,,,,,,,estem abarcant   el nen el nadó que naixerà,estamos abarcando el niño el bebé que nacerá,are spanning the boy the baby that will be born
226,ARG2,1,AGAINST,,,,,,,està abarcant la mare gestant,está abarcando la madre gestante,is spanning the mother gestant
227,ARG2,1,AGAINST,224,MA,,,,,estem abarcant a la família de la mare gestant,estamos abarcando a la familia de la madre gestante,are spanning at the mother's family gestant
228,ARG2,3,AGAINST,42;59;61;66;119;123;128;138;141;144;213;214;215;216;217;218;220;221;222;223;224;225;226;227,RA,,,,,tot això canvia molt el procés a l'hora d'aplicar una pràctica d'aquest calibre,todo esto cambia mucho el proceso en la hora de aplicar una práctica de este calibre,everything this capsizes a lot the process at the hour to apply a practice of this calibre
229,ARG2,,AGAINST,,,,,,,el feminisme està definit com el moviment que té com a finalitat aconseguir la igualtat política econòmica i jurídica de la dona respecte a l'home,el feminismo está definido como el movimiento que tiene como finalidad conseguir la igualdad política económica y jurídica de la mujer respecto al hombre,the feminism is defined how the movement that has as a purpose achieve the economic political equality and juridical of the wife with regard to the man
230,ARG2,,AGAINST,229,CA,,,,,no és només lluitar per tu com a individu,no es solo luchar por tú como individuo,is not only battle for you as a individual
231,ARG2,,AGAINST,43;73;122;133,RA,5;6;11;20;28;77;82;84;88;90;110;128;157,CA,,,la gestació subrogada a espanya no evitarà que hi hagi múltiples dones a països del tercer món siguin explotades,la gestación subrogada a espanya no evitará que haya múltiples mujeres a países del tercer mundo sean explotadas,the surrogacy at espanya will not eschew that there is multiple wives at countries of the third world are exploded
232,ARG2,,AGAINST,231,RA,,,,,com va dir un gran filòsof ortega gasset el que no puede lo que quiere que quiera lo que pueda,como dijo un gran filósofo ortega gasset el que no puede lo que quiere que quiera lo que pueda,how said a big philosopher ortega gasset what no puede lo that quiere that quiera lo that pueda
