ID (Chronological),TYPE (Part + Person),ARGUMENT NUMBER,TEAM STANCE,RELATED ID,ARGUMENTAL RELATION  TYPE,RELATED ID.1,ARGUMENTAL RELATION  TYPE.1,ADU_CAT,ADU_ES,ADU_EN
131,ARG1,1.0,AGAINST,130,RA,,,una parella australiana per exemple rebutja el seu fill per tenir síndrome de down,una pareja australiana por ejemplo rechaza su hijo para tener síndrome de down,an Aussie couple for example rebuffs his son to have syndrome of down
132,ARG1,1.0,AGAINST,131,RA,,,això no ho podem permetre,esto no lo podemos permitir,this can not it permit
133,ARG1,1.0,AGAINST,131,RA,,,això és l'eugenèsia,esto es la eugenesia,this is the eugenics
134,ARG1,2.0,AGAINST,16;98,RA,,,l'objectivització de la dona,la objectivització de la mujer,the objectivització of the wife
135,ARG1,2.0,AGAINST,134,RA,,,la dona és la responsable de portar el nadó,la mujer es la responsable de llevar el bebé,the wife is the manager to take the baby
136,ARG1,2.0,AGAINST,135,RA,,,i per tant hi ha en el moment en què signa aquest contracte no tindrà la possibilitat de sortir,y por tanto hay en el momento en que firma este contrato no tendrá la posibilidad de salir,and therefore there is at the moment at what signs this agreement will not the possibility to exit
137,ARG1,2.0,AGAINST,136,RA,,,la dona quedarà esclavitzada,la mujer quedará esclavizada,the wife will stay enslaved
138,ARG1,2.0,AGAINST,136,RA,,,la mare en el cas que vulgui sortir haurà d'avortar,la madre en el supuesto de que quiera salir tendrá que abortar,the mother at the case that want to exit will have to abort
139,ARG1,2.0,AGAINST,138,RA,,,és posar en risc la seva vida,es poner en riesgo su vida,is to pose at risk his life
140,ARG1,2.0,AGAINST,139,RA,,,a més de matar el nen no nascut més,además de matar el niño no nacido más,in addition to killing the no born boy more
141,ARG1,2.0,AGAINST,135,RA,,,la mare gestant pot tenir una relació psicològica amb el nen,la madre gestante puede tener una relación psicológica con el niño,the mother gestant can have a psychological account with the boy
142,ARG1,2.0,AGAINST,141,RA,,,en aquesta evidència d'aquest estudi podem veure com la mare pot tenir relacions psicològiques amb el nen,en esta evidencia de este estudio podemos ver como la madre puede tener relaciones psicológicas con el niño,at this evidence of this survey can view how the mother can have psychological accounts with the boy
143,ARG1,2.0,AGAINST,142,RA,,,hi hauria una voluntat,habría una voluntad,there would be a will
144,ARG1,2.0,AGAINST,143,RA,,,em vull quedar el meu fill,me quiero quedar mi hijo,want to stay me my son
145,ARG1,2.0,AGAINST,144,RA,,,aquesta notícia del mundo on una mare vol quedar-se el nen,esta noticia del mundo donde una madre quiere quedarse el niño,this news of the mundo where a mother wants to stay the boy
146,ARG1,2.0,AGAINST,145,RA,,,el propi control judicial li dóna el nen,el propio control judicial le da el niño,the own judicial control gives him the boy
147,ARG1,2.0,AGAINST,145;146,RA,,,perquè considera que és seu,porque considera que es suyo,so that it considers that it is his
148,ARG1,2.0,AGAINST,142,RA,,,la dignitat de la mare en  tant que serà reduïda com un objecte,la dignidad de la madre en cuanto que será reducida como un objeto,the mother's dignity at so much that will be reduced how an object
149,ARG1,2.0,AGAINST,148,RA,,,només es buscarà el seu ventre,solo se buscará su vientre,only will seek  his belly
150,ARG1,3.0,AGAINST,16,RA,,,la gestació subrogada perjudicaria en el context que ens trobem la introducció del cavall de troia dins el nostre país,la gestación subrogada perjudicaría en el contexto que nos encontramos la introducción del caballo de troia dentro de nuestro país,the surrogacy would prejudice at the context that find us the introduction of the horse of troia in our country
151,ARG1,3.0,AGAINST,47;104;150,RA,,,comportaria la introducció de moltes màfies,comportaría la introducción de muchas mafias,would comport the introduction of a lot of mafias
152,ARG1,3.0,AGAINST,151,RA,,,a ucrania han hagut aparicions de màfies en les que han afectat a famílies espanyoles,a ucrania han habido apariciones de mafias en las que han afectado a familias españolas,at ucrania have had emergences of mafias at those that have affected at Spanish families
153,ARG1,3.0,AGAINST,150;151;152,RA,,,i el fet d'introduir la gestació subrogada a espanya afectarà A la nostra situació i el nostre ordenament jurídic,y el hecho de introducir la gestación subrogada a espanya afectará A nuestra situación y nuestro ordenamiento jurídico,and the fact to introduce the surrogacy at espanya will affect At our situation and our juridical arranging
154,ARG1,1.0,FAVOUR,,,,,com va dir el famós filòsof romà sèneca no és perquè les coses són difícils que no gosem sinó que és perquè no gosem que són difícils és perquè creiem que són difícils,como dijo el famoso filósofo romano sèneca no es porque las cosas son difíciles que no osemos sino que es porque no osamos que son difíciles es porque creemos que son difíciles,how said the famed Roman philosopher sèneca is not so that the things are difficult that do not dare but that it is so that we do not dare that they are difficult is so that we think that they are difficult
155,ARG1,1.0,FAVOUR,154,RA,,,les creences limitadores,las creencias limitadoras,the beliefs limitadores
156,ARG1,1.0,FAVOUR,,,,,hi ha quí diu que totes les dones pateixen el moment d'entregar el nadó,hay quí dice que todas las mujeres sufren el momento de entregar el bebé,there is quí says that all the wives suffer the moment to hand the baby
157,ARG1,1.0,FAVOUR,156,RA,,,una creença limitadora,una creencia limitadora,a belief limitadora
158,ARG1,1.0,FAVOUR,156;157,RA,,,es creu universalment establert un amor maternal,se cree universalmente establecido un amor maternal,thinks  universally established a maternal love
159,ARG1,1.0,FAVOUR,158,RA,,,delphine noos qui va estudiar antropologia explica en el seu llibre que és la maternitat que per a ella l'amor maternal no és algú innat sinó fruit de la societat,delphine noos quién estudió antropología explica en su libro que es la maternidad que para ella el amor maternal no es alguien innato sino fruto de la sociedad,delphine noos who studied anthropology explains at his book that is the motherhood that for her the maternal love is not somebody innate but fruit of the society
160,ARG1,1.0,FAVOUR,159,RA,,,i si hi ha dones que creuen que no és innat,y si hay mujeres que creen que no es innato,and if there are wives that think that it is not innate
161,ARG1,1.0,FAVOUR,160,RA,,,poden desenvolupar un amor diferent,pueden desarrollar un amor diferente,can develop a distinct love
162,ARG1,1.0,FAVOUR,160,RA,,,si creiem que és innat,si creemos que es innato,if we think that it is innate
163,ARG1,1.0,FAVOUR,162,RA,,, hauríem de tancar les llars d'infants,tendríamos que cerrar los hogares de niños,would have to shut the kindergartens
164,ARG1,1.0,FAVOUR,163,RA,,,aquestes dones que passen vuit hores amb tants infants,estas mujeres que pasan ocho horas con tantos niños,these wives that pass eight hours with so many girls
165,ARG1,1.0,FAVOUR,158;162,RA,,,com em podeu dir que no desenvolupa un amor de mare cap a aquests infants,como me podéis decir que no desarrolla un amor de madre hacia estos niños,how can me say that it does not develop mother's a love to these girls
166,ARG1,1.0,FAVOUR,,,,,hi ha qui diu que les dones que duen a terme una gestació subrogada no ho trien de manera lliure,hay quién dice que las mujeres que llevan a cabo una gestación subrogada no lo eligen de manera libre,there is who says that the wives that carry out a surrogacy do not elect it of free mode
167,ARG1,1.0,FAVOUR,,,,,sinó que depenen de les seves circumstàncies,sino que dependen de sus circunstancias,but that depend of his circumstances
168,ARG1,1.0,FAVOUR,167,RA,,,de quines circumstàncies parlen,de qué circunstancias hablan,of which circumstances talk
169,ARG1,1.0,FAVOUR,51,RA,,,el paper de la dona ha evolucionat gràcies a les Lleis,el papel de la mujer ha evolucionado gracias a las Leyes,the paper of the wife has evolved thanks to the Laws
170,ARG1,1.0,FAVOUR,169,RA,,,tenim dret a decidir quants fills volem,tenemos derecho a decidir cuántos hijos volamos,have law to decide how many children blast
171,ARG1,1.0,FAVOUR,169,RA,,,no hi ha llibertat sense norma,no hay libertad sin norma,there is not liberty without norm
172,ARG1,1.0,FAVOUR,171,RA,,,per això té tot el seu sentit  parlar de regulació de la gestació subrogada,por eso tiene todo su sentido hablar de regulación de la gestación subrogada,therefore has all his sense talk of regulation of the surrogacy
173,ARG1,,AGAINST,47;104;151;152,RA,,,no és una realitat actual la creació de màfia respecte a la gestació subrogada,no es una realidad actual la creación de mafia respecto a la gestación subrogada,is not an ongoing reality the creation of mafia with regard to the surrogacy
174,ARG1,2.0,FAVOUR,65;172,RA,,,condicionarem una regulació de l'estat,condicionaremos una regulación del estado,will condition a regulation of the state
175,ARG1,2.0,FAVOUR,174,RA,173,CA,no hi hauria màfies,no habría mafias,there would not be mafias
176,ARG1,2.0,FAVOUR,65;172;174,RA,,,per això la importància de la regulació,por eso la importancia de la regulación,therefore the importance of the regulation
177,ARG1,1.0,FAVOUR,51,RA,,,l'evolució de la mentalitat de la nostra societat,la evolución de la mentalidad de nuestra sociedad,the evolution of the mentality of our society
178,ARG1,1.0,FAVOUR,177,RA,,,abans una dona només es casava amb un home i tenia fills i així per tota la vida,antes una mujer solo se casaba con un hombre y tenía hijos y así por toda la vida,before a wife only married  with a man and had children and like this for all the life
179,ARG1,1.0,FAVOUR,178,RA,,,hem acceptat el divorci,hemos aceptado el divorcio,have accepted the divorce
180,ARG1,1.0,FAVOUR,179,RA,,,una dona es podia casar amb un home tenir fills decidir divorciar i aspirar a tenir fills amb un altre home,una mujer se podía casar con un hombre tener hijos decidir divorciar y aspirar a tener hijos con otro hombre,a wife could marry  with a man have children decide divorce and aspire at having children with another man
181,ARG1,1.0,FAVOUR,178,RA,,,avui una dona pot decidir quants quan i amb qui vol tenir fills,hoy una mujer puede decidir cuántos cuando y con quienes quiere tener hijos,today a wife can decide how many when and with who wants to have children
182,ARG1,1.0,FAVOUR,181,RA,,,que demà pugui decidir quan quants amb qui,que mañana pueda decidir cuando cuántos con quienes,that tomorrow can decide when how many with who
183,ARG1,1.0,FAVOUR,,,,,però per qui vol tenir fills,pero por quien quiere tener hijos,but for who wants to have children
184,ARG1,1.0,FAVOUR,183,RA,,,ja que podrà decidir lliurement i amb consciència,puesto que podrá decidir libremente y con conciencia,since it will be able to decide loosely and with conscience
185,ARG1,1.0,FAVOUR,184,RA,,,si vol dur a terme una gestació subrogada,si quiere llevar a cabo una gestación subrogada,if it wants to carry out a surrogacy
186,ARG1,,AGAINST,,,,,i el fet que pugui decidir inclús quan afecti els seus drets i llibertats,y el hecho que pueda decidir incluso cuando afecte sus derechos y libertados,and the fact that can decide even when affect his laws and liberties
187,ARG1,,AGAINST,186,RA,,,és una bona manera decidir,es una buena manera decidir,is a good mode decide
188,ARG1,1.0,FAVOUR,186,CA,,,no afectarà els seus drets,no afectará sus derechos,will not affect his laws
189,ARG1,1.0,FAVOUR,188,RA,,,ja que una bona regulació garantiria el seu benestar,puesto que una buena regulación garantizaría su bienestar,since a good regulation would guarantee his welfare
190,ARG1,1.0,FAVOUR,189,RA,,,tant de la gestant com de les parts implicades en aquesta gestació,tanto de la gestante como de las partes implicadas en esta gestación,so much of the gestant how of the parts implied at this gestation
191,ARG1,1.0,FAVOUR,75;88;189,RA,,,quines serien les propostes d'aquesta nova regulació que garantitzarien la dignitat integritat de la dona i el nen,qué serían las propuestas de esta nueva regulación que garantitzarien la dignidad integridad de la mujer y el niño,which would be the proposals of this new regulation that garantitzarien the dignity integrity of the wife and the boy
192,ARG1,1.0,FAVOUR,191,RA,,,que es faci a nivell nacional,que se haga a nivel nacional,that make  nationally
193,ARG1,1.0,FAVOUR,,,,,parla del perill de la mercantilització,habla del peligro de la mercantilización,talks of the peril of the mercantilització
194,ARG1,1.0,FAVOUR,193,RA,,,estem davant d'un sistema social de reproducció,estamos ante un sistema social de reproducción,are in front of a social system of reproduction
195,ARG1,1.0,FAVOUR,,,,,no parlem d'objectes,no hablamos de objetos,do not talk of objects
196,ARG1,1.0,FAVOUR,195,CA,,,sinó de persones,sino de personas,but of persons
197,ARG1,1.0,FAVOUR,196,RA,,,i per això les dones han de regular la gestació subrogada,y por eso las mujeres tienen que regular la gestación subrogada,and therefore the wives have to regulate the surrogacy
198,ARG2,3.0,AGAINST,,,,, avui dia existeix el context adequat per poder portar a terme aquest tipus de pràctica,hoy en día existe el contexto adecuado para poder llevar a cabo este tipo de práctica,nowadays exists the context adapted to be able to carry out this type of practice
199,ARG2,3.0,AGAINST,,,,,ens han parlat de la societat capitalista,nos han hablado de la sociedad capitalista,have talked us of the capitalist society
200,ARG2,3.0,AGAINST,64,MA,,,i de que estem en una època de millor predisposició,y de que estamos en una época de mejor predisposición,and of that we are at an epoch of better predisposition
201,ARG2,3.0,AGAINST,200,RA,,,per una vulneració de drets humans,por una vulneración de derechos humanos,for a violation of human laws
202,ARG2,3.0,AGAINST,199,RA,,,en la societat capitalista el que es caracteritza més és el capital,en la sociedad capitalista el que se caracteriza más es el capital,at the capitalist society what characterises  more is the capital
203,ARG2,1.0,AGAINST,200,RA,,,quin tipus de capital és aquest la dona i el nen,qué tipo de capital es este la mujer y el niño,which type of capital is this the wife and the boy
204,ARG2,1.0,AGAINST,201,RA,,,quin tipus de capital és aquest el nen,qué tipo de capital es este el niño,which type of capital is this the boy
205,ARG2,1.0,AGAINST,202,RA,,,perquè el nen s'està utilitzant com a contraprestació,porque el niño se está utilizando como contraprestación,so that the boy is utilising  as a contraprestació
206,ARG2,1.0,AGAINST,30;35;127;130;205,RA,,,s'està utilitzant per tant com a objecte,se está utilizando por lo tanto como objeto,is utilising  therefore as a object
207,ARG2,1.0,AGAINST,206,RA,,,ja sigui de forma altruista ,ya sea de forma altruista,already was of altruistic form
208,ARG2,1.0,AGAINST,207,RA,,,o sigui mitjançant uns diners,o sea intermediando un dinero,or are mediating a money
209,ARG2,1.0,AGAINST,206,RA,,,el nen continúa essent un objecte,el niño continúa siendo un objeto,the boy continúa being an object
210,ARG2,1.0,AGAINST,201,RA,,,aportarien un conjunt de garanties que respectarien els drets fonamentals,aportarían un conjunto de garantías que respetarían los derechos fundamentales,would contribute a pool of guarantees that would respect the fundamental laws
211,ARG2,1.0,AGAINST,202,RA,,,com tindrien cabuda aquest conjunt de garanties dins de l'ordenament jurídic ,como tendrían cabida este conjunto de garantías dentro del ordenamiento jurídico,how would fit this pool of guarantees in the juridical arranging
212,ARG2,1.0,AGAINST,211,RA,,,el nostre ordenament jurídic no permet aixó,nuestro ordenamiento jurídico no permite aixó,our juridical arranging does not permit aixó
213,ARG2,1.0,AGAINST,212,RA,,,No  existeix adequació a la norma,No existe adecuación en la norma,does not exist adequació at the norm
214,ARG2,,FAVOUR,30;35;127;130;206;209,CA,,,el fet que un nadó és gesti fora d'un ventre de la seva mare biològica no el converteix en un objecte,el hecho que un bebé es geste fuera de un vientre de su madre biológica no lo convierte en un objeto,the fact that a baby is gesti out of his biological mother's a belly does not convert it at an object
215,ARG2,2.0,AGAINST,,,,,la gestació subrogada és una tècnica per la qual la mare gestant que és la que té la capacitat per quedar-se embarassada gesta el nen dins del seu ventre,la gestación subrogada es una técnica por la cual la madre gestante que es la que tiene la capacidad para quedarse embarazada gesta el niño dentro de su vientre,the surrogacy is a technician for which the mother gestant that it is what has the capacity to stay  pregnant feat the boy in his belly
216,ARG2,2.0,AGAINST,215,RA,,,per tant no s'està buscant a la mare gestant,por lo tanto no se está buscando a la madre gestante,therefore it is not  seeking at the mother gestant
217,ARG2,2.0,AGAINST,216,RA,,,sinó que s'està buscant el ventre de la Gestant,sino que se está buscando el vientre de la Gestante,but that is seeking  the belly of the Gestant
218,ARG2,2.0,AGAINST,217,RA,,,hi ha diferència entre fer l'ús del cos i la cosificació,hay diferencia entre hacer el uso del cuerpo y la cosificación,there is difference among making the use of the body and the reification
219,ARG2,2.0,AGAINST,218,RA,,,perquè en aquest cas la mare gestant s'està anul·lant tota aquesta dimensió psicològica i racional,porque en este caso la madre gestante se está anulando toda esta dimensión psicológica y racional,so that at this case the mother gestant is annulling  all this psychological and rational dimension
220,ARG2,2.0,AGAINST,217;218,RA,,,perquè només interessa el ventre,porque solo interesa el vientre,so that only interests the belly
221,ARG2,2.0,AGAINST,220,RA,,,estem fent un ús del cos com si es tractés d'un objecte,estamos haciendo un uso del cuerpo como si se tratara de un objeto,are making an use of the body as if it treated  of an object
222,ARG2,2.0,AGAINST,221,RA,,,per tant en quin moment s'està respectant la integritat i la dignitat de la dona,por lo tanto en qué momento se está respetando la integridad y la dignidad de la mujer,therefore at which moment is respecting  the integrity and the dignity of the wife
223,ARG2,2.0,AGAINST,,,,,tot això de la societat econòmica que havien explicat,todo esto de la sociedad económica que habían explicado,everything this of the economic society that had explained
224,ARG2,2.0,AGAINST,,,,,cau pel seu propi pes,cae por su propio peso,lair for his own weight
225,ARG2,2.0,AGAINST,222;224,RA,,,perquè no respecta els drets humans,porque no respeta los derechos humanos,so that it does not respect the human laws
226,ARG2,2.0,AGAINST,,,,,han parlat sobre el tema de la dona,han hablado sobre el tema de la mujer,have talked on the motif of the wife
227,ARG2,2.0,AGAINST,187,RA,,,i de què se li està donant una possible elecció,y de que se le está dando una posible elección,and of what is him giving a possible election
228,ARG2,2.0,AGAINST,227,RA,,,perquè s'estigui mercantilitzant el seu cos,porque se esté mercantilizando su cuerpo,so that it was  mercantilitzant his body
229,ARG2,2.0,AGAINST,228,RA,,, s'està utilitzant a la dona,se está utilizando a la mujer,is utilising  at the wife
230,ARG2,2.0,AGAINST,228,RA,,,utilitzar el seu ventre com si fos un objecte,utilizar su vientre como si fuera un objeto,utilise his belly as if it was an object
231,ARG2,3.0,AGAINST,213,RA,,,no existeix adequació a norma,no existe adecuación a norma,does not exist adequació at norm
232,ARG2,3.0,AGAINST,231,RA,,,el sistema legal és com un trencaclosques,el sistema legal es como un rompecabezas,the legal system is how a puzzle
233,ARG2,3.0,AGAINST,232,RA,,,i en la mesura en què enganxem una peça que no encaixa tot es cau,y en la medida en que enganchamos una pieza que no encaja todo se cae,and at the size at what bond a piece that does not fit every falls
234,ARG2,3.0,AGAINST,233,RA,,,es tracta d'una falsedat,se trata de una falsedad,treats  of a deceitfulness
235,ARG2,3.0,AGAINST,234,RA,,,perquè en la mesura en la què això no és llibertat,porque en la medida en la qué esto no es libertado,so that at the size at the what this is not liberty
236,ARG2,3.0,AGAINST,235,RA,,,és caos,es caos,is chaos
237,ARG2,3.0,AGAINST,236,RA,,,l'estat no pot permetre que dins de l'ordenament jurídic hi hagi caos,el estado no puede permitir que dentro del ordenamiento jurídico haya caos,the state can not permit that in the juridical arranging there is chaos
238,ARG2,,FAVOUR,,,,,abans deia que quan ens interessem la gestació subrogada és només pel ventre de la mare,antes decía que cuando nos interesamos la gestación subrogada es solo por el vientre de la madre,before said that when interest us the surrogacy is only for the mother's belly
239,ARG2,,FAVOUR,,,,,Però si ens fixem sobre el model de regne unit,Pero si nos fijamos sobre el modelo de reino unido,But if we fix us on the model of realm united
240,ARG2,,FAVOUR,239,RA,,,abans de dur a terme una gestació subrogada,antes de llevar a cabo una gestación subrogada,before carrying out a surrogacy
241,ARG2,,FAVOUR,240,RA,,,tan comitents com la dona que vol dur a terme una gestació subrogada es passen mesos parlant i reflexionant,tan comitentes como la mujer que quiere llevar a cabo una gestación subrogada se pasan meses hablando y reflexionando,as comitents how the wife that wants to carry out a surrogacy pass  months talking and reflexionant
242,ARG2,,FAVOUR,230,CA,241.0,RA,aquí jo veig persones i no objectes,aquí yo veo personas y no objetas,here I view persons and do not object
243,ARG2,1.0,AGAINST,30;35;127;130;206;209,RA,242.0,CA,on està l'interés superior del menor en quant que aquest sí que s'utilitza com objecte,donde está el interés superior del menor en cuánto que este sí que se utiliza como objeto,where is the superior interest of the minor at how much that this aye that it utilises  how object
244,ARG2,3.0,AGAINST,47;104;151,RA,,,totes aquestes màfies que s'aprofitarien i utilitzarien precisament aquest cavall de troia,todas estas mafias que se aprovecharían y utilizarían precisamente este caballo de troia,all these mafias that would take advantage of  and would utilise precisely this horse of troia
245,ARG2,2.0,AGAINST,244,RA,,,on es trobaria aquesta protecció cap a la dona en la mesura,donde se encontraría esta protección hacia la mujer en la mesura,where would find  this protection to the wife at the size
246,ARG2,3.0,AGAINST,,,,,s'ha parlat molt de l'altruisme,se ha hablado mucho del altruismo,has talked  a lot of the altruism
247,ARG2,3.0,AGAINST,,,,,però és que l'altruisme en aquest tipus de contractes no es pot dur a terme aquest tipus de limitació,pero es que el altruismo en este tipo de contratos no se puede llevar a cabo este tipo de limitación,but is that the altruism at this type of agreements can not  carry out this type of limitation
248,ARG2,3.0,AGAINST,247,RA,,,i és que el altruisme no és una garantia,y es que el altruismo no es una garantía,and is that the altruism is not a guarantee
249,ARG2,3.0,AGAINST,248,RA,,,perquè  el dia de demà porto a terme un contracte de gestació subrogada,porque el día de mañana llevo a cabo un contrato de gestación subrogada,so that the day of tomorrow carry out an agreement of surrogacy
250,ARG2,3.0,AGAINST,249,RA,,,el dia següent el que estic fent és passar uns diners en negre aquella persona,el día siguiente el que estoy haciendo es pasar un dinero en negro aquella persona,the following day what am making is to pass a money at black that person
251,ARG2,2.0,FAVOUR,,,,,al meu país d'origen trobem nadons desprotegits per la llei,a mi país de origen encontramos bebés desprotegidos por la ley,at my country of origin find unprotected babies for the law
252,ARG2,2.0,FAVOUR,251,RA,,,a frança A gestació subrogada no és legal,a frança A gestación subrogada no es legal,at frança At surrogacy is not legal
253,ARG2,2.0,FAVOUR,252,RA,,,famílies se'n van a kíev per poder tenir fills a través de la gestació subrogada,familias se van a kíev para poder tener hijos a través de la gestación subrogada,families go  at kíev to be able to have children through the surrogacy
254,ARG2,2.0,FAVOUR,251;252;253,RA,,,quan tornen aquests nens no són protegits,cuando vuelven estos niños no son protegidos,when return these boys are not protected
255,ARG2,2.0,FAVOUR,254,RA,,,no són reconeguts per la llei,no son reconocidos por la ley,are not recognised by the law
256,ARG2,2.0,FAVOUR,255,RA,,,no tindran accés a la seguretat social a l'educació,no tendrán acceso a la seguridad social en la educación,will not fit at the social security at the nurture
257,ARG2,2.0,FAVOUR,256,RA,,,és una problemàtica,es una problemática,is a problematic
258,ARG2,2.0,FAVOUR,257,RA,,,hi ha registres en països que el nadó no podrà conèixer els seus orígens,hay registros en países que el bebé no podrá conocer sus orígenes,there are registries at countries that the baby will not be able to meet his origins
259,ARG2,2.0,FAVOUR,258,RA,,,una situació caòtica,una situación caótica,a chaotic situation
260,ARG2,2.0,FAVOUR,172;174;176;189;259,RA,,,per això té sentit parlar d'una regulació avui,por eso tiene sentido hablar de una regulación hoy,therefore has heard to talk of a regulation today
261,ARG2,2.0,FAVOUR,,,,,com aconseguirem aquesta regulació,como conseguiremos esta regulación,how will achieve this regulation
