ID (Chronological),TYPE (Part + Person),ARGUMENT NUMBER,TEAM STANCE,RELATED ID,ARGUMENTAL RELATION  TYPE,RELATED ID.1,ARGUMENTAL RELATION  TYPE.1,ADU_CAT,ADU_ES,ADU_EN
260,ARG2,,FAVOUR,49,RA,,,si per causes biològiques jo sóc infèrtil la meva única oportunitat de poder ser pare els nostres company no la volen acceptar,si por causas biológicas yo soy infértil mi única oportunidad de poder ser padre nuestros compañero no la quieren aceptar,if for biological causes I am infertile my only opportunity to be able to being pause our partner do not want to it accept
261,ARG2,,FAVOUR,,,,,els nostres companys són tan freds que deixarien aquest nadó fora de la possibilitat de viure conjuntament en família,nuestros compañeros son tan fríos que dejarían este bebé fuera de la posibilidad de vivir conjuntamente en familia,our partners are as cold that they would let this baby out of the possibility to live jointly at family
262,ARG2,,FAVOUR,,,,,gràcies a la saviesa dels japonesos van poder introduir aquest nadó a dins de japó,gracias a la sabiduría de los japoneses pudieron introducir este bebé adentro de japó,thanks to the wisdom of the Japanese could introduce this baby in japó
263,ARG2,,FAVOUR,262,RA,,,això ha estat gràcies al neoliberalisme,esto ha estado gracias al neoliberalismo,this has been thanks to the neoliberalism
264,ARG2,,FAVOUR,,,,,el neoliberalisme no significa que vingui un polític i comenci a parasitar les institucions,el neoliberalismo no significa que venga un político y empiece a parasitar las instituciones,the neoliberalism does not mean that it come a politician and commence at parasitar the institutions
265,ARG2,,FAVOUR,,,,,el neoliberalisme significa àdam smith riquesa de les nacions,el neoliberalismo significa àdam smith riqueza de las naciones,the neoliberalism means àdam smith wealth of the nations
266,ARG2,,FAVOUR,,,,,significa que es basa en quatre postulats què són les següents,significa que se basa en cuatro postulados qué son las siguientes,means that it bases  at four postulates what are the following
267,ARG2,,FAVOUR,266,RA,,,sa llibertat habitual igualtat jurídica individualisme autonomia contractual,su libertad habitual igualdad jurídica individualismo autonomía contractual,his habitual liberty juridical equality individualism contractual autonomy
268,ARG2,,FAVOUR,266,RA,,,i sobretot un govern limitat,y sobre todo un gobierno limitado,and especially a governance limited
269,ARG2,3,FAVOUR,,,,,és el govern el que està parasitant les institucions en aquell moment  que faci que la meva acció no sigui feta a la llarga,es el gobierno el que está parasitant las instituciones en aquel momento que haga que mi acción no sea hecha a la larga,is the governance what is parasitant the institutions at that moment that make that my act was not made in the long run
270,ARG2,3,FAVOUR,,,,,no suportarem cap mena de estat paternalista i liberticida cap a  els drets individuals de subjecte social d'una societat,no soportaremos ningún tipo de estado paternalista y liberticida hacia los derechos individuales de sujeto social de una sociedad,will not endure any type of been paternalista and liberticida to the individual laws of social subject of a society
271,ARG2,3,AGAINST,255,MA,,,un ciutadà japonès violant  obertament la llei japonesa perquè era conscient que era il·legal allà  va la incompleix fora del territori,un ciudadano japonés violando abiertamente la ley japonesa porque era consciente que era ilegal allá va la incumple fuera del territorio,a Japanese citizen raping openly the Japanese law so that it was conscious that it was illegal there futile breaches it out of the territory
272,ARG2,3,AGAINST,271,RA,,,i això és una raó per  legalitzar una cosa que ell havia incomplert,y esto es una razón para legalizar una cosa que él había incumplido,and this is a reason to legalise a thing that he had breached
273,ARG2,3,FAVOUR,272,CA,,,el primer negre que estats  units va votar la llei de què no es podia seure en  el lloc on s'ha d'asseure una persona blanca  també ho va fer malament,el primer negro que estados unidos votó la ley de que no se podía sentar en el lugar donde se tiene que sentar una persona blanca también lo hizo mal,the first black that states united voted the law of what could not  seat at the place where has to seat  a white person also made it poorly
274,ARG2,3,FAVOUR,,,,,les lleis han d'anar evolucionant,las leyes tienen que ir evolucionando,the laws have to go evolving
275,ARG2,,FAVOUR,,,,,jo he d'anar evolucionant,yo tengo que ir evolucionando,I have to go evolving
276,ARG2,,FAVOUR,275,RA,,, sóc una persona que vaig començar la carrera universitaria amb uns ideals,soy una persona que empecé la carrera universitaria con unos ideales,am a person that commenced the career universitaria with some ideals
277,ARG2,,FAVOUR,276,RA,,,i l'he acabat en uns altres,y lo he acabado en otros,and have ended it at other
278,ARG2,,FAVOUR,275,RA,,,he evolucionat,he evolucionado,have evolved
279,ARG2,3,FAVOUR,274,RA,,,les lleis han d'anar evolucionant mitjançant la societat va demanant noves lleis,las leyes tienen que ir evolucionando mediante la sociedad va pidiendo nuevas leyes,the laws have to go evolving by means of the society goes requesting new laws
280,ARG2,,FAVOUR,247,RA,,,lo que no hem de fer és establir què mos quedam en el segle ú,lo que no tenemos que hacer es establecer que bocado quedamos en el siglo ú,lo that do not have to make is to establish what snack stay at the century ú
281,ARG2,,FAVOUR,280,RA,,,estem al segle vint-i-u,estamos en el siglo veintiuno,are at the century twenty-and-u
282,ARG2,,FAVOUR,,,,,hi ha altres demandes,hay otras demandes,there are other demands
283,ARG2,,FAVOUR,265,RA,,,la definició de lliberal d'adam smith sobre la riquesa de les nacions que perquè això va de demanda i oferta,la definición de liberal de adam smith sobre la riqueza de las naciones que porque esto va de demanda y ofrecida,the definition of liberal of adam smith on the wealth of the nations that so that this goes of demand and offer
284,ARG2,,FAVOUR,283,RA,,,si hi ha una demanda perquè biològicament no podem suplir aquestes necessitats ha d'haver una oferta implícita,si hay una demanda porque biológicamente no podemos suplir estas necesidades tiene que haber una oferta implícita,if there is a demand so that biologically can not suplir these necessities has to have an implicit offer
285,ARG2,3,FAVOUR,,,,,l'estat no ha de  poder intervindre,el estado no tiene que poder intervenir,the state does not have to can intervene
286,ARG2,3,FAVOUR,,,,,ha de facilitar aquest camí perquè és un mètode,tiene que facilitar este camino porque es un método,has to facilitate this path so that it is a method
287,ARG2,,FAVOUR,,,,,és el neoliberalisme d'adam smith,es el neoliberalismo de adam smith,is the neoliberalism of adam smith
288,ARG2,,FAVOUR,269,RA,,,lo altre  està parasitat,lo otro está parasitat,lo other is parasitat
289,ARG2,,FAVOUR,,,,,no limitaràn l'adopció per aprovar la gestació subrogada,no limitaràn la adopción para aprobar la gestación subrogada,no limitaràn the adoption to approve the surrogacy
290,ARG2,3,FAVOUR,289,RA,,,jo puc adoptar,yo puedo adoptar,I can adopt
291,ARG2,2,FAVOUR,,,,,però  puc tenir altres fills d'una manera normal,pero puedo tener otros hijos de una manera normal,but can have other children of a normal mode
292,ARG2,2,FAVOUR,291,MA,,,però  la gestació subrogada és el fet que et dono de manera normal,pero la gestación subrogada es el hecho que te doy de manera normal,but the surrogacy is the fact that give you of normal mode
293,ARG2,,FAVOUR,292,RA,,, donarem el mètode aquesta  persona que sigui papa,daremos el método esta persona que sea papa,will give the method this person that was pope
294,ARG2,3,FAVOUR,,,,,alhora també que pugui adoptar,a la vez también que pueda adoptar,CONCurrently also that it can adopt
295,ARG2,2;3,FAVOUR,290;291,RA,,,les dues coses poden conviure conjuntament ,las dos cosas pueden convivir conjuntamente,the two things can coexist jointly
296,ARG2,,FAVOUR,295,RA,,,no hi ha què limitar ni una que l'altra,no hay qué limitar ni una que la otra,there is not what limit or one that the other
297,ARG2,,FAVOUR,296,MA,,,han de facilitar la convivència de les dues opcions,tienen que facilitar la convivencia de las dos opciones,have to facilitate the coexistence of the two options
298,ARG2,,FAVOUR,297,RA,,,com a estat no paternalista i no liberticida han de fer això,como estado no paternalista y no liberticida tienen que hacer esto,as a state no paternalista and no liberticida have to make this
299,ARG2,,FAVOUR,,,,,han d'aprovar,tienen que aprobar,have to approve
300,ARG2,2,AGAINST,284,MA,,,si hi ha una demanda implícita hi ha d'haver una oferta,si hay una demanda implícita hay de haber una ofrecida,if there is an implicit demand there has to be an offer
301,ARG2,,AGAINST,300,RA,,,pot dir el mateix sobre les drogues o les armes,puede decir el mismo sobre las drogas o las armes,can say the same on the drugs or the arms
302,ARG2,,FAVOUR,,,,,això és l'argument de sai,esto es el argumento de sai,this is the argument of sai
303,ARG2,,FAVOUR,,,,,l'argument de say de dintre del noelliberalisme es va equivocar,el argumento de say de dentro del noelliberalisme se equivocó,the argument of say of inside of the noelliberalisme goes  equivocar
304,ARG2,,FAVOUR,303,RA,,,i per això va aparèixer en marshall,y por eso apareció en marshall,and therefore it appeared at marshall
305,ARG2,,FAVOUR,,,,,el fet que tu facis una tenda de gelats no implica que tu hagis de tenir clients,el hecho que tú hagas una tienda de helados no implica que tú tengas que tener clientes,the fact that you make a tent of ice creams does not imply that you have to have customers
306,ARG2,,FAVOUR,,,,,el fet és la necessitat,el hecho es la necesitado,the fact is the necessity
307,ARG2,,FAVOUR,,,,,les drogues és una substància la qual és nociva i sobretot adictiva,las drogas es una sustancia la cual es nociva y sobre todo adictiva,the drugs is a substance which is harmful and especially adictiva
308,ARG2,,FAVOUR,307,RA,,,el fet de tenir fills no és addictiu,el hecho de tener hijos no es adictivo,the fact to have children is not addictive
309,ARG2,,FAVOUR,,,,,una persona té un fill,una persona tiene un hijo,a person has a son
310,ARG2,,FAVOUR,309,RA,,,i no significa que vagi a tenir deu fills,y no significa que vaya a tener diez hijos,and does not mean that it go at having ten children
311,ARG2,,FAVOUR,301,CA,,,m'estàs comparant una drogoaddicció  amb un fet de generositat,me estás comparando una drogadicción con un hecho de generosidad,are comparing me a drug addiction with a fact of generosity
312,ARG2,,FAVOUR,311,RA,,,tenir una generositat no és una drogoaddicció,tener una generosidad no es una drogadicción,have a generosity is not a drug addiction
313,ARG2,2,FAVOUR,,,,,un fill és una persona,un hijo es una persona,a son is a person
314,ARG2,2,FAVOUR,313,MA,,,és un nadó,es un bebé,is a baby
315,ARG2,,FAVOUR,313,MA,,,com a éssers humans hem avançat,como seres humanos hemos avanzado,as a human beings have advanced
316,ARG2,,FAVOUR,,,,,no hem endarrerit com els animals que només per sobreviure l'espècie,no hemos atrasado como los animales que solo para sobrevivir la especie,have not retarded like the animals that only to survive the species
317,ARG2,,FAVOUR,316,CA,,,hem avançat perquè volem felicitar,hemos avanzado porque queremos felicitar,have advanced so that we want to congratulate
318,ARG2,,FAVOUR,317,MA,,,volem compartir la nostra felicitat,queremos compartir nuestra felicidad,want to share our happiness
319,ARG2,,FAVOUR,317,CA,,,i sobretot no volem insultar ningú,y sobre todo no queremos insultar nadie,and especially do not want to insult nobody
320,ARG2,,FAVOUR,318,MA,,,volem que tothom pugui tenir la certesa de que ha de compartir lo que és bo,queremos que todo el mundo pueda tener la certeza de que tiene que compartir lo que es buen,want to that everybody can have the certainty of that it has to share lo that it is good
321,ARG2,,FAVOUR,320,RA,,,i lo que és dolent,y lo que es doliendo,and lo that it is hurting
322,ARG2,,FAVOUR,316,RA,,,si mos queda en un paternalisme un lliberticida del qual no deixa que les multituds de diferència continuï creixent aquest món s'endarrerirà,si nos queda en un paternalismo un liberticida del cual no deja que las multitudes de diferencia continúe creciendo este mundo se atrasará,if snack stays at a paternalisme a lliberticida of which does not let that the crowds of difference continue growing this world will retard
323,CONC,,FAVOUR,,,,,molt bon dia primer de tot agrair a tots per aquest tan interessant  debat als nostres contrincants el jurat i per suposat a la universitat de barcelona  i els als meus companys  en aquest debat tan tan important tan impactant sobre la nostra societat  ens hem quedat de vegades en els  anunciats ens han parlat que eren fal·laços sense explicar mai com  nosaltres en canvi pel contrari hem explicat cada argument  i hem entrat en cada raonament i direm ara repassarem com  primer de tot hem dit que hi havia un argument social pel qual  s'ha de legalitzar la gestació subrogada    hem dit que l'accés a la maternitat no pot estar determinat només  en qüestions biològiques aquest determinisme de només puc  tenir el meu propi fill si la meva capacitat biològica ho permet  quan hi ha possibilitats tecnològiques quan estem en el moment  en què és possible fer-ho igualment negar això és totalment injust  i per tant nosaltres hem apostat per la gestació subrogada  ens han contestat els companys és veritat ens han dit bueno dubtem  però els hem dit que no era el mateix primer de tot perquè  com ha dit el meu company andreu en la gestació subrogada  a part que és el teu propi fill pot participar al llarg del procés  i a més a més com ens ha anat més a ells mateixos és ineficient  i tot i així hem entrat hem dit  tot i que passi això que no sigui del tot eficient podem fer  les dues coses a la vegada podem millorar el sistema d'adopcions i  a la vegada permetre que les mares que no poden tenir els seus fills biològicament  ho facin per tant aquest argument ha quedat en peu  què més ha passat hem dit hi ha un argument legal  que deia que precisament la legalització permet evitar tots  aquests riscos que ens plantejaven podem protegir a la gestan  en casos grisos en casos en què no se sap què passa amb la custòdia  en què es veu sent mare quan no volia estem ara realment protegim el nadó  perquè les despeses al llarg de la gestació i per tant que  tenen un impacte en el seu desenvolupament estan coberts  i a més a més de nou no hi ha casos grisos de custòdies mai deixem  abandonat un nen als sol·licitants perquè hi ha unes garanties en el procés  cap i a la fi hem dit hi ha un marc legal que protegeix a cadascuna de les parts  s'han parlat explotació ens han parlat de cosificació i això mai  res tenia veure amb aquest debat ens han parlat de liberalisme  i hem entrat n'hem parlat hem dit l'estat regularà però dintre dels seus límits  i això ens ha portat a un tercer argument  que era el punt de la llibertat individual  que deia aquest aquest argument  al cap i a la fi qui és l'estat per decidir com un pot  formar la seva família o no quan hi ha possibilitats de fer-ho com on vol  ells ho han criminalitzat però nosaltres hem apostat per aquesta possibilitat  i aquesta capacitat de decisió  i la gestant també ella té una llibertat individual i ho hem dit  ens han posat una postura una mica paternalista  dient que hem de protegir aquesta dona que hem de protegir el feble nosaltres hem dit  no deixem decidir aquesta dona és el seu propi cos i és ella  qui amb aquest contracte amb aquestes condicions conegudes  ha de decidir si vol o no vol ser la mare gestant per una altra família  per tant hem dit  per un argument social és a dir  perquè els vols parteixen cada dia i entenem que parteixin  entenem que si una mare no pot ser pilot del seu propi avió vingui un altre  i sigui el pilot per aquest nadó  entenem que per un argument legal perquè podem fer unes lleis d'aviació  civil per seguir amb l'analogia per això té sentit legalitzar la gestació subrogada  i en tercer lloc perquè si hi ha una dona que vol pilotar  hi ha una família que vol rebre el seu nen  és a dir per aquesta llibertat individual no som qui per intervenir  i decidir que s'ha de prohibir sense una justificació per totes aquestes raons  gràcies de nou i seguim pensant que s'ha de legalitzar la gestació subrogada  moltes gràcies,muy buen día antes que nada agradecer a todos por este tan interesante debate a nuestros contrincantes el jurado y por supuesto en la universidad de barcelona y los a mis compañeros en este debate tan tan importando tan impactante sobre nuestra sociedad nos hemos quedado a veces en los anunciados nos han hablado que eran falaces sin explicar nunca como nosotros en cambio por el contrario hemos explicado cada argumento y hemos entrado en cada razonamiento y diremos ahora repasaremos como antes que nada hemos dicho que había un argumento social por el cual se tiene que legalizar la gestación subrogada hemos dicho que el acceso a la maternidad no puede estar determinado solo en cuestiones biológicas este determinismo de solo puedo tener mi propio hijo si mi capacidad biológica lo permite cuando hay posibilidades tecnológicas cuando estamos en el momento en qué es posible hacerlo igualmente negar esto es totalmente injusto y por tanto nosotros hemos apostado por la gestación subrogada nos han contestado los compañeros es verdad nos han dicho bueno dudamos pero los hemos dicho que no era el mismo antes que nada porque como ha dicho mi compañero andreu en la gestación subrogada fuera de que es tu propio hijo puede participar a lo largo del proceso y además como nos ha ido más a ellos mismos es ineficiente y aun así hemos entrado hemos dicho a pesar de que pase esto que no sea del todo eficiente podemos hacer las dos cosas a la vegada podemos mejorar el sistema de adopciones y a la vegada permitir que las madres que no pueden tener sus hijos biológicamente lo hagan por lo tanto este argumento ha quedado en pie que más ha pasado hemos dicho hay un argumento legal que decía que precisamente la legalización permite evitar todos estos riesgos que nos planteaban podemos proteger a la gestan en casos grises en casos en que no se sabe qué pasa con la custodia en que se ve siendo madre cuando no quería estamos ahora realmente protegemos el bebé porque los gastos a lo largo de la gestación y por tanto que tienen un impacto en su desarrollo están cubiertos y además de nuevo no hay casos grises de custodias nunca dejamos abandonado un niño a los solicitantes porque hay unas garantías en el proceso cabe y al fin hemos dicho hay un marco legal que protege a cada una de las partes se han hablado explotación nos han hablado de cosificación y esto nunca nada tenía ver con este debate nos han hablado de liberalismo y hemos entrado hemos hablado hemos dicho el estado regulará pero dentro de sus límites y esto nos ha llevado a un tercer argumento que era el punto de la libertad individual que decía este este argumento al fin y al cabo quién es el estado para decidir como uno puede formar su familia o no cuando hay posibilidades de hacerlocomo dónde quiere ellos lo han criminalizado pero nosotros hemos apostado por esta posibilidad y esta capacidad de decisión y la gestante también ella tiene una libertad individual y lo hemos dicho nos han puesto una postura un poco paternalista diciendo que tenemos que proteger esta mujer que tenemos que proteger el débil nosotros hemos dicho no dejamos decidir esta mujer es su propio cuerpo y es ella quien con este contrato con estas condiciones conocidas tiene que decidir si quiere o no quiere ser la madre gestante por otra familia por lo tanto hemos dicho por un argumentosocial es decir porque los vuelos parten cada día y entendemos que partan entendemos que si una madre no puede ser piloto de su propio avión venga otro y sea el piloto por este bebé entendemos que por un argumento legal porque podemos hacer unas leyes de aviación civil para seguir con la analogía por eso tiene sentido legalizar la gestación subrogada y en tercer lugar porque si hay una mujer que quiere pilotar hay una familia que quiere recibir su niño es decir por esta libertad individual no somos quien para intervenir y decidir quese tiene que prohibir sin una justificación por todas estas razones gracias de nuevo y seguimos pensando que se tiene que legalizar la gestación subrogada muchas gracias,a lot of good morning first of all appreciate at all for this as interesting debate at our opponents the jury and for supposed at the university of barcelona and the at my partners at this debate as as importing as impacting on our society have stayed us sometimes at the announced have talked us that they were fallacious without explaining never like us instead for the opposite have explained each argument and have entered at each reasoning and will say now will review how first of all have said that there was a social argument for which has to legalise  the gestation subrogada have said that the fit at the motherhood can not be determined only at biological questions this determinism of only can have my own son if my biological capacity permits it when has made possible  technological when are at the moment at what is possible to make it equally deny this is totally unfair and therefore we have bet for the surrogacy have answered us the partners is truth have said us bueno doubt but have said the ones that it was not the same first of all so that how has said my partner andreu at the surrogacy aside that it is your own son can take part along the process and in addition how has gone us more at them same is inefficient and yet we have entered have said although it pass this that was not in its entirety efficient can make the two things at any one time can improve the system of adoptions and at any one time permit that the mothers that can not have his children biologically make it therefore this argument has stayed at foot what more has passed have said there is a legal argument that said that precisely the legalisation permits to eschew all these risks that posed us can protect at the gestan at grey cases at cases at what does not know  what passes with the custody at what views  being mother when did not want to are now really protect the baby so that the expenses along the gestation and therefore that have an impact at his development are coated and in addition to new there are not grey cases of custodies never let abandoned a boy at the applicants so that there are some guarantees in the process cape and at the end have said there is a legal frame that protects at cadascuna of the parts have talked  exploitation have talked us of reification and this never nothing had view with this debate have talked us of liberalism and have entered have talked  have said the state will regulate but inside of his limits and this has taken us at a third argument that was the point of the individual liberty that said this this argument after all who is the state to decide like one can form his family or no when has made possible  to make it how where loves they have it criminalitzat but we have bet for this possibility and this capacity of decision and the gestant also she has an individual liberty and have said it have posed us a posture a bit paternalista saying that we have to protect this wife that have to protect the weak we have said do not let to decide this wife is his own body and is she who with this agreement with these conditions met has to decide if it wants to or does not want to being the mother gestant for another family therefore we have said for an argument social that is to say so that the flights split every day and understand that they split understand that if a mother can not be pilot of his own airliner come another and was the pilot for this baby understand that for a legal argument so that we can make some laws of civil aviation to track with the analogy therefore has heard to legalise the surrogacy and thirdly so that if there is a wife that wants to pilot there is a family that wants to get his boy that is to say for this individual liberty are not who to intervene and decide that has to prohibit  without a justification for all these reasons thank you of walnut and track thinking that has to legalise  the surrogacy a lot of thank you
