ID (Chronological),TYPE (Part + Person),ARGUMENT NUMBER,TEAM STANCE,RELATED ID,ARGUMENTAL RELATION  TYPE,RELATED ID.1,ARGUMENTAL RELATION  TYPE.1,RELATED ID.2,ARGUMENTAL RELATION  TYPE.2,ADU_CAT,ADU_ES,ADU_EN
82,ARG1,1,FAVOUR,45;47;59;61;70,CA,80;81,RA,,,per tant no s'està mercantilitzat amb el nen ,por lo tanto no se está mercantilizado con el niño,therefore it is not  mercantilitzat with the boy
83,ARG1,1,FAVOUR,82,RA,,,,,afirmar que es mercantilitzen el nen en aquest sentit seria com dir que adoptant s'està mercantilitzant nens,afirmar que se mercantilizan el niño en este sentido seria como decir que adoptador se está mercantilizando niños,affirm that  mercantilitzen the boy at this sense would be like saying that adopter is  mercantilitzant boys
84,ARG1,1,FAVOUR,43,CA,,,,,en segon lloc enfoquen també aquest argument que no es pot llogar un ventre ,en segundo lugar enfocan también este argumento que no se puede alquilar un vientre,in the second place focus also this argument that can not  rent a belly
85,ARG1,1,FAVOUR,,,,,,,amb el cos de la dona no es pot mercantilitzar,con el cuerpo de la mujer no se puede mercantilizar,with the body of the wife can not  mercantilitzar
86,ARG1,1,FAVOUR,,,,,,, però es que el que nosaltres proposem no és utilitzar la dona com a objecte de comerç,pero se que el que nosotros proponemos no es utilizar la mujer como objeto de comercio,but  that what we propose is not to utilise the wife as a object of trade
87,ARG1,1,FAVOUR,4;17;24;30;34,RA,,,,,és legalitzar per tal que aquesta dona pugui de forma totalment altruista participar en aquest procés ,es legalizar para que esta mujer pueda de forma totalmente altruista participar en este proceso,is to legalise in order that this wife can of form totally altruistic take part in this process
88,ARG1,1,FAVOUR,4;17;24;30;34,RA,,,,,no ser objecte de cobert justament perquè el que passa és que quan nosaltres no la legalitzen les dones que són objecte de comerç són dones d'altres països,no ser objeto de cubierto justamente porque el que pasa es que cuando nosotros no la legalizan las mujeres que son objeto de comercio son mujeres otros países,not being object of silverware justly so that what passes is that when we do not legalise it the wives that are object of trade are wives of other countries
89,ARG1,1,AGAINST,,,,,,,quina opinió li mereix que actualment el psoe mitjançant la nova proponents no instrucció al direcció risc i notarial immaterial actualment no es registren els nens a espanya,qué opinión le merece que actualmente lo psoe mediante la nueva proponentes no instrucción al dirección riesgo y notarial inmaterial actualmente no se registran los niños a espanya,which opinion merits him that at present the psoe by means of the new proponents no instruction at the address risk and notarial immaterial at present do not register  the boys at espanya
90,ARG1,1,FAVOUR,10;28;89,RA,,,,,segons la reforma que es va donar el dos mil disset del codi civil almenys registren automàticament espanya ,según la reforma que se dio el dos mil diecisiete del código civil al menos registran automáticamente espanya,according to the reform that gave  the two thousand seventeen of the civil code at least register automatically espanya
91,ARG1,1,FAVOUR,,,,,,,això ve a través d'una directiva europea,esto viene a través de una directiva europea,this comes through a European director
92,ARG1,2,FAVOUR,51;64;66,MA,,,,,ens parlen del cavall de troia de les màfies,nos hablan del caballo de troia de las mafias,talk us of the horse of troia of the mafias
93,ARG1,2,FAVOUR,92,RA,,,,,amb la llei seca als estats units el que es va donar és que es va prohibir l'alcohol,con la ley seca en los estados unidos el que se dio es que se prohibió el alcohol,with the dry law at the states united what gave  is that it prohibited  the alcohol
94,ARG1,2,FAVOUR,93,RA,,,,,això és el que va generar les màfies,esto es el que generó las mafias,this is what generated the mafias
95,ARG1,2,FAVOUR,93,RA,,,,, no només això ,no solo esto,no only this
96,ARG1,2,FAVOUR,1;2;4;17;24;30;31;34;87,RA,,,,,sinó que hi ha estudis com el de la catedràtica catherin dou que diu que una manera d'acabar amb la tracta i l'explotació de les dones és legalitzant,sino que hay estudios como el de la catedrática catherin dou que dice que una manera de acabar con la trata y la explotación de las mujeres es legalizando,but that there are surveys like the of the catedràtica catherin dou that it says that a mode to end with treats it and the exploitation of the wives is legalising
97,ARG1,3,FAVOUR,52;72,CA,,,,,l'efecte rebot de com pujaria la demanda i l'oferta es mantindria igual,el efecto rebote de cómo subiría la demanda y la oferta se mantendría igual,the effect rebound of how would climb the demand and the offer would maintain  the same
98,ARG1,3,FAVOUR,97,CA,,,,,però no obstant això no és cert com demostra el cas del canadà,pero sin embargo no es cierto como demuestra el caso del canadà,but nevertheless is not some how evidences the case of the canadà
99,ARG1,3,FAVOUR,98,RA,,,,,el cas del canadà una vegada es va regular l'oferta va pujar perquè a les dones se'ls donava totes les garanties,el caso del canadà una vez se reguló la oferta subió porque a las mujeres se los daba todas las garantizabas,the case of the canadà a time regulated  the offer climbed so that at the wives gave the ones all the guarantees
100,ARG1,3,FAVOUR,33;27,RA,58,MA,,,és veritat a espanya ara mateix està prohibit segons l'article deu,es verdad a espanya ahora mismo está prohibido según el artículo diez,is truth at espanya right now is prohibited according to the article owes
101,ARG1,3,FAVOUR,6;7;8;9;10;11;12;13;4;15;27;29;33;100,RA,58,MA,,,a espanya existeix una realitat i és aquesta prohibició,a espanya existe una realidad y es esta prohibición,at espanya exists a reality and is this ban
102,ARG1,3,FAVOUR,,,,,,,però és que aquesta prohibició no és eficaç ,pero es que esta prohibición no es eficaz,but is that this ban is not effective
103,ARG1,3,FAVOUR,79;80;81;82;83,RA,,,,,per la protecció del nen ,por la protección del niño,for the protection of the boy
104,ARG1,3,FAVOUR,10;28;90,RA,,,,,els nens s'han d'escriure i per tant es dóna igual,los niños se tienen que escribir y por tanto se da igual,the boys have to write  and therefore it gives  the same
105,ARG1,3,FAVOUR,11;18,RA,,,,,si això ho conjuguem amb la falta d'harmonització internacional en el tema el que passa és que les parelles espanyoles riques se'n van a altres perque s'ho poden permetre,si esto lo conjugamos con la falta de armonización internacional en el tema el que pasa es que las parejas españolas ricas se van a otras perque se lo pueden permitir,if this conjugate it with the fault of international harmonisation at the motif what passes is that the affluent Spanish couples go  at other perque can it permit
106,ARG1,3,FAVOUR,10;11;18;28;90;104;105,RA,,,,,s'en van a ucraina i gesten els seus nens allà els porten a espanya i els inscriuen ,se van a ucraina y gestan sus niños allá los llevan a espanya y los inscriben,go  at ucraina and gesten his boys there take the ones at espanya and inscribe the ones
107,ARG1,3,FAVOUR,105;106,RA,,,,,per tant li donen la volta ,por lo tanto le dan la cerca,therefore they give him the turn
108,ARG1,3,FAVOUR,11;18;105;106,RA,,,,,la previsió és que com es produeix això com demostra ronald cohen en el seu estudi sobre turisme reproductiu es tradueix en el mateix amb el que va passar a l'avort ,la previsión es que como se produce esto como demuestra ronald cohen en su estudio sobre turismo reproductivo se traduce en el mismo con el que pasó al avort,the forecast is that like produces  this how evidences ronald cohen at his survey on reproductive tourism translates  at the same with what passed at the avort
109,ARG1,2;3,FAVOUR,11;18;105;106,RA,,,,,l'avort estava prohibit a espanya només els rics s'ho podien permetre,la avort estaba prohibido a espanya solo los ricos se lo podían permitir,the avort was prohibited at espanya only the affluent could it permit
110,ARG1,2;3,FAVOUR,109,RA,,,,,però no només això sinó que s'anaven a unes condicions precàries,pero no solo esto sino que se iban a unas condiciones precarias,but no only this but that went  at some precarious conditions
111,ARG1,2;3,FAVOUR,11,MA,,,,,que en aquest sentit es traduiria com per exemple diu xavier garcía armes o cristina berger en una explotació reproductiva a altres països ,que en este sentido se traduciría como por ejemplo dice xavier garcía armas o cristina berger en una explotación reproductiva a otros países,that at this sense would translate  like for example says xavier garcía arms or cristina berger at a reproductive exploitation at other countries
112,ARG1,2;3,FAVOUR,109;110;11,RA,,,,,és problema nostre que s'estiguin explotant aquestes dones a ucraina o a georgia,es problema nuestro que se estén explotando estas mujeres a ucraina o a georgia,is ours problem that are exploding  these wives at ucraina or at georgia
113,ARG1,2;3,FAVOUR,20;21;22,RA,,,,,segons el comissionat de les nacions unides la dignitat de les persones és responsabilitat de tots els estats una pràctica fa que s'estigui donant igualment en altres països que no son garantistes ,según el comisionado de las naciones unidas la dignidad de las personas es responsabilidad de todos los estados una práctica hace que se esté dando igualmente en otros países que no su garantistas,as the comissionat of the nations united the dignity of the persons is responsibility of all the states a practice makes that it was giving  equally at other countries that no sleep garantistes
114,ARG1,2;3,AGAINST,15;19;23;24;25;26;27,CA,,,,,quina opinió li mereix que precisament el fet de regularitzar podria crear una economia submergida i espanya no tindria el control judicial suficient ,qué opinión le merece que precisamente el hecho de regularizar podría crear una economía sumergida y espanya no tendría el control judicial suficiente,which opinion merits him that precisely the fact of regularitzar could create an economics submerged and espanya would not the sufficient judicial control
115,ARG1,2;3,FAVOUR,114,CA,,,,,això no és pas cert com ja hem demostrat anteriorment,esto no es paso cierto como ya hemos demostrado anteriormente,this is not not some like already have evidenced anteriorly
116,ARG1,2;3,FAVOUR,4;15;17;19;24;30;34;87;96;11;18;105;106;108;109,RA,,,,,l'estudi de caterin dove catedràtica en dret constitucional justament la forma de legalitzar-ho el que passaria és que hi hauria un control més eficaç i a més s'acabaria amb aquesta tracta,el estudio de caterin dove catedrática en derecho constitucional justamente la forma de legalizarlo el que pasaría es que habría un control más eficaz y además se acabaría con esta trata,the survey of caterin dove catedràtica at constitutional law justly the form to legalise it what would pass is that there would be a more effective control and besides would end  with this treats
117,ARG1,2;3,FAVOUR,20;24;113,RA,,,,,aquí a més es donarien les garanties per poder-ho fer d'una forma que no vulnerés la dignitat de la dona ,aquí además se darían las garantías para poderlo hacer de una forma que no vulnerara la dignidad de la mujer,here besides would give  the guarantees to be able to it make of a form that no vulnerés the dignity of the wife
118,ARG1,2;3,FAVOUR,97,RA,,,,,va passar canadà es va legalitzar i el que va passar és que les dones les parelles gestants ja no podien a l'exterior,pasó canadà se legalizó y el que pasó es que las mujeres las parejas gestantes ya no podían a la exterior,passed canadà legalised  and what passed is that the wives the couples gestants no longer could at the outside
119,ARG1,2;3,FAVOUR,97;10;28;90;104;118,RA,,,,,es va acabar amb aquest mercat negre que tan preocupa el país ,se acabó con este mercado negro que tan preocupa el país,ended  with this black market that as preoccupies the country
120,ARG1,3,FAVOUR,,,,,,,a islàndia es va fer una proposició de llei justament basada en aquests pilars,a islàndia se hizo una proposición de ley justamente basada en estos pilares,at islàndia made  a proposition of law justly based at these pillars
121,ARG1,3,FAVOUR,120;27;33;100;101;102,RA,,,,,a islandia estava prohibit,a islandia estaba prohibido,at islandia was prohibited
122,ARG1,3,FAVOUR,120;121,RA,,,,,les dones no tenien les garanties i els hi era igual,las mujeres no tenían las garantías y se los era igual,the wives did not have the guarantees and was the ones to him equal
123,ARG1,3,FAVOUR,122,RA,,,,, islàndia tenia els ulls tapats contra això,islàndia tenía los ojos tapados contra esto,islàndia had the eyes covered against this
124,ARG1,3,FAVOUR,,,,,,,la seva responsabilitat,su responsabilidad,his responsibility
125,ARG1,3,FAVOUR,4;17;24;30;34;87;96;23;25;26;27,RA,,,,,van establir un procés garantista totalment altruista totalment cobert per la seguretat social,establecieron un proceso garantista totalmente altruista totalmente cubierto por la seguridad social,established a process garantista totally altruistic totally coated for the social security
126,ARG1,3,FAVOUR,125,RA,,,,,pel qual les dones s'haguessin de presentar altruistament a islàndia per poder fer aquest procès ,por el cual las mujeres se tuvieran que presentar altruistamente a islàndia para poder hacer este procès,for which the wives had to present  altruistament at islàndia to be able to make this procès
127,ARG1,3,FAVOUR,92;93;94;96,RA,,,,,i a més es pogués controlar aquestes màfies,y además se pudiera controlar estas mafias,and besides could  control these mafias
128,ARG1,3,FAVOUR,,,,,,,parlen d'un cavall de troia que no volen,hablan de un caballo de troia que no vuelan,talk of a horse of troia that they do not blast
129,ARG1,3,FAVOUR,128,MA,,,,,les màfies,las mafias,the mafias
130,ARG1,2;3,FAVOUR,,,,,,,volem un cavall de troia per acabar amb les màfies amb les violacions de drets de les dones,volemos un caballo de troia para acabar con las mafias con las violaciones de derechos de las mujeres,blast a horse of troia to end with the mafias with the rapes of laws of the wives
131,ARG1,3,FAVOUR,23;24;25;26;27,RA,,,,,que no siguin espanyoles no vol dir que no haguem de protegir els seus drets,que no sean españolas no quiere decir que no hayamos de proteger sus derechos,that they are not Spanish does not mean that we do not have to protect his laws
132,ARG1,1,AGAINST,46;50;59;61;62;70;75;76;47;61,RA,,,,,tractem la mercantilització del nen i la  l'objectivització de la dona en un mateix argument,tratamos la mercantilización del niño y la la objectivització de la mujer en un mismo argumento,treat the mercantilització of the boy and the the objectivització of the wife at a same argument
133,ARG1,1;2;3,AGAINST,,,,,,,l'equip rival està intentant venent una quimera,el equipo rival está intentando vendiendo una quimera,the rival squad is attempting selling a chimaera
134,ARG1,3,AGAINST,87;125;126,CA,133,RA,,,estan plantejant que estan venent un contracte que serà altruista i no hi haurà cap problema envers els seus drets ni envers les seves dignitats,están planteando que están vendiendo un contrato que será altruista y no habrá ningún problema hacia sus derechos ni hacia sus dignidades,are posing that they are selling an agreement that will be altruistic and there will not be any problem envers his laws or envers his dignities
135,ARG1,3,AGAINST,,,,,,,però això no es pot concebre ,pero esto no se puede concebir,but this can not  conceive
136,ARG1,3,AGAINST,,,,,,,perquè la pròpia esència del contracte afecta contra la dignitat i contra l'integritat  de les persones o de les parts que es veuen involucrades,porque la propia esència del contrato afecta contra la dignidad y contra la integridad de las personas o de las partes que se ven involucradas,so that the own esència of the agreement affects against the dignity and con the integrity of the persons or of the parts that view  involved
137,ARG1,3,AGAINST,46;47;59;61;62;70,RA,,,,,de les parts que es veuen involucrades ,de las partes que se ven involucradas,of the parts that view  involved
138,ARG1,3,AGAINST,137,MA,,,,,es a dir el menor i la dona,se a decir el menor y la mujer,at saying the minor and the wife
139,ARG1,1;3,AGAINST,20;24;50;61;62;70;113;134;136;141;142;174,RA,,,,,afecta a la seva dignitat i la seva integritat perquè no podem comparar a una persona amb un objecte ,afecta a su dignidad y su integridad porque no podemos comparar a una persona con un objeto,affects at his dignity and his integrity so that we can not compare at a person with an object
140,ARG1,1;3,AGAINST,47;59;61;70,RA,,,,,no podem comparar un nen amb un ronyó ,no podemos comparar un niño con un riñón,can not compare a boy with a kidney
141,ARG1,1;3,AGAINST,140,RA,,,,,no podem fer-ho perque atempta contra la seva dignitat,no podemos hacerlo perque atenta contra su dignidad,can not make it perque attacks against his dignity
142,ARG1,1;3,FAVOUR,141,CA,,,,,sí si es fa una legislació que estigui portegint la dignitat de la mare gestant i la del nen  quin problema hi ha aleshores,sí si se hace una legislación que esté portegint la dignidad de la madre gestante y la del niño qué problema hay entonces,aye if it makes  a legislation that was portegint the mother's dignity gestant and the of the which boy problem there is then
143,ARG1,1;3,AGAINST,142,CA,,,,,com podem garantir que es farà aquesta legislació que puguem protegir-la,como podemos garantizar que se hará esta legislación que podamos protegerla,how can guarantee that it will make  this legislation that can protect it
144,ARG1,2,AGAINST,51;64;66;71,RA,,,,,l'introducció d'aquest cavall de troia està dient que vol introduir aquestes màfies,la introducción de este caballo de troia está diciendo que quiere introducir estas mafias,the introduction of this horse of troia is saying that it wants to introduce these mafias
145,ARG1,2,AGAINST,,,,,,,potser diuen no passarà espanya,quizás dicen no pasará espanya,perhaps say will not pass espanya
146,ARG1,2,AGAINST,144;145,RA,,,,,el fet de regular-ho hi estem implicant que no hi haurà una implicació perquè les màfies no entraran perquè està regulat,el hecho de regularlo estamos implicando que no habrá una implicación porque las mafias no entrarán porque está regulado,the fact to regulate it are implying  that there will not be an implication so that the mafias will not enter so that it is regulated
147,ARG1,2,AGAINST,146,RA,,,,,però és que la marihuana està acceptada i actualment a espanya pot haver màfies de drogues ,pero es que la marihuana está aceptada y actualmente a espanya puede haber mafias de drogas,but is that the marijuana is accepted and at present at espanya can have mafias of drugs
148,ARG1,2,AGAINST,146,RA,,,,,pot haver màfies de prostitució,puede haber mafias de prostitución,can have mafias of prostitution
149,ARG1,2,AGAINST,146;147;148,RA,,,,,hi pot haver moltíssim tipus de màfies que estan introduïts mitjançant aquest cavall de troia que en aquest cas és la gestació subrogada,puede haber muchísimo tipo de mafias que están introducidos mediante este caballo de troia que en este caso es la gestación subrogada,there can be very a lot of type of mafias that are introduced by means of this horse of troia that at this case is the surrogacy
150,ARG1,3,AGAINST,52;67;72,RA,97,MA,,,efecte rebot en tant que si en el cas de legalitzar-lo augmentaria la demanda però l'oferta continuaria sent la mateixa,efecto rebote en cuanto que si en el caso de legalizarlo aumentaría la demanda pero la oferta continuaría siendo la misma,effect rebound at so much that if at the case to legalise it would augment the demand but the offer would continue being the same
151,ARG1,1,AGAINST,50;59;61;62;70;75;76,RA,,,,,estem dient que hi ha un mercat ,estamos diciendo que hay un mercado,are saying that there is a market
152,ARG1,1,AGAINST,52;67;72;150,RA,,,,,tenim oferta tenim demanda,tenemos oferta tenemos demanda,have offer have demand
153,ARG1,1,AGAINST,152,RA,,,,,una és molt elevada l'altra és molt reduïda ,una es muy elevada la otra es muy reducida,one is very elevated the other is very reduced
154,ARG1,1,AGAINST,,,,,,, espanya és un país amb garanties,espanya es un país con garantías,espanya is a country with guarantees
155,ARG1,1,AGAINST,153,RA,,,,,aquest país amb garanties no tindria aquesta capacitat d'oferir tant com es demanda,este país con garantías no tendría esta capacidad de ofrecer tanto como se demanda,this country with guarantees would not this capacity to offer as much as sues
156,ARG1,1,AGAINST,52;67;72,RA,,,,,hi hauria un turisme reproductiu,habría un turismo reproductivo,there would be a reproductive tourism
157,ARG1,1,AGAINST,153,RA,,,,,la gent no podria fer el servei aquí espanya per què no hi ha oferta,la gente no podría hacer el servicio aquí espanya por qué no ha ofrecida,the persons could not make the kick here espanya how come has not offered
158,ARG1,1,AGAINST,156,MA,,,,,se'n van a altres països com ucrania com pot ser pot ser estats units o altres països en què no es garantixen els drets ,se van a otros países como ucrania como puede ser puede ser estados unidos u otros países en que no se garantizan los derechos,go  at other countries like ucrania how can being can be states united or other countries at what do not guarantee  the laws
159,ARG1,1,AGAINST,46;47;59,MA,,,,,no es garantitzen els drets ni dels nens ni de la mare,no se garantitzen los derechos ni de los niños ni de la madre,no  garantitzen the laws or of the boys or of the mother
160,ARG1,2,FAVOUR,,,,,,,ens poden provar que les màfies no siguin un problema de mala legislació i no de legislació simplement ,nos pueden probar que las mafias no sean un problema de mala legislación y no de legislación simplemente,can prove us that the mafias are not a problem of bad legislation and no of legislation simply
161,ARG1,2,AGAINST,46;47;59;61;62;70;137;144;145;146;147;148;149,RA,,,,,actualment a qualsevol part del món pot haver ,actualmente a cualquier parte del mundo puede haber,at present at any part in the world can have
162,ARG1,2,AGAINST,161,MA,,,,,és a dir les màfies en tot en general està a tot  arreu del món,es decir las mafias en todo en general está en todas partes del mundo,that is to say the mafias at every in general is all around in the world
163,ARG1,2,AGAINST,161;162,MA,,,,,a tot arreu del món hi ha un vot amb una legislació  més o menys concreta,en todas partes del mundo hay un voto con una legislación más o menos concreta,all around in the world there is a vote with a more or less concrete legislation
164,ARG1,2,AGAINST,162,MA,,,,,però és tot global i per tant no podem  per molt que hi hagi una legislació ,pero es todo global y por tanto no podamos por mucho que haya una legislación,but is every global and therefore we can not for a lot that there is a legislation
165,ARG1,2,AGAINST,46;47;59;61;62;70;137;144;145;146;147;148;149;161;162;163,RA,,,,,la introducció d'aquesta  màfia d'aquest cavall de troia seria introduir les màfies  dintre del nostre ordenament jurídic ,la introducción de esta mafia de este caballo de troia sería introducir las mafias dentro de nuestro ordenamiento jurídico,the introduction of this mafia of this horse of troia would be to introduce the mafias inside of our juridical arranging
166,ARG1,1,AGAINST,6;7;8;9;10;11;12;13;14;15;29,CA,44;47,RA,,,una realitat  fàctica que no és certa del tot perquè amb la nova instrucció del registres i notarial està dient  que no es pot permetre això,una realidad fáctica que no es cierta del todo porque con la nueva instrucción del registros y notarial está diciendo que no se puede permitir esto,a reality fàctica that it is not true in its entirety so that with the new instruction of the registries and notarial is saying that it can not  permit this
167,ARG1,1,AGAINST,,,,,,,és a dir està dient que el propi  jutge del país on està succeint la gestació subrogada   ha d'acceptar que el nen és fill,es decir está diciendo que el propio juez del país donde está sucediendo la gestación subrogada tiene que aceptar que el niño es hijo,that is to say is saying that the own judge of the country where is succeint the surrogacy has to accept that the boy is son
168,ARG1,1,AGAINST,167,MA,,,,,és a dir ha d'acceptar que  el nen ha de ser nacionalitzat espanyol ,es decir tiene que aceptar que el niño tiene que ser nacionalizado español,that is to say has to accept that the boy has to be nationalised Spanish
169,ARG1,1;3,AGAINST,167;168,RA,,,,,però és que això  els jutges no ho tenen regulat al seu propi país ,pero es que esto los jueces no lo tienen regulado a su propio país,but is that this the judges do not have it regulated at his own country
170,ARG1,1,AGAINST,169,RA,,,,,el primer argument ja no és una realitat,el primer argumento ya no es una realidad,the first argument no longer is a reality
171,ARG1,1,AGAINST,52;67;72;156,MA,,,,,un exili,un exilio,an exile
172,ARG1,1,AGAINST,52;67;72;150;156;171,RA,,,,,turisme reproductiu que passarà com  a conseqüència del nostre argument de l'efecte rebot,turismo reproductivo que pasará como consecuencia de nuestro argumento del efecto rebote,reproductive tourism that will pass as a consequence of our argument of the effect rebound
173,ARG1,3,AGAINST,52;67;72;150;156;171;172,RA,,,,,el fet de legalitzar-ho produïra un efecte rebot que es produirà un exili  al turisme,el hecho de legalizarlo produjera un efecto rebote que se producirá un exilio al turismo,the fact to legalise it produced an effect rebound that will produce  an exile at the tourism
