ID (Chronological),TYPE (Part + Person),ARGUMENT NUMBER,TEAM STANCE,RELATED ID,ARGUMENTAL RELATION  TYPE,RELATED ID.1,ARGUMENTAL RELATION  TYPE.1,ADU_CAT,ADU_ES,ADU_EN
119,ARG1,,FAVOUR,118,RA,,,quan van veure que la gammy tenia síndrome de down el que van fer és portar-se a austràlia el nadó que havia nascut sense discapacitats,cuando vieron que la gammy tenía síndrome de down el que hicieron es llevarse a austràlia el bebé que había nacido sin discapacitados,when they viewed that the gammy had syndrome of down what made is to take at austràlia the baby that had been born able-bodied
120,ARG1,,FAVOUR,112,RA,,,la gammy va quedar a tailàndia amb la seva mare subrogada,la gammy quedó a tailàndia con su madre subrogada,the gammy stayed at tailàndia with his mother subrogada
121,ARG1,1,FAVOUR,,,,,posa de manifest que existeix per part de les famílies una necessitat de recórrer a la gestació subrogada enfront a l'adopció,pone de manifiesto que existe por parte de las familias una necesidad de recurrir a la gestación subrogada enfrente a la adopción,pose of manifesto that exists for part of the families a necessity to resort to the surrogacy in front at the adoption
122,ARG1,1,FAVOUR,71;72;73,MA,,,l'equip contrari ens ha dit no és que la gestació subrogada el que fa és explotar a països del tercer món enfront a les necessitats dels països del primer món,el equipo contrario nos ha dicho no es que la gestación subrogada el que hace es explotar en países del tercer mundo enfrente a las necesidades de los países del primer mundo,the contrary squad has said us is not that the surrogacy what makes is to explode at countries of the third world in front at the necessities of the countries of the first world
123,ARG1,,FAVOUR,122,RA,,,estem d'acord,estamos de acuerdo,agree
124,ARG1,3,FAVOUR,22; 122,CA,,,l'adopció no,la adopción no,the adoption no
125,ARG1,3,FAVOUR,124,RA,,,l'adopció majoritària es dóna precisament en països en vies de desenvolupament,la adopción mayoritaria se da precisamente en países en vías de desarrollo,the majority adoption gives  precisely at countries at roads of development
126,ARG1,3,FAVOUR,125,MA,,,per membres de països que estan desenvolupats,por miembros de países que están desarrollados,for members of countries that are developed
127,ARG1,3,FAVOUR,,,,,aquest argument que posen vostés amb l'adopció com alternativa a la gestió subrogada és fals,este argumento que pongan ustedes con la adopción como alternativa a la gestión subrogada es falso,this argument that pose you with the adoption like alternative at the management subrogada is dud
128,ARG1,1,FAVOUR,,,,,hi ha una necessitat,hay una necesitado,there is a necessity
129,ARG1,3,FAVOUR,128,RA,,,anem a protegir-la anem a legislar-la,vayamos a protegerla vayamos a legislarla,go at protecting it go at legislating it
130,ARG1,3,AGAINST,113,CA,,,tailàndia no té una regulació però sí que la tenia i era legal,tailàndia no tiene una regulación pero sí que la tenía y era legal,tailàndia does not have a regulation but aye that it had it and was legal
131,ARG1,3,AGAINST,,,,,fruit precisament d'aquest cas es va prohibir,fruto precisamente de este caso se prohibió,fruit precisely of this case prohibited
132,ARG1,,FAVOUR,130; 131,CA,,,la dada que m'està donant és totalment falsa,el dato que me está dando es totalmente falsa,the data that is giving me is totally dud
133,ARG1,3,FAVOUR,132,MA,,,tenim evidències de que a tailàndia no hi ha cap tipus de regulació sobre aquesta gestació subrogada,tenemos evidencias de que a tailàndia no hay ningún tipo de regulación sobre esta gestación subrogada,have evidences of that at tailàndia there is not any type of regulation on this surrogacy
134,ARG1,,FAVOUR,,,,,quan acabi el debat us ho podem demostrar,cuando acabe el debate os lo podemos demostrar,when it end the debate can it to you evidence
135,ARG1,3,FAVOUR,129,RA,,,la universitat de barcelona per legalitzar la gestació subrogada presenta un triangle de protecció,la universidad de barcelona para legalizar la gestación subrogada presenta un triángulo de protección,the university of barcelona to legalise the surrogacy presents a triangle of protection
136,ARG1,3,FAVOUR,135,RA,,,un triangle en què es protegeix per un costat el nadó,un triángulo en que se protege por un lado el bebé,a triangle at what protects  for a canton the baby
137,ARG1,3,FAVOUR,135,RA,,,per un costat al gestant,por un lado al gestante,for a canton at the gestant
138,ARG1,3,FAVOUR,135,RA,,,i per un costat a la família sol·licitant,y por un lado a la familia solicitante,and for a canton at the family soliciting
139,ARG1,2,FAVOUR,3,CA,,,l'argument humà que ens presentava la universitat oberta de catalunya cau,el argumento humano que nos presentaba la universidad abierta de catalunya cae,the human argument that presented us the open university of catalunya falls
140,ARG1,2,FAVOUR,,,,,han dit que no tenim en compte el nadó,han dicho que no tenemos en cuenta el bebé,have said that we do not take into account the baby
141,ARG1,2,FAVOUR,,,,,que no tenim en compte la gestant,que no tenemos en cuenta la gestante,that do not take into account the gestant
142,ARG1,2,FAVOUR,17,MA,,,l'estam cosificant,el estambre cosificant,the stamen cosificant
143,ARG1,3,FAVOUR,,,,,el que proposem nosaltres és una legalització que precisament tingui en compte a experts psicològics que puguin tenir en compte aquest vincle que genera entre gestant i entre el nadó,el que proponemos nosotros es una legalización que precisamente tenga en cuenta a expertos psicológicos que puedan tener en cuenta este vínculo que genera entre gestante y entre el bebé,what propose we is a legalisation that precisely take into account at psychological experts that can take into account this tie that generates among gestant and among the baby
144,ARG1,3,FAVOUR,136;138;143,RA,,,entre la família i el nadó,entre la familia y el bebé,among the family and the baby
145,ARG1,3,FAVOUR,136;137;138;143,RA,,,entre el nadó i les dues parts,entre el bebé y las dos partes,among the baby and the two parts
146,ARG1,2,FAVOUR,55;139,MA,,,el seu argument humà estaria caient davant el nostre argument legal,su argumento humano estaría cayendo ante nuestro argumento legal,his human argument would be falling in front of our legal argument
147,ARG1,3,FAVOUR,135;136,RA,,,el nostre argument legal busca protegir el nadó,nuestro argumento legal busca proteger el bebé,our legal argument seeks to protect the baby
148,ARG1,3,FAVOUR,119,RA,,,protegir la gammy de la discriminació que va patir,proteger la gammy de la discriminación que sufrió,protect the gammy of the discrimination that suffered
149,ARG1,3,FAVOUR,137,RA,,,protegir a la gestant,proteger a la gestante,protect at the gestant
150,ARG1,3,FAVOUR,149,RA,,,potser la gestant no volia ser mare,quizás la gestante no quería ser madre,perhaps the gestant did not want to be mother
151,ARG1,,FAVOUR,,,,,ha de decidir això els pares d'austràlia no,tiene que decidir esto los padres de austràlia no,has to decide this the parents of austràlia no
152,ARG1,,FAVOUR,151,RA,,,qui ho ha de decidir és un jutge mitjançant unes lleis que ja estiguin establertes,quién lo tiene que decidir es un juez mediante unas leyes que ya estén establecidas,who has to decide it is a judge by means of some laws that already are established
153,ARG1,3,FAVOUR,55;135,RA,,,s'ha de legalitzar,se tiene que legalizar,has to legalise
154,ARG1,3,FAVOUR,153,MA,,,és necessari legalitzar la gestació subrogada,es necesario legalizar la gestación subrogada,is necessary to legalise the surrogacy
155,ARG1,3,FAVOUR,55;154,RA,,,s'ha de protegir les garanties d'aquest sol·licitats de tot el procés,se tiene que proteger las garantías de este solicitados de todo el proceso,has to protect  the guarantees of this solicited of all the process
156,ARG1,3,FAVOUR,34,RA,,,han de protegir els passatgers de l'avió,tienen que proteger los pasajeros del avión,have to protect the passengers of the airliner
157,ARG1,3,FAVOUR,34,RA,,,han de protegir el pilot de l'avió ,tienen que proteger el piloto del avión,have to protect the pilot of the airliner
158,ARG1,3,FAVOUR,34,RA,,,hem de protegir l'aeroport d'arribada de l'avió amb normes d'aviació civil,tenemos que proteger el aeropuerto de llegada del avión con normas de aviación civil,have to protect the airport of arrival of the airliner with norms of civil aviation
159,ARG1,3,FAVOUR,55;135;143,RA,,,nem a legislar la gestació subrogada,nem a legislar la gestación subrogada,nem at legislating the surrogacy
160,ARG1,1,FAVOUR,121,RA,,,hi ha una necessitat social de recórrer a aquesta  gestació subrogada,hay una necesidad social de recurrir a esta gestación subrogada,there is a social necessity to resort to this surrogacy
161,ARG1,3,FAVOUR,154,RA,,,d'aquesta manera estarem protegint  a totes aquestes parts,de este modo estaremos protegiendo a todas estas partes,in this way will be protecting at all these parts
162,ARG1,,FAVOUR,93,RA,,,les màfies pararan,las mafias pararán,the mafias will pause
163,ARG1,,FAVOUR,162,MA,,,aturaran les màfies per legalitzar la gestació subrogada,pararán las mafias para legalizar la gestación subrogada,will stop the mafias to legalise the surrogacy
164,ARG1,,FAVOUR,93,CA,,,el seu argument de les màfies no és vàlid,su argumento de las mafias no es válido,his argument of the mafias is not valid
165,ARG1,2,FAVOUR,,,,,el principi de la llibertat individual,el principio de la libertad individual,the principle of the individual liberty
166,ARG1,2,FAVOUR,,,,,tothom té una ideologia una moral una manera de fer,todo el mundo tiene una ideología una moral una manera de hacer,everybody has an ideology a morale a mode to make
167,ARG1,2,FAVOUR,,,,,si una persona s'ofereix perquè això li comportarà un benefici  emocional no ho ha de fer,si una persona se ofrece porque esto le comportará un beneficio emocional no lo tiene que hacer,if a person offers  so that this will comport him an emotional benefit does not have to it make
168,ARG1,3,FAVOUR,,,,,qui és l'estat per exercir una coacció externa mitjançant la prohibició,quien es el estado para ejercer una coacción externa mediante la prohibición,who is the state to exert an external coercion by means of the ban
169,ARG1,,FAVOUR,,,,,res en aquest món ha de ser temut sinó entés,nada en este mundo tiene que ser temido sino entendido,nothing at this world has to be dreaded but understood
170,ARG1,,FAVOUR,169,MA,,,ara  és moment de tèmer menys,ahora es momento de tèmer menos,now is moment of tèmer less
171,ARG1,,FAVOUR,170,RA,,,i d'entendre més,y de entender más,and to understand more
172,ARG1,1,FAVOUR,,,,,hi ha una necessitat social,hay una necesidad social,there is a social necessity
173,ARG1,3,FAVOUR,,,,,hi ha una necessitat legal,hay una necesidad legal,there is a legal necessity
174,ARG1,,FAVOUR,,,,,no poden coaccionar la dona,no pueden coaccionar la mujer,can not coerce the wife
175,ARG2,,AGAINST,,,,,la  dona que coneix els pares i tal,la mujer que conoce los padres y tal,the wife that meets the parents and such
176,ARG2,,AGAINST,,,,,però això no és real,pero esto no es real,but this is not real
177,ARG2,,AGAINST,176,RA,,,això no passa,esto no pasa,this does not pass
178,ARG2,,AGAINST,176,RA,,,és una fal·làcia,es una falacia,is a fallacy
179,ARG2,,AGAINST,176,RA,,,no és la realitat,no es la realidad,is not the reality
180,ARG2,,AGAINST,176,RA,,,no és el món de la gestació subrogada,no es el mundo de la gestación subrogada,is not the world of the surrogacy
181,ARG2,3,AGAINST,,,,,l'estat de benestar justament el que busca és la millora del col·lectiu,el estado de bienestar justamente el que busca es la mejora del colectivo,the state of welfare justly what seeks is the improvement of the community
182,ARG2,,AGAINST,181,CA,,,no de les llibertats de les persones perquè sí,no de las libertades de las personas porque sí,no of the liberties of the persons so that aye
183,ARG2,,AGAINST,165,MA,,,som lliures de fer el que vulguem,somos libres de hacer el que queramos,are free to make what want to
184,ARG2,,AGAINST,,,,,és que el món seria un caos,es que el mundo sería un caos,is that the world would be a chaos
185,ARG2,3,AGAINST,168,CA,,,l'estat justament està per regular aquella llibertat que acaba on comença la de l'altre,el estado justamente está para regular aquella libertad que acaba donde empieza la del otro,the state justly is to regulate that liberty that ends where commences the of the other
186,ARG2,3,AGAINST,185,RA,,,això és l'estat de benestar,esto es el estado de bienestar,this is the state of welfare
187,ARG2,,AGAINST,185,RA,,,i és cap on hem d'anar,y es jefe donde tenemos que ir,and is cape where have to go
188,ARG2,1,AGAINST,,,,,no cap a un estat liberal absolutament com els estats units,no hacia un estado liberal absolutamente como los estados unidos,no to a liberal state absolutely like the states united
189,ARG2,,AGAINST,188,RA,,,la tradició  dels països evolucionats no va cap a aquest costat,la tradición de los países evolucionados no va hacia este costado,the tradition of the countries evolved does not go to this canton
190,ARG2,2,AGAINST,,,,,el cos de la dona abans  que es veu forçat econòmicament a gestar  de la manera subrogada,el cuerpo de la mujer antes de que se ve forzado económicamente a gestar de la manera subrogada,the body of the wife before it views  forced economically at gestar of the mode subrogada
191,ARG2,,FAVOUR,186,CA,,,actualment l'estat del benestar permet que hi hagi morts al mediterrani,actualmente el estado del bienestar permite que haya muertos al mediterráneo,at present the state of the welfare permits that it have died  at the Mediterranean
192,ARG2,3,FAVOUR,191,RA,,,per tant  el fet de continuar la defensa l'estat de benestar  significa que ells tenen la raó ,por lo tanto el hecho de continuar la defensa el estado de bienestar significa que ellos tienen la razón,therefore the fact to continue the defence the state of welfare means that they have the reason
193,ARG2,3,AGAINST,191,CA,,,hi ha bastants col·lectius al món que estem lluitant  justament perquè no hi hagi aquestes morts,hay bastantes colectivos en el mundo que estamos luchando justamente porque no haya estas muertos,there is quite a lot of communities at the world that are battling justly so that there are not these deaths
194,ARG2,,AGAINST,191,CA,,,aquestes morts  no les hem de permetre,estas muertes no las tenemos que permitir,these deaths no the have to permit
195,ARG2,,AGAINST,193,RA,,,i hi ha moltes associacions que estan fent això,y hay muchas asociaciones que están haciendo esto,and there is a lot of associations that are making this
196,ARG2,,AGAINST,189,RA,,,i estem buscant que l'estat de benestar vagi en aquest camí,y estamos buscando que el estado de bienestar vaya en este camino,and are seeking that the state of welfare go at this path
197,ARG2,,AGAINST,,,,,justament no al contrari,justamente no al contrario,justly no on the contrary
198,ARG2,2,AGAINST,,,,,el cos de la dona durant l'embaràs  es troba en clíniques on veu sotmès el seu cos a la seva pròpia llibertat,el cuerpo de la mujer durante el embarazo se encuentra en clínicas donde ve sometido su cuerpo en su propia libertado,the body of the wife during the pregnancy finds  at clinics where views subjected his body at his own liberty
199,ARG2,2,AGAINST,,,,,és fals que les dones són lliures de decidir,es falso que las mujeres son libres de decidir,is dud that the wives are free to decide
200,ARG2,,AGAINST,,,,,quan  signen un contracte l'han de dur a terme,cuando firman un contrato lo tienen que llevar a cabo,when sign an agreement have to carry out it
201,ARG2,,AGAINST,200,RA,,,signen un contracte,firman un contrato,sign an agreement
202,ARG2,,AGAINST,201,RA,,,l'han d'acabar  perquè és un contracte que no torna enrere,lo tienen que acabar porque es un contrato que no vuelve atrás,have to end it so that it is an agreement that does not return back
203,ARG2,,AGAINST,200,MA,,,si tu estàs embarassada de cinc mesos  en una clínica on has signat un contracte d'aquest tipus no pots tornar enrere,si tú estás embarazada de cinco meses en una clínica donde has firmado un contrato de este tipo no puedes volver atrás,if you are pregnant of five months at a clinic where have signed an agreement of this type can not return back
204,ARG2,2,AGAINST,201,RA,,,no hi ha llibertat,no ha libertado,there is not liberty
205,ARG2,,AGAINST,,,,,això és fals,esto es falso,this is dud
206,ARG2,,AGAINST,205,MA,,,és una fal·làcia,es una falacia,is a fallacy
207,ARG2,1,AGAINST,17,RA,,,podem parlar del cos després de la dona,podemos hablar del cuerpo después de la mujer,can talk of the body after the wife
208,ARG2,1,AGAINST,207,RA,,,els efectes que té un embaràs després,los efectos que tiene un embarazo desprendido,the effects that has a pregnancy next
209,ARG2,1,AGAINST,208,RA,,,el cos de la dona no només té efectes físics també hi ha qüestions psicològiques al mig,el cuerpo de la mujer no solo tiene efectos físicos también hay cuestiones psicológicas en medio,the body of the wife no only has physical effects also there are psychological questions in between
210,ARG2,1,AGAINST,209,RA,,,aquests efectes es produeixen a la gestació,estos efectos se producen a la gestación,these effects produce  at the gestation
211,ARG2,1,AGAINST,210,RA,,,tant si és lucrativa,tanto si es lucrativa,whether it is yielding
212,ARG2,1,AGAINST,210,RA,,,com si és altruista,como sí es altruista,as if it is altruistic
213,ARG2,1,AGAINST,208,RA,,,la dona encara que sigui una gestació subrogada altruista pateix una pèrdua,la mujer aunque sea una gestación subrogada altruista sufre una pérdida,the wife although it was a surrogacy altruist suffers a loss
214,ARG2,,AGAINST,208;211,RA,,,el seu cos estava preparat per tenir un fill,su cuerpo estaba preparado para tener un hijo,his body was prepared to have a son
215,ARG2,2,AGAINST,17;208,RA,,,és reduir el cos de la dona a un recipient,es reducir el cuerpo de la mujer a un recipiente,is to reduce the body of the wife at a container
216,ARG2,2,AGAINST,17;215,RA,,,estem reduint el cos de la dona a una gestant  res més,estamos reduciendo el cuerpo de la mujer a una gestante nada más,are reducing the body of the wife at a gestant nothing more
217,ARG2,2,AGAINST,201,RA,,,quan acabi el contracte la dona desapareixerà,cuando acabe el contrato la mujer desaparecerá,when it end the agreement the wife will disappear
218,ARG2,2,AGAINST,17;217,RA,,,d'això s'en diu cosificació,de esto se dice cosificación,thereof says  reification
219,ARG2,,AGAINST,,,,,una paraula molt de moda ara que estem parlant de sororitat de feminisme,una palabra mucho de moda ahora que estamos hablando de sororidad de feminismo,a word very in fashion now that we are talking of sororitat of feminism
220,ARG2,,AGAINST,,,,,no té sentit,no tiene sentido,does not have heard
221,ARG2,3,AGAINST,186,RA,,,l'estat de benestar busca el bé del col·lectiu,el estado de bienestar busca el bien del colectivo,the state of welfare seeks the sake of the community
222,ARG2,3,AGAINST,221,MA,,,això vol dir el bé de tant de les persones febles de com de les persones no febles,esto quiere decir el bien de tanto de las personas débiles de cómo de las personas no débiles,this means the sake of so much of the weak persons of how of the no weak persons
223,ARG2,3,AGAINST,222,RA,,,nosaltres hem de protegir el feble,nosotros tenemos que proteger el débil,we have to protect the weak
224,ARG2,3,AGAINST,222,RA,,,hem de protegir el feble enfront del que té poder,tenemos que proteger el débil frente al que tiene poder,have to protect the weak façade of the that has can
225,ARG2,1,AGAINST,2,RA,,,avui dia el poder l'atorga el diner,hoy en día el poder lo otorga el dinero,nowadays the can awards it the money
226,ARG2,2,AGAINST,215,MA,,,el cos de la dona  és un recipient,el cuerpo de la mujer es un recipiente,the body of the wife is a container
227,ARG2,2,AGAINST,,,,,ho podem veure en fires com hem tingut fa un parell d'anys a madrid surrofair,lo podemos ver en ferias cómo hemos tenido hace un par de años a madrid surrofair,can view it at fairs how have had makes a pair of years at madrid surrofair
228,ARG2,2,AGAINST,110,RA,,,s'ensenyen catàlegs de dones per escollir la mare que portaria el teu nadó al ventre,se enseñan catálogos de mujeres para escoger la madre que llevaría tu bebé al vientre,teach  catalogues of wives to choose the mother that would take your baby at the belly
229,ARG2,2,AGAINST,14,RA,,,les dones estan explotades,las mujeres están explotadas,the wives are exploded
230,ARG2,3,AGAINST,221,RA,,,l'estat les ha de protegir,el estado las tiene que proteger,the state the has to protect
231,ARG2,3,AGAINST,230,CA,,,si legalitzen la gestació subrogada estaríem fent tot el contrari,si legalizan la gestación subrogada estaríamos haciendo todo el contrario,if they legalise the surrogacy would be making all the opposite
232,ARG2,,AGAINST,231,CA,,,no té cap sentit,no tiene jefe sentido,does not have cape heard
233,ARG2,3,AGAINST,221,RA,,,l'estat ha de garantir  la llibertat de les persones,el estado tiene que garantizar la libertad de las personas,the state has to guarantee the liberty of the persons
234,ARG2,3,AGAINST,64,RA,,,vostés han confós el CONCepte de llibertat amb el CONCepte de llibertat que té el neoliberalisme brutal,ustedes han confundido el CONCepto de libertad con el CONCepto de libertad que tiene el neoliberalismo brutal,you have confused the CONCept of liberty with the CONCept of liberty that has the brutal neoliberalism
235,ARG2,2,AGAINST,234,RA,,,on tot es redueix a un producte,donde todo se reduce a un producto,where everything reduces  at a product
236,ARG2,2,AGAINST,234,RA,,,les dones es redueixen a un producte,las mujeres se reducen a un producto,the wives reduce  at a product
237,ARG2,2,AGAINST,234,RA,,,els nadons es redueixen un producte,los bebés se reducen un producto,the babies reduce  a product
238,ARG2,2,AGAINST,234,RA,,,els òrgans els redueixen un producte,los órganos los reducen un producto,the organs reduce the ones a product
239,ARG2,2,AGAINST,,,,,el meu cos és el meu cos,mi cuerpo es mi cuerpo,my body is my body
240,ARG2,2,AGAINST,64;239,RA,,,i jo puc fer el que vulgui,y yo puedo hacer el que quiera,and I can make what want to
241,ARG2,2,AGAINST,,,,,no és així,no es así,is not like this
242,ARG2,3,AGAINST,186,RA,,,la llibertat es defineix per la relació amb els altres,la libertad se define por la relación con los otras,the liberty defines  for the account with the others
243,ARG2,2,AGAINST,,,,,la filiació no la marca la genètica,la filiación no la marca la genética,the filiació no the mark the genetic
244,ARG2,2,AGAINST,243,RA,,,és molt important,es muy importante,is very important
245,ARG2,2;3,AGAINST,22;243,RA,,,la filiació també es pot dur a terme a través de l'adopció,la filiación también se puede llevar a cabo a través de la adopción,the filiació also can  carry out through the adoption
246,ARG2,1,AGAINST,,,,,voler transmetre la genètica és més ben bé un caprici que no pas un dret,querer transmitir la genética es mejor bien un capricho que no un derecho,want to transmit the genetics is better well a whim that no a law
247,ARG2,,FAVOUR,,,,,som al segle vint-i-u en un món globalitzat,estamos en el siglo veintiuno en un mundo globalizado,are at the century twenty-and-u at a world globalitzat
248,ARG2,,FAVOUR,,,,,avui puc estar aquí abat oliba,hoy puedo estar aquí abate oliba,today can be here pulls down oliba
249,ARG2,,FAVOUR,,,,,l'endemà puc estar a japó,el día siguiente puedo estar a japó,the next day can be at japó
250,ARG2,,FAVOUR,,,,,d'una manera molt senzilla,de una manera muy sencilla,of a very simple mode
251,ARG2,,FAVOUR,,,,,llençant  totes les correlacions de tots els individus d'una manera brutal,tirando todas las correlaciones de todos los individuos de una manera brutal,discarding all the correlations of all the individuals of a brutal mode
252,ARG2,,FAVOUR,,,,,que som molts,que somos muchos,that we are many
253,ARG2,,FAVOUR,,,,,estem correlacionats,estamos correlacionados,are correlated
254,ARG2,,FAVOUR,253,RA,,,gràcies a això  podem fer lo que avui dia  se pot anomenar com una comunicació interna entre humans,gracias a esto podemos hacer lo que hoy en día se puede denominar como una comunicación interna entre humanos,thanks to this can make lo that nowadays can  nickname like an internal communication among human
255,ARG2,,FAVOUR,,,,,en doctor yamato era japonès va anar a l'índia a intentar tenir un fill per gestació subrogada,en doctor yamato era japonés fue a la india a intentar tener un hijo por gestación subrogada,at doctor yamato was Japanese went at the Indian at attempting have a son for surrogacy
256,ARG2,,FAVOUR,,,,,va anar tot bé,fue todo bueno,went every sake
257,ARG2,,FAVOUR,255,RA,,,a l'hora de tornar al japó aquest país no el va acceptar,en la hora de volver al japó este país no lo aceptó,at the hour to return at the japó this country did not accept it
258,ARG2,,FAVOUR,257,RA,,,dins d'aquestes lleis no varen voler que aquesta vida estigués de dins del país japonès,dentro de estas leyes no quisieron que esta vida estuviera de dentro del país japonés,in these laws did not want to that this life was of in the Japanese country
259,ARG2,,FAVOUR,258,RA,,,degut al que el jutge no el va deixar,debido al que el juez no lo dejó,owed at the that the judge did not let it
