ID (Chronological),TYPE (Part + Person),ARGUMENT NUMBER,TEAM STANCE,RELATED ID,ARGUMENTAL RELATION  TYPE,RELATED ID.1,ARGUMENTAL RELATION  TYPE.1,RELATED ID.2,ARGUMENTAL RELATION  TYPE.2,ADU_CAT,ADU_ES,ADU_EN
1,INTRO,,FAVOUR,,,,,,,la imatge que veuran en pantalla és un retrat de bartolomé de las casas un frare espanyol defensor dels drets dels indígenes en els inicis de la colonització d'amèrica commogut pels abusos dels colons espanyols cap aquest bartolomé va emprendre des d'aquell moment una campanya per defensar els seus drets i acabar amb la seva esclavitud però degut a que la corona necessitava mà d'obra per poder extreure els recursos naturals d'amèrica van decidir portar població afroamericana i esclavitzar-la,la imagen que verán en pantalla es un retrato de bartolomé de las casas un fraile español defensor de los derechos de los indígenas en los inicios de la colonización de amèrica conmovido por los abusos de los colonos españoles jefe este bartolomé emprendió desde aquel momento una campaña para defender sus derechos y acabar con su esclavitud pero debido a que la corona necesitaba mano de obra para poder extraer los recursos naturales de amèrica decidieron llevar población afroamericana y esclavizarla,the image that will view at screen is a portrait of bartolomé of las casas a Spanish friar defender of the laws of the native at the onsets of the colonisation of amèrica commogut for the abuses of the colons Spanish cape this bartolomé undertook from that time on a campaign to defend his laws and end with his slavery but owed at that the crown needed labour to be able to extract the natural resources of amèrica decided to take populace afroamericana and enslave it
2,INTRO,,FAVOUR,1,RA,,,,,es va substituir l'esclavitud dels indígenes per la dels afroamericans,se sustituyó la esclavitud de los indígenas por la de los afroamericanos,substituted  the slavery of the native for the of the afroamericans
3,INTRO,,FAVOUR,,,,,,,és necessari legalitzar la maternitat subrogada per tal d'evitar la complicitat del nostre país en pràctiques que són moralment reprovables,es necesario legalizar la maternidad subrogada para evitar la complicidad de nuestro país en prácticas que son moralmente reprobables,is necessary to legalise the surrogacy for such to eschew the complicity of our country at practices that are morally reprovables
4,INTRO,,FAVOUR,,,,,,, legalitzar segons el diccionari de cambridge significa permetre una pràctica que havia estat prohibida amb anterioritat ,legalizar según el diccionario de cambridge significa permitir una práctica que había sido prohibida con anterioridad,legalise according to the dictionary of cambridge means to permit a practice that had been prohibited with anteriority
5,INTRO,,FAVOUR,6;16;23,RA,,,,,la nostra línia es divideix en tres arguments diferents,nuestra línea se divide en tres argumentos diferentes,our line divides  at three distinct arguments
6,INTRO,1,FAVOUR,,,,,,,en primer lloc un argument fàctic,en primer lugar un argumento fáctico,in the first place an argument fàctic
7,INTRO,1,FAVOUR,6,RA,,,,,és necessària la legalització de la maternitat subrogada perquè és una realitat permesa de facto en el nostre país ,es necesaria la legalización de la maternidad subrogada porque es una realidad permitida de facto en nuestro país,is necessary the legalisation of the surrogacy so that it is a reality permitted of facto at our country
8,INTRO,1,FAVOUR,6;7,RA,,,,,per entendre si és necessari o no legalitzar aquesta pràctica hem d'entendre com estem a dia d'avui ,para entender si es necesario o no legalizar esta práctica tenemos que entender como estamos a día de hoy,to understand if necessary or not legalising this practice have to understand how are at day of today
9,INTRO,1,FAVOUR,6,RA,,,,,avui segueix en vigor la llei de tècniques de reproducció humana assistida dos mil sis en la qual en el seu article desè es prohibeix expressament la maternitat subrogada,hoy sigue en vigor la ley de técnicas de reproducción humana asistida dos mil seis en la cual en su artículo décimo se prohíbe expresamente la maternidad subrogada,today tracks in force the law of technicians of human reproduction assisted two thousand six at which at his tenth article prohibits  expressly the surrogacy
10,INTRO,1,FAVOUR,,,,,,,no obstant això sí que permet al nostre sistema és inscriure en el registre civil aquells nascuts a l'estranger mitjançant aquest tipus de pràctiques en els països en els quals aquesta pràctica sigui permesa,sin embargo sí que permite a nuestro sistema es inscribir en el registro civil aquellos nacidos en el extranjero mediante este tipo de prácticas en los países en los cuales esta práctica sea permitida,nevertheless aye that it permits at our system is to inscribe at the civil registry those born abroad by means of this type of practices at the countries at which this practice was permitted
11,INTRO,1,FAVOUR,6;10,RA,,,,,això genera un efecte que s'anomena turisme o exili reproductiu,esto genera un efecto que se denomina turismo o exilio reproductivo,this generates an effect that nicknames  tourism or reproductive exile
12,INTRO,1,FAVOUR,6;13;15,RA,,,,, que a la vegada genera dos problemes,que a la vegada genera dos problemas,that at any one time generates two problems
13,INTRO,1,FAVOUR,6;12,RA,,,,,en primer lloc desigualtat dintre del propi país,en primer lugar desigualdad dentro del propio país,in the first place inequality inside of the own country
14,INTRO,1,FAVOUR,6;13,RA,,,,,doncs només aquelles rendes o aquelles famílies amb les rendes més altes poden accedir a aquest tipus de pràctiques ,pues solo aquellas rentas o aquellas familias con las rentas más altas pueden acceder a este tipo de prácticas,then only those rendes or those families with the rendes taller can access at this type of practices
15,INTRO,2,FAVOUR,12,RA,,,,,en segon lloc un altre problema que hem titulat l'absència de control,en segundo lugar otro problema que hemos titulado la ausencia de control,in the second place another problem that have titled the absence of control
16,INTRO,2,FAVOUR,15,MA,,,,,conforma el nostre segon argument que és el nostre argument moral,conforma nuestro segundo argumento que es nuestro argumento moral,conforms our second argument that is our moral argument
17,INTRO,2,FAVOUR,16,RA,,,,,és necessària la legalització de la maternitat subrogada per garantir que respecten els drets humans,es necesaria la legalización de la maternidad subrogada para garantizar que respetan los derechos humanos,is necessary the legalisation of the surrogacy to guarantee that they respect the human laws
18,INTRO,2,FAVOUR,16,RA,,,,,la situació de turisme reproductiu el que genera és que les famílies se'n vagin a l'estranger en països en els quals espanya no té jurisdicció,la situación de turismo reproductivo el que genera es que las familias se vayan al extranjero en países en los cuales espanya no tiene jurisdicción,the situation of reproductive tourism what generates is that the families go  abroad at countries at which espanya does not have jurisdiction
19,INTRO,2,FAVOUR,16;18,RA,,,,,per tant no pot exercir cap tipus de control en el sentit de poder assegurar que les dones no es vegin explotades en aquest tipus de pràctiques,por lo tanto no puede ejercer ningún tipo de control en el sentido de poder asegurar que las mujeres no se vean explotadas en este tipo de prácticas,therefore it can not exert any type of control at the sense to be able to assure that the wives do not view  exploded at this type of practices
20,INTRO,2,FAVOUR,16,RA,,,,,tenint en compte les paraules de l'alt comissionat de les nacions unides pels drets humans es va expressar que el respecte a la dignitat humana és responsabilitat de tots els estats ,teniendo en cuenta las palabras del alto comisionado de las naciones unidas por los derechos humanos se expresó que el respecto a la dignidad humana es responsabilidad de todos los estados,taking into account the words of the tall comissionat of the nations united by the human laws expressed  that the with regard to the human dignity is responsibility of all the states
21,INTRO,2,FAVOUR,16;18;19;20,RA,,,,,per tant aquests tenen l'obligació de protegir garantir proactivament aquests drets en el propi país i també arreu del món,por lo tanto estos tienen la obligación de proteger garantizar proactivamente estos derechos en el propio país y también en todo el mundo,therefore these have the debenture to protect guarantee proactivament these laws at the own country and also all over in the world
22,INTRO,2,FAVOUR,16;18;19;20,RA,,,,,mantenint la situació actual a espanya podem veure com no està complint,manteniendo la situación actual a espanya podemos ver como no está cumpliendo,maintaining the ongoing situation at espanya can view like is not conforming
23,INTRO,3,FAVOUR,,,,,,,al nostre tercer argument que és l'argument jurídic,a nuestro tercer argumento que es el argumento jurídico,at our third argument that is the juridical argument
24,INTRO,3,FAVOUR,23,RA,17,MA,,,és necessària legalització per estructurar un procediment que respecti la dignitat de totes les parts implicades en aquest tipus de pràctiques,es necesaria legalización para estructurar un procedimiento que respete la dignidad de todas las partes implicadas en este tipo de prácticas,is necessary legalisation to structure a procedure that respect the dignity of all the parts implied at this type of practices
25,INTRO,3,FAVOUR,23,RA,,,,,la situació actual no és sostenible ,la situación actual no es sostenible,the ongoing situation is not sustainable
26,INTRO,3,FAVOUR,23,RA,,,,,ens trobem en una situació d'esquizofrènia legislativa,nos encontramos en una situación de esquizofrenia legislativa,find us at a situation of legislative schizophrenia
27,INTRO,3,FAVOUR,23,RA,,,,,des d'una banda tenim una prohibició,desde una banda tenemos una prohibición,since a band have a ban
28,INTRO,1;3,FAVOUR,23,RA,,,,,des de l'altra banda es permet la inscripció al registre civil de nens nascuts a l'estranger,desde la otra banda se permite la inscripción al registro civil de niños nacidos a la extranjero,since the other band permits  the inscription at the civil registry of boys been born abroad
29,INTRO,1;3,FAVOUR,23,RA,,,,,és a dir en una situació en què està permesa de facto ,es decir en una situación en que está permitida de facto,that is to say at a situation at what is permitted of facto
30,INTRO,3,FAVOUR,23,RA,17;24,MA,,,hem de legalitzar un procediment en el qual les garanties de totes les parts implicades es vegin satisfetes,tenemos que legalizar un procedimiento en el cual las garantías de todas las partes implicadas se vean satisfechas,have to legalise a procedure at which the guarantees of all the parts implied view  satisfied
31,INTRO,3,FAVOUR,1;23,RA,,,,,la corona espanyola va decidir deixar d'esclavitzar els indígenes per protegir els seus drets,la corona española decidió dejar de esclavizar los indígenas para proteger sus derechos,the Spanish crown decided to let to enslave the native to protect his laws
32,INTRO,3,FAVOUR,23;31,RA,,,,,és que el mateix és el que està passant amb la maternitat subrogada,es que el mismo es el que está pasando con la maternidad subrogada,is that the same is what is passing with the surrogacy
33,INTRO,3,FAVOUR,17,RA,,,,,estem prohibint la maternitat subrogada dintre el nostre país però estem permetent que això es doni a terme a l'estranger ,estamos prohibiendo la maternidad subrogada dentro nuestro país pero estamos permitiendo que esto se dé a término a la extranjero,are prohibiting the surrogacy inside our country but are permitting that this give  at term abroad
34,INTRO,3,FAVOUR,24;25;26;27;28;29;30;32;33,RA,17;24;30,MA,,,per tal d'acabar amb aquesta situació hem de legalitzar aquesta pràctica per garantir que els drets de totes les dones es vegin satisfets ,para acabar con esta situación tenemos que legalizar esta práctica para garantizar que los derechos de todas las mujeres se vean satisfechos,for such to end with this situation have to legalise this practice to guarantee that the laws of all the wives view  satisfied
35,INTRO,3,FAVOUR,3;34,RA,,,,,en cas contrari seguirem sent còmplices de pràctiques que són moralment reprovables ,en caso contrario seguiremos siendo cómplices de prácticas que son moralmente reprobables,at contrary case will track being accomplices of practices that are morally reprovables
36,INTRO,,AGAINST,,,,,,,no és desacceleració econòmica ,no es desaceleración económica,is not economic deceleration
37,INTRO,,AGAINST,36,CA,,,,,és una crisi,es una crisis,is a crisis
38,INTRO,,AGAINST,,,,,,,no estem parlant de la reducció de plantilla ,no estamos hablando de la reducción de plantilla,are not talking of the cut of team
39,INTRO,,AGAINST,38,CA,,,,,estem parlant de l'acomiadament,estamos hablando del despido,are talking of the dismissal
40,INTRO,,AGAINST,,,,,,,no es produeixen danys col·laterals ,no se producen daños colaterales,do not produce  collateral harms
41,INTRO,,AGAINST,40,CA,,,,,es produeixen víctimes civils,se producen víctimas civiles,produce  civil victims
42,INTRO,,AGAINST,,,,,,,no estem parlant de gestació subrogada,no estamos hablando de gestación subrogada,are not talking of surrogacy
43,INTRO,,AGAINST,42,CA,,,,,estem parlant de ventres de lloguer,estamos hablando de vientres de alquiler,are talking of bellies for hire
44,INTRO,,AGAINST,36;37;38;39;40;41;42;43,RA,,,,,vivim en el temps del maquillatge i amb les paraules intentem naturalitzar una realitat que ens neguem a anomenar ,vivimos en el tiempo del maquillaje y con las palabras intentamos naturalizar una realidad que nos negamos a denominar,live at the time of the make-up and with the words attempt to naturalise a reality that deny us at nicknaming
45,INTRO,,AGAINST,17;34,CA,,,,,però nosaltres serem valents i demostrarem com la gestació subrogada vulnera clarament els drets i les llibertats fonamentals ,pero nosotros seremos valientes y demostraremos como la gestación subrogada vulnera claramente los derechos y las libertades fundamentales,but we will be lion-hearted and will evidence like the surrogacy vulnera clearly the laws and the fundamental liberties
46,INTRO,,AGAINST,45,RA,,,,,no només de la mare gestant ,no solo de la madre gestante,no only of the mother gestant
47,INTRO,,AGAINST,46,RA,,,,,sinó també del menor,sino también del menor,but also of the minor
48,INTRO,,AGAINST,3,CA,,,,,no s'hauria de legalitzar la gestació subrogada,no se tendría que legalizar la gestación subrogada,would not have to  legalise the surrogacy
49,INTRO,,AGAINST,50;51;52,RA,,,,,ho pensem fer mitjançant tres sòlids arguments,lo pensamos hacer mediante tres sólidos argumentos,think it make by means of three solid arguments
50,INTRO,1,AGAINST,45,RA,,,,,el primer l'objectivització i la mercantilització que es produeix tant la mare gestant com el menor,lo primero el objectivització y la mercantilización que se produce tanto la madre gestante como el menor,the first the objectivització and the mercantilització that it produces  so much the mother gestant like the minor
51,INTRO,2,AGAINST,,,,,,,el segon el cavall de troia en referència a les màfies ,el segundo el caballo de troia en referencia a las mafias,the second the horse of troia at reference at the mafias
52,INTRO,3,AGAINST,,,,,,,el tercer a l'efecte rebot que es produiria al legalitzar aquesta pràctica ,lo tercero al efecto rebote que se produciría al legalizar esta práctica,the third at the effect rebound that would produce  at the legalise this practice
53,INTRO,,AGAINST,,,,,,,entenem per maternitat subrogada segons l'informe warnock una pràctica mitjançant la qual una dona gesta o porta al seu ventre un nen per una altra dona amb la intenció d'entregar-li després de néixer ,entendemos por maternidad subrogada según el informe warnock una práctica mediante la cual una mujer gesta o puerta a su vientre un niño por otra mujer con la intención de entregarle después de nacer,understand for surrogacy as the report warnock a practice by means of which a wife feat or door at his belly a boy for another wife with the intent to hand him after being born
54,INTRO,1,AGAINST,53,RA,,,,,per tant una dona està llogant el seu propi ventre,por lo tanto una mujer está alquilando su propio vientre,therefore a wife is renting his own belly
55,INTRO,1,AGAINST,,,,,,,algo totalment inacceptable ,algo totalmente inaceptable,algo totally unacceptable
56,INTRO,1,AGAINST,4,CA,,,,,legalitzar vol dir donar estat legal a una cosa ,legalizar quiere decir dar estado legal a una cosa,legalise means to give legal state at a thing
57,INTRO,1,AGAINST,44;50,RA,,,,,no volem maquillar una pràctica que atempta contra tots els principis generals,no queremos maquillar una práctica que atenta contra todos los principios generales,do not blast maquillar a practice that attacks against all the general principles
58,INTRO,3,AGAINST,,,,,,,a espanya al nostre país d'acord amb la llei catorze dos mil sis concretament l'article deu es declaren nuls de ple drets tots els contractes de gestació subrogada,a espanya en nuestro país de acuerdo con la ley catorce dos mil seis concretamente el artículo diez se declaran nulos de pleno derechos todos los contratos de gestación subrogada,at espanya at our country of chord with the law fourteen two thousand six concretely the article ten declare  null of full laws all the agreements of surrogacy
59,INTRO,1,AGAINST,46;47,RA,45,MA,,,perquè aquests contractes vulneren clarament els drets i les llibertats fonamentals no només de la mare gestant sinó també del menor en tant que se'ls objectivitza es cosifiquen i es quantifica trobant a les persones un ús,porque estos contratos vulneran claramente los derechos y las libertades fundamentales no solo de la madre gestante sino también del menor en cuanto que se los objectivitza se cosifiquen y se cuantifica encontrando a las personas un uso,so that these agreements vulneren clearly the laws and the fundamental liberties no only of the mother gestant but also of the minor at so much that  the ones objectivitza  cosifiquen and quantifies  finding at the persons an use
60,INTRO,1,AGAINST,48,RA,4;17;24;34,CA,,,defensem un clar i rotund no davant de si s'hauria de legalitzar la maternitat subrogada ,defendemos un claro y rotundo no ante si se tendría que legalizar la maternidad subrogada,defend a clear and rotund no in front of if would have to legalise  the surrogacy
61,INTRO,1,AGAINST,50,RA,,,,,hi ha una mercantilització i l'objectivització de la mare gestant perquè en tant que s'utilitza el nen com un objecte de compravenda el que significa que estem mercantilitzant amb una vida humana ,hay una mercantilización y la objectivització de la madre gestante porque en cuanto que se utiliza el niño como un objeto de compraventa el que significa que estamos mercantilizando con una vida humana,there is a mercantilització and the objectivització of the mother gestant so that at so much that utilises  the boy like an object of compravenda what means that we are mercantilitzant with a human life
62,INTRO,1,AGAINST,61,MA,,,,,diem que hi ha un objectivització de la mare gestant perquè s'utilitza la mare com a objecte per aconseguir el fi del contracte en tant que haurà d'estar obligada durant nou mesos a complir una sèrie de condicions i renunciar a aquest fill,decimos que hay un objectivització de la madre gestante porque se utiliza la madre como objeto para conseguir el fin del contrato en cuanto que tendrá que estar obligada durante nueve meses a cumplir una serie de condiciones y renunciar a este hijo,say that there is an objectivització of the mother gestant so that it utilises  the mother as a object to achieve the end of the agreement at so much that will have to be obliged during nine months at conforming a series of conditions and renounce at this son
63,INTRO,1,AGAINST,,,,,,,per tant s'anul·la l'autonomia de la voluntat de la dona i es tracta d'una esclavitud encoberta ,por lo tanto se anula la autonomía de la voluntad de la mujer y se trata de una esclavitud encubierta,therefore it annuls  the autonomy of the will of the wife and treats  of a slavery concealed
64,INTRO,2,AGAINST,51,RA,,,,,hem utilitzat la metàfora el cavall de troia perquè la legalització de la indústria dels ventres de lloguer no facilita el seu control ,hemos utilizado la metáfora el caballo de troia porque la legalización de la industria de los vientres de alquiler no facilita su control,have utilised the metaphor the horse of troia so that the legalisation of the industry of the bellies for hire does not facilitate his control
65,INTRO,2,AGAINST,64,RA,,,,,sinó tot el contrari ,sino todo el contrario,but all the opposite
66,INTRO,2,AGAINST,51;64,RA,,,,,expandeix la introducció de màfies que s'aprofitarien d'aquesta cobertura legal i la manca de recursos per part de l'administració per vulnerar els drets inherents als ventres de lloguer ,expande la introducción de mafias que se aprovecharían de esta cobertura legal y la carencia de recursos por parte de la administración para vulnerar los derechos inherentes a los vientres de alquiler,expands the introduction of mafias that would take advantage of  of this legal coverage and the lack of resources for part of the administration for vulnerar the inherent laws at the bellies for hire
67,INTRO,2,AGAINST,52,RA,,,,,l'efecte rebot que es produiria al legalitzar aquesta pràctica en tant que legalitzar no augmentaria la demanda i l'oferta seguiria estant igual,el efecto rebote que se produciría al legalizar esta práctica en cuanto que legalizar no aumentaría la demanda y la oferta seguiría estando igual,the effect rebound that would produce  at the legalise this practice at so much that legalise would not augment the demand and the offer would track being the same
68,INTRO,2,AGAINST,,,,,,,aquesta contraposició faria que molta gent s'anés a altres països a fer aquesta pràctica ,esta contraposición haría que mucha gente se fuera a otros países a hacer esta práctica,this comparison would make that a lot of persons went  at other countries at making this practice
69,INTRO,2,AGAINST,45;46;47;59,RA,,,,,d'aquesta manera no podríem assegurar els drets i les llibertats fonamentals de les parts implicades ,de este modo no podríamos asegurar los derechos y las libertades fundamentales de las partes implicadas,in this way could not assure the laws and the fundamental liberties of the parts implied
70,INTRO,1,AGAINST,45;46;47;50;61;62,RA,,,,,per tant és per l'objectivització de la mare gestant i del menor ,por lo tanto es por la objectivització de la madre gestante y del menor,therefore it is for the objectivització of the mother gestant and of the minor
71,INTRO,2,AGAINST,51;64;66,MA,,,,,per el cavall de troia respecte a les màfies,por el caballo de troia respecto a las mafias,for the horse of troia with regard to the mafias
72,INTRO,3,AGAINST,52,MA,,,,,l'efecte rebot que es produiria legalitzar aquesta pràctica,el efecto rebote que se produciría legalizar esta práctica,the effect rebound that would produce  legalise this practice
73,INTRO,3,AGAINST,44;48;57;60,RA,7;29,MA,,,la realitat de la gestació subrogada ja és present i hem de prendre una decisió,la realidad de la gestación subrogada ya es presente y tenemos que tomar una decisión,the reality of the surrogacy already is present and have to take a decision
74,INTRO,3,AGAINST,48;60,RA,4;17;24;30;34,CA,,,la decisió de protegir-los contra aquesta amenaça de dir no a la legalització de la gestació subrogada,la decisión de protegerlos contra esta amenaza de decir no a la legalización de la gestación subrogada,the decision to protect them against this threat to say no at the legalisation of the surrogacy
75,INTRO,3,AGAINST,,,,,,,no defensem el que en tant que l'objecte,no defendemos el que en cuanto que lo objete,do not defend what at so much that the object
76,INTRO,3,AGAINST,75,RA,,,,,sinó que defensem el qui davant de la persona,sino que defendemos quien ante la persona,but that defend the one who in front of the person
77,ARG1,1,FAVOUR,59,MA,,,,,l'objectivització i mercantilització tant del nen com de la dona,la objectivització y mercantilización tanto del niño como de la mujer,the objectivització and mercantilització so much of the boy like of the wife
78,ARG1,1,FAVOUR,79;84,RA,,,,,enfoquen aquest argument a dos factors,enfocan este argumento a dos factores,focus this argument at two factors
79,ARG1,1,FAVOUR,,,,,,, en primer lloc la possible desprotecció del nen com a objecte de comerç,en primer lugar la posible desprotección del niño como objeto de comercio,in the first place the possible desprotecció of the boy as a object of trade
80,ARG1,1,FAVOUR,,,,,,,cosa que ja és impossible actualment com així ha demostrat el tribunal de drets humans de la unió europea en les seves diferents sentències,cosa que ya es imposible actualmente como así ha demostrado el tribunal de derechos humanos de la unión europea en sus diferentes sentencias,thing that already is impossible at present like like this has evidenced the tribunal of right humans of the European union at his distinct sentences
81,ARG1,1,FAVOUR,79;80,RA,,,,,el nen per protegir-lo justament el que s'ha de fer és inscriure'l a espanya i garantir tots els seus drets mitjançant els tribunals espanyols,el niño para protegerlo justamente el que se tiene que hacer es inscribirlo a espanya y garantizar todos sus derechos mediante los tribunales españoles,the boy to protect it justly what has to make  is to inscribe it at espanya and guarantee all his laws by means of the Spanish tribunals
